test/tvm_script/json/softmax.json
{"i": [["[\"softmax_layer\", 128, 1, 1000]", "cuda -keys=cuda,gpu -arch=sm_70 -max_num_threads=1024 -thread_warp_size=32", [-1, 16, 64, 49152, 2147483647, 1024, 8, 32], "", 0, []], [[], [["SP", 4, 2, 1000, [40], 1], ["AN", 4, 3, 6], ["FSP", 3, 2, 0, 1], ["AN", 3, 3, 6], ["CA", 3, 4, 1], ["CI", 2], ["FU", 4, [0, 1]], ["AN", 4, 0, 5], ["FU", 1, [0, 1]], ["SP", 1, 0, 128, [64], 1], ["AN", 1, 0, 5], ["AN", 1, 1, 6], ["PR", 1, 0, "auto_unroll_max_step$16"], ["PR", 3, 0, "auto_unroll_max_step$0"]]]], "r": [[3.63661e-05], 0, 2.46281, 1699437604], "v": "v0.6"}
{"i": [["[\"softmax_layer\", 128, 1, 1000]", "cuda -keys=cuda,gpu -arch=sm_70 -max_num_threads=1024 -thread_warp_size=32", [-1, 16, 64, 49152, 2147483647, 1024, 8, 32], "", 0, []], [[], [["SP", 4, 2, 1000, [8], 1], ["AN", 4, 3, 6], ["FSP", 3, 2, 0, 1], ["AN", 3, 3, 6], ["CA", 3, 4, 1], ["CI", 2], ["FU", 4, [0, 1]], ["AN", 4, 0, 5], ["FU", 1, [0, 1]], ["SP", 1, 0, 128, [1], 1], ["AN", 1, 0, 5], ["AN", 1, 1, 6], ["PR", 1, 0, "auto_unroll_max_step$0"], ["PR", 3, 0, "auto_unroll_max_step$64"]]]], "r": [[3.34865e-05], 0, 2.29003, 1699437604], "v": "v0.6"}
{"i": [["[\"softmax_layer\", 128, 1, 1000]", "cuda -keys=cuda,gpu -arch=sm_70 -max_num_threads=1024 -thread_warp_size=32", [-1, 16, 64, 49152, 2147483647, 1024, 8, 32], "", 0, []], [[], [["SP", 4, 2, 1000, [2], 1], ["AN", 4, 3, 6], ["FSP", 3, 2, 0, 1], ["AN", 3, 3, 6], ["CA", 3, 4, 1], ["CI", 2], ["FSP", 1, 2, 0, 1], ["AN", 1, 3, 6], ["CA", 1, 4, 1], ["FU", 4, [0, 1]], ["AN", 4, 0, 5], ["PR", 1, 0, "auto_unroll_max_step$16"], ["PR", 3, 0, "auto_unroll_max_step$1024"]]]], "r": [[7.80768e-05], 0, 4.43775, 1699437605], "v": "v0.6"}
{"i": [["[\"softmax_layer\", 128, 1, 1000]", "cuda -keys=cuda,gpu -arch=sm_70 -max_num_threads=1024 -thread_warp_size=32", [-1, 16, 64, 49152, 2147483647, 1024, 8, 32], "", 0, []], [[], [["SP", 4, 2, 1000, [1], 1], ["AN", 4, 3, 6], ["FSP", 3, 2, 0, 1], ["AN", 3, 3, 6], ["CA", 3, 4, 1], ["CI", 2], ["FU", 4, [0, 1]], ["AN", 4, 0, 5], ["FU", 1, [0, 1]], ["SP", 1, 0, 128, [1], 1], ["AN", 1, 0, 5], ["AN", 1, 1, 6], ["PR", 1, 0, "auto_unroll_max_step$1024"], ["PR", 3, 0, "auto_unroll_max_step$0"]]]], "r": [[0.000158399], 0, 2.25457, 1699437605], "v": "v0.6"}
{"i": [["[\"softmax_layer\", 128, 1, 1000]", "cuda -keys=cuda,gpu -arch=sm_70 -max_num_threads=1024 -thread_warp_size=32", [-1, 16, 64, 49152, 2147483647, 1024, 8, 32], "", 0, []], [[], [["CI", 2], ["SP", 1, 2, 1000, [2], 1], ["AN", 1, 3, 6], ["FU", 4, [0, 1, 2]], ["SP", 4, 0, 128000, [64], 1], ["AN", 4, 0, 5], ["AN", 4, 1, 6], ["FU", 3, [0, 1]], ["SP", 3, 0, 128, [16], 1], ["AN", 3, 0, 5], ["AN", 3, 1, 6], ["FU", 1, [0, 1]], ["AN", 1, 0, 5], ["PR", 1, 0, "auto_unroll_max_step$16"], ["PR", 3, 0, "auto_unroll_max_step$16"]]]], "r": [[4.21953e-05], 0, 2.33824, 1699437605], "v": "v0.6"}
{"i": [["[\"softmax_layer\", 128, 1, 1000]", "cuda -keys=cuda,gpu -arch=sm_70 -max_num_threads=1024 -thread_warp_size=32", [-1, 16, 64, 49152, 2147483647, 1024, 8, 32], "", 0, []], [[], [["SP", 4, 2, 1000, [4], 1], ["AN", 4, 3, 6], ["FSP", 3, 2, 0, 1], ["AN", 3, 3, 6], ["CA", 3, 4, 1], ["CI", 2], ["FU", 4, [0, 1]], ["AN", 4, 0, 5], ["FU", 1, [0, 1]], ["SP", 1, 0, 128, [32], 1], ["AN", 1, 0, 5], ["AN", 1, 1, 6], ["PR", 1, 0, "auto_unroll_max_step$1024"], ["PR", 3, 0, "auto_unroll_max_step$64"]]]], "r": [[6.21373e-05], 0, 2.23423, 1699437606], "v": "v0.6"}
{"i": [["[\"softmax_layer\", 128, 1, 1000]", "cuda -keys=cuda,gpu -arch=sm_70 -max_num_threads=1024 -thread_warp_size=32", [-1, 16, 64, 49152, 2147483647, 1024, 8, 32], "", 0, []], [[], [["SP", 4, 2, 1000, [1], 1], ["AN", 4, 3, 6], ["FSP", 3, 2, 0, 1], ["AN", 3, 3, 6], ["CA", 3, 4, 1], ["CI", 2], ["FSP", 1, 2, 0, 1], ["AN", 1, 3, 6], ["CA", 1, 4, 1], ["FU", 4, [0, 1]], ["AN", 4, 0, 5], ["PR", 1, 0, "auto_unroll_max_step$0"], ["PR", 3, 0, "auto_unroll_max_step$0"]]]], "r": [[0.000143509], 0, 2.19654, 1699437606], "v": "v0.6"}
{"i": [["[\"softmax_layer\", 128, 1, 1000]", "cuda -keys=cuda,gpu -arch=sm_70 -max_num_threads=1024 -thread_warp_size=32", [-1, 16, 64, 49152, 2147483647, 1024, 8, 32], "", 0, []], [[], [["CI", 2], ["SP", 1, 2, 1000, [16], 1], ["AN", 1, 3, 6], ["FU", 4, [0, 1, 2]], ["SP", 4, 0, 128000, [32], 1], ["AN", 4, 0, 5], ["AN", 4, 1, 6], ["FU", 3, [0, 1]], ["SP", 3, 0, 128, [32], 1], ["AN", 3, 0, 5], ["AN", 3, 1, 6], ["FU", 1, [0, 1]], ["AN", 1, 0, 5], ["PR", 1, 0, "auto_unroll_max_step$1024"], ["PR", 3, 0, "auto_unroll_max_step$64"]]]], "r": [[4.93646e-05], 0, 2.34785, 1699437606], "v": "v0.6"}
{"i": [["[\"softmax_layer\", 128, 1, 1000]", "cuda -keys=cuda,gpu -arch=sm_70 -max_num_threads=1024 -thread_warp_size=32", [-1, 16, 64, 49152, 2147483647, 1024, 8, 32], "", 0, []], [[], [["SP", 4, 2, 1000, [4], 1], ["AN", 4, 3, 6], ["FSP", 3, 2, 0, 1], ["AN", 3, 3, 6], ["CA", 3, 4, 1], ["CI", 2], ["FSP", 1, 2, 0, 1], ["AN", 1, 3, 6], ["CA", 1, 4, 1], ["FU", 4, [0, 1]], ["AN", 4, 0, 5], ["PR", 1, 0, "auto_unroll_max_step$512"], ["PR", 3, 0, "auto_unroll_max_step$1024"]]]], "r": [[3.91098e-05], 0, 3.49404, 1699437607], "v": "v0.6"}
{"i": [["[\"softmax_layer\", 128, 1, 1000]", "cuda -keys=cuda,gpu -arch=sm_70 -max_num_threads=1024 -thread_warp_size=32", [-1, 16, 64, 49152, 2147483647, 1024, 8, 32], "", 0, []], [[], [["CI", 2], ["FU", 4, [0, 1, 2]], ["SP", 4, 0, 128000, [32], 1], ["AN", 4, 0, 5], ["AN", 4, 1, 6], ["FU", 3, [0, 1]], ["SP", 3, 0, 128, [8], 1], ["AN", 3, 0, 5], ["AN", 3, 1, 6], ["FU", 1, [0, 1]], ["SP", 1, 0, 128, [32], 1], ["AN", 1, 0, 5], ["AN", 1, 1, 6], ["PR", 1, 0, "auto_unroll_max_step$16"], ["PR", 3, 0, "auto_unroll_max_step$64"]]]], "r": [[5.87548e-05], 0, 2.35505, 1699437607], "v": "v0.6"}
{"i": [["[\"softmax_layer\", 128, 1, 1000]", "cuda -keys=cuda,gpu -arch=sm_70 -max_num_threads=1024 -thread_warp_size=32", [-1, 16, 64, 49152, 2147483647, 1024, 8, 32], "", 0, []], [[], [["CI", 2], ["FU", 4, [0, 1, 2]], ["SP", 4, 0, 128000, [2], 1], ["AN", 4, 0, 5], ["AN", 4, 1, 6], ["FU", 3, [0, 1]], ["SP", 3, 0, 128, [4], 1], ["AN", 3, 0, 5], ["AN", 3, 1, 6], ["FU", 1, [0, 1]], ["SP", 1, 0, 128, [32], 1], ["AN", 1, 0, 5], ["AN", 1, 1, 6], ["PR", 1, 0, "auto_unroll_max_step$64"], ["PR", 3, 0, "auto_unroll_max_step$1024"]]]], "r": [[0.000142182], 0, 2.34117, 1699437607], "v": "v0.6"}
{"i": [["[\"softmax_layer\", 128, 1, 1000]", "cuda -keys=cuda,gpu -arch=sm_70 -max_num_threads=1024 -thread_warp_size=32", [-1, 16, 64, 49152, 2147483647, 1024, 8, 32], "", 0, []], [[], [["CI", 2], ["FU", 4, [0, 1, 2]], ["SP", 4, 0, 128000, [2], 1], ["AN", 4, 0, 5], ["AN", 4, 1, 6], ["FU", 3, [0, 1]], ["SP", 3, 0, 128, [32], 1], ["AN", 3, 0, 5], ["AN", 3, 1, 6], ["FU", 1, [0, 1]], ["SP", 1, 0, 128, [32], 1], ["AN", 1, 0, 5], ["AN", 1, 1, 6], ["PR", 1, 0, "auto_unroll_max_step$64"], ["PR", 3, 0, "auto_unroll_max_step$64"]]]], "r": [[0.000152797], 0, 2.30046, 1699437608], "v": "v0.6"}
{"i": [["[\"softmax_layer\", 128, 1, 1000]", "cuda -keys=cuda,gpu -arch=sm_70 -max_num_threads=1024 -thread_warp_size=32", [-1, 16, 64, 49152, 2147483647, 1024, 8, 32], "", 0, []], [[], [["SP", 4, 2, 1000, [1], 1], ["AN", 4, 3, 6], ["FSP", 3, 2, 0, 1], ["AN", 3, 3, 6], ["CA", 3, 4, 1], ["CI", 2], ["FU", 4, [0, 1]], ["AN", 4, 0, 5], ["FU", 1, [0, 1]], ["SP", 1, 0, 128, [1], 1], ["AN", 1, 0, 5], ["AN", 1, 1, 6], ["PR", 1, 0, "auto_unroll_max_step$512"], ["PR", 3, 0, "auto_unroll_max_step$64"]]]], "r": [[0.000158393], 0, 2.26387, 1699437608], "v": "v0.6"}
{"i": [["[\"softmax_layer\", 128, 1, 1000]", "cuda -keys=cuda,gpu -arch=sm_70 -max_num_threads=1024 -thread_warp_size=32", [-1, 16, 64, 49152, 2147483647, 1024, 8, 32], "", 0, []], [[], [["CI", 2], ["FU", 4, [0, 1, 2]], ["SP", 4, 0, 128000, [4], 1], ["AN", 4, 0, 5], ["AN", 4, 1, 6], ["FU", 3, [0, 1]], ["SP", 3, 0, 128, [32], 1], ["AN", 3, 0, 5], ["AN", 3, 1, 6], ["FU", 1, [0, 1]], ["SP", 1, 0, 128, [64], 1], ["AN", 1, 0, 5], ["AN", 1, 1, 6], ["PR", 1, 0, "auto_unroll_max_step$0"], ["PR", 3, 0, "auto_unroll_max_step$16"]]]], "r": [[0.000112342], 0, 2.35087, 1699437609], "v": "v0.6"}
{"i": [["[\"softmax_layer\", 128, 1, 1000]", "cuda -keys=cuda,gpu -arch=sm_70 -max_num_threads=1024 -thread_warp_size=32", [-1, 16, 64, 49152, 2147483647, 1024, 8, 32], "", 0, []], [[], [["CI", 2], ["SP", 1, 2, 1000, [32], 1], ["AN", 1, 3, 6], ["FU", 4, [0, 1, 2]], ["SP", 4, 0, 128000, [32], 1], ["AN", 4, 0, 5], ["AN", 4, 1, 6], ["FU", 3, [0, 1]], ["SP", 3, 0, 128, [32], 1], ["AN", 3, 0, 5], ["AN", 3, 1, 6], ["FU", 1, [0, 1]], ["AN", 1, 0, 5], ["PR", 1, 0, "auto_unroll_max_step$16"], ["PR", 3, 0, "auto_unroll_max_step$64"]]]], "r": [[4.8667e-05], 0, 2.34994, 1699437609], "v": "v0.6"}
{"i": [["[\"softmax_layer\", 128, 1, 1000]", "cuda -keys=cuda,gpu -arch=sm_70 -max_num_threads=1024 -thread_warp_size=32", [-1, 16, 64, 49152, 2147483647, 1024, 8, 32], "", 0, []], [[], [["CI", 2], ["FU", 4, [0, 1, 2]], ["SP", 4, 0, 128000, [32], 1], ["AN", 4, 0, 5], ["AN", 4, 1, 6], ["FU", 3, [0, 1]], ["SP", 3, 0, 128, [32], 1], ["AN", 3, 0, 5], ["AN", 3, 1, 6], ["FU", 1, [0, 1]], ["SP", 1, 0, 128, [64], 1], ["AN", 1, 0, 5], ["AN", 1, 1, 6], ["PR", 1, 0, "auto_unroll_max_step$512"], ["PR", 3, 0, "auto_unroll_max_step$512"]]]], "r": [[7.28572e-05], 0, 2.35612, 1699437609], "v": "v0.6"}
{"i": [["[\"softmax_layer\", 128, 1, 1000]", "cuda -keys=cuda,gpu -arch=sm_70 -max_num_threads=1024 -thread_warp_size=32", [-1, 16, 64, 49152, 2147483647, 1024, 8, 32], "", 0, []], [[], [["SP", 4, 2, 1000, [32], 1], ["AN", 4, 3, 6], ["FSP", 3, 2, 0, 1], ["AN", 3, 3, 6], ["CA", 3, 4, 1], ["CI", 2], ["FU", 4, [0, 1]], ["AN", 4, 0, 5], ["FU", 1, [0, 1]], ["SP", 1, 0, 128, [1], 1], ["AN", 1, 0, 5], ["AN", 1, 1, 6], ["PR", 1, 0, "auto_unroll_max_step$64"], ["PR", 3, 0, "auto_unroll_max_step$512"]]]], "r": [[2.0657e-05], 0, 2.35953, 1699437610], "v": "v0.6"}
{"i": [["[\"softmax_layer\", 128, 1, 1000]", "cuda -keys=cuda,gpu -arch=sm_70 -max_num_threads=1024 -thread_warp_size=32", [-1, 16, 64, 49152, 2147483647, 1024, 8, 32], "", 0, []], [[], [["CI", 2], ["FU", 4, [0, 1, 2]], ["SP", 4, 0, 128000, [16], 1], ["AN", 4, 0, 5], ["AN", 4, 1, 6], ["FU", 3, [0, 1]], ["SP", 3, 0, 128, [32], 1], ["AN", 3, 0, 5], ["AN", 3, 1, 6], ["FU", 1, [0, 1]], ["SP", 1, 0, 128, [32], 1], ["AN", 1, 0, 5], ["AN", 1, 1, 6], ["PR", 1, 0, "auto_unroll_max_step$512"], ["PR", 3, 0, "auto_unroll_max_step$1024"]]]], "r": [[7.38171e-05], 0, 2.3233, 1699437610], "v": "v0.6"}
{"i": [["[\"softmax_layer\", 128, 1, 1000]", "cuda -keys=cuda,gpu -arch=sm_70 -max_num_threads=1024 -thread_warp_size=32", [-1, 16, 64, 49152, 2147483647, 1024, 8, 32], "", 0, []], [[], [["SP", 4, 2, 1000, [32], 1], ["AN", 4, 3, 6], ["FSP", 3, 2, 0, 1], ["AN", 3, 3, 6], ["CA", 3, 4, 1], ["CI", 2], ["FU", 4, [0, 1]], ["AN", 4, 0, 5], ["FU", 1, [0, 1]], ["SP", 1, 0, 128, [8], 1], ["AN", 1, 0, 5], ["AN", 1, 1, 6], ["PR", 1, 0, "auto_unroll_max_step$0"], ["PR", 3, 0, "auto_unroll_max_step$0"]]]], "r": [[2.70074e-05], 0, 2.24218, 1699437610], "v": "v0.6"}
{"i": [["[\"softmax_layer\", 128, 1, 1000]", "cuda -keys=cuda,gpu -arch=sm_70 -max_num_threads=1024 -thread_warp_size=32", [-1, 16, 64, 49152, 2147483647, 1024, 8, 32], "", 0, []], [[], [["CI", 2], ["SP", 1, 2, 1000, [4], 1], ["AN", 1, 3, 6], ["FU", 4, [0, 1, 2]], ["SP", 4, 0, 128000, [32], 1], ["AN", 4, 0, 5], ["AN", 4, 1, 6], ["FU", 3, [0, 1]], ["SP", 3, 0, 128, [2], 1], ["AN", 3, 0, 5], ["AN", 3, 1, 6], ["FU", 1, [0, 1]], ["AN", 1, 0, 5], ["PR", 1, 0, "auto_unroll_max_step$1024"], ["PR", 3, 0, "auto_unroll_max_step$512"]]]], "r": [[3.86816e-05], 0, 2.28581, 1699437611], "v": "v0.6"}
{"i": [["[\"softmax_layer\", 128, 1, 1000]", "cuda -keys=cuda,gpu -arch=sm_70 -max_num_threads=1024 -thread_warp_size=32", [-1, 16, 64, 49152, 2147483647, 1024, 8, 32], "", 0, []], [[], [["CI", 2], ["FU", 4, [0, 1, 2]], ["SP", 4, 0, 128000, [32], 1], ["AN", 4, 0, 5], ["AN", 4, 1, 6], ["FU", 3, [0, 1]], ["SP", 3, 0, 128, [32], 1], ["AN", 3, 0, 5], ["AN", 3, 1, 6], ["FU", 1, [0, 1]], ["SP", 1, 0, 128, [32], 1], ["AN", 1, 0, 5], ["AN", 1, 1, 6], ["PR", 1, 0, "auto_unroll_max_step$64"], ["PR", 3, 0, "auto_unroll_max_step$64"]]]], "r": [[6.82281e-05], 0, 2.33817, 1699437611], "v": "v0.6"}
{"i": [["[\"softmax_layer\", 128, 1, 1000]", "cuda -keys=cuda,gpu -arch=sm_70 -max_num_threads=1024 -thread_warp_size=32", [-1, 16, 64, 49152, 2147483647, 1024, 8, 32], "", 0, []], [[], [["CI", 2], ["FU", 4, [0, 1, 2]], ["SP", 4, 0, 128000, [20], 1], ["AN", 4, 0, 5], ["AN", 4, 1, 6], ["FU", 3, [0, 1]], ["SP", 3, 0, 128, [64], 1], ["AN", 3, 0, 5], ["AN", 3, 1, 6], ["FU", 1, [0, 1]], ["SP", 1, 0, 128, [32], 1], ["AN", 1, 0, 5], ["AN", 1, 1, 6], ["PR", 1, 0, "auto_unroll_max_step$1024"], ["PR", 3, 0, "auto_unroll_max_step$0"]]]], "r": [[7.32516e-05], 0, 2.29058, 1699437611], "v": "v0.6"}
{"i": [["[\"softmax_layer\", 128, 1, 1000]", "cuda -keys=cuda,gpu -arch=sm_70 -max_num_threads=1024 -thread_warp_size=32", [-1, 16, 64, 49152, 2147483647, 1024, 8, 32], "", 0, []], [[], [["CI", 2], ["SP", 1, 2, 1000, [32], 1], ["AN", 1, 3, 6], ["FU", 4, [0, 1, 2]], ["SP", 4, 0, 128000, [64], 1], ["AN", 4, 0, 5], ["AN", 4, 1, 6], ["FU", 3, [0, 1]], ["SP", 3, 0, 128, [64], 1], ["AN", 3, 0, 5], ["AN", 3, 1, 6], ["FU", 1, [0, 1]], ["AN", 1, 0, 5], ["PR", 1, 0, "auto_unroll_max_step$64"], ["PR", 3, 0, "auto_unroll_max_step$16"]]]], "r": [[4.75363e-05], 0, 2.32499, 1699437612], "v": "v0.6"}
{"i": [["[\"softmax_layer\", 128, 1, 1000]", "cuda -keys=cuda,gpu -arch=sm_70 -max_num_threads=1024 -thread_warp_size=32", [-1, 16, 64, 49152, 2147483647, 1024, 8, 32], "", 0, []], [[], [["CI", 2], ["SP", 1, 2, 1000, [8], 1], ["AN", 1, 3, 6], ["FU", 4, [0, 1, 2]], ["SP", 4, 0, 128000, [32], 1], ["AN", 4, 0, 5], ["AN", 4, 1, 6], ["FU", 3, [0, 1]], ["SP", 3, 0, 128, [32], 1], ["AN", 3, 0, 5], ["AN", 3, 1, 6], ["FU", 1, [0, 1]], ["AN", 1, 0, 5], ["PR", 1, 0, "auto_unroll_max_step$1024"], ["PR", 3, 0, "auto_unroll_max_step$64"]]]], "r": [[4.86703e-05], 0, 2.34042, 1699437612], "v": "v0.6"}
{"i": [["[\"softmax_layer\", 128, 1, 1000]", "cuda -keys=cuda,gpu -arch=sm_70 -max_num_threads=1024 -thread_warp_size=32", [-1, 16, 64, 49152, 2147483647, 1024, 8, 32], "", 0, []], [[], [["SP", 4, 2, 1000, [10], 1], ["AN", 4, 3, 6], ["FSP", 3, 2, 0, 1], ["AN", 3, 3, 6], ["CA", 3, 4, 1], ["CI", 2], ["FSP", 1, 2, 0, 1], ["AN", 1, 3, 6], ["CA", 1, 4, 1], ["FU", 4, [0, 1]], ["AN", 4, 0, 5], ["PR", 1, 0, "auto_unroll_max_step$512"], ["PR", 3, 0, "auto_unroll_max_step$512"]]]], "r": [[1.70273e-05], 0, 2.67324, 1699437612], "v": "v0.6"}
{"i": [["[\"softmax_layer\", 128, 1, 1000]", "cuda -keys=cuda,gpu -arch=sm_70 -max_num_threads=1024 -thread_warp_size=32", [-1, 16, 64, 49152, 2147483647, 1024, 8, 32], "", 0, []], [[], [["CI", 2], ["SP", 1, 2, 1000, [32], 1], ["AN", 1, 3, 6], ["FU", 4, [0, 1, 2]], ["SP", 4, 0, 128000, [32], 1], ["AN", 4, 0, 5], ["AN", 4, 1, 6], ["FU", 3, [0, 1]], ["SP", 3, 0, 128, [64], 1], ["AN", 3, 0, 5], ["AN", 3, 1, 6], ["FU", 1, [0, 1]], ["AN", 1, 0, 5], ["PR", 1, 0, "auto_unroll_max_step$64"], ["PR", 3, 0, "auto_unroll_max_step$64"]]]], "r": [[5.03693e-05], 0, 2.38299, 1699437613], "v": "v0.6"}
{"i": [["[\"softmax_layer\", 128, 1, 1000]", "cuda -keys=cuda,gpu -arch=sm_70 -max_num_threads=1024 -thread_warp_size=32", [-1, 16, 64, 49152, 2147483647, 1024, 8, 32], "", 0, []], [[], [["CI", 2], ["SP", 1, 2, 1000, [32], 1], ["AN", 1, 3, 6], ["FU", 4, [0, 1, 2]], ["SP", 4, 0, 128000, [64], 1], ["AN", 4, 0, 5], ["AN", 4, 1, 6], ["FU", 3, [0, 1]], ["SP", 3, 0, 128, [1], 1], ["AN", 3, 0, 5], ["AN", 3, 1, 6], ["FU", 1, [0, 1]], ["AN", 1, 0, 5], ["PR", 1, 0, "auto_unroll_max_step$0"], ["PR", 3, 0, "auto_unroll_max_step$0"]]]], "r": [[3.48445e-05], 0, 2.28409, 1699437613], "v": "v0.6"}
{"i": [["[\"softmax_layer\", 128, 1, 1000]", "cuda -keys=cuda,gpu -arch=sm_70 -max_num_threads=1024 -thread_warp_size=32", [-1, 16, 64, 49152, 2147483647, 1024, 8, 32], "", 0, []], [[], [["SP", 4, 2, 1000, [32], 1], ["AN", 4, 3, 6], ["FSP", 3, 2, 0, 1], ["AN", 3, 3, 6], ["CA", 3, 4, 1], ["CI", 2], ["FU", 4, [0, 1]], ["AN", 4, 0, 5], ["FU", 1, [0, 1]], ["SP", 1, 0, 128, [1], 1], ["AN", 1, 0, 5], ["AN", 1, 1, 6], ["PR", 1, 0, "auto_unroll_max_step$0"], ["PR", 3, 0, "auto_unroll_max_step$512"]]]], "r": [[2.06732e-05], 0, 2.30135, 1699437613], "v": "v0.6"}
{"i": [["[\"softmax_layer\", 128, 1, 1000]", "cuda -keys=cuda,gpu -arch=sm_70 -max_num_threads=1024 -thread_warp_size=32", [-1, 16, 64, 49152, 2147483647, 1024, 8, 32], "", 0, []], [[], [["SP", 4, 2, 1000, [50], 1], ["AN", 4, 3, 6], ["FSP", 3, 2, 0, 1], ["AN", 3, 3, 6], ["CA", 3, 4, 1], ["CI", 2], ["FSP", 1, 2, 0, 1], ["AN", 1, 3, 6], ["CA", 1, 4, 1], ["FU", 4, [0, 1]], ["AN", 4, 0, 5], ["PR", 1, 0, "auto_unroll_max_step$64"], ["PR", 3, 0, "auto_unroll_max_step$0"]]]], "r": [[5.46113e-06], 0, 2.14539, 1699437614], "v": "v0.6"}
{"i": [["[\"softmax_layer\", 128, 1, 1000]", "cuda -keys=cuda,gpu -arch=sm_70 -max_num_threads=1024 -thread_warp_size=32", [-1, 16, 64, 49152, 2147483647, 1024, 8, 32], "", 0, []], [[], [["SP", 4, 2, 1000, [16], 1], ["AN", 4, 3, 6], ["FSP", 3, 2, 0, 1], ["AN", 3, 3, 6], ["CA", 3, 4, 1], ["CI", 2], ["FU", 4, [0, 1]], ["AN", 4, 0, 5], ["FU", 1, [0, 1]], ["SP", 1, 0, 128, [16], 1], ["AN", 1, 0, 5], ["AN", 1, 1, 6], ["PR", 1, 0, "auto_unroll_max_step$512"], ["PR", 3, 0, "auto_unroll_max_step$512"]]]], "r": [[2.96887e-05], 0, 2.50786, 1699437614], "v": "v0.6"}
{"i": [["[\"softmax_layer\", 128, 1, 1000]", "cuda -keys=cuda,gpu -arch=sm_70 -max_num_threads=1024 -thread_warp_size=32", [-1, 16, 64, 49152, 2147483647, 1024, 8, 32], "", 0, []], [[], [["SP", 4, 2, 1000, [40], 1], ["AN", 4, 3, 6], ["FSP", 3, 2, 0, 1], ["AN", 3, 3, 6], ["CA", 3, 4, 1], ["CI", 2], ["FSP", 1, 2, 0, 1], ["AN", 1, 3, 6], ["CA", 1, 4, 1], ["FU", 4, [0, 1]], ["AN", 4, 0, 5], ["PR", 1, 0, "auto_unroll_max_step$1024"], ["PR", 3, 0, "auto_unroll_max_step$1024"]]]], "r": [[6.23976e-06], 0, 2.19688, 1699437614], "v": "v0.6"}
{"i": [["[\"softmax_layer\", 128, 1, 1000]", "cuda -keys=cuda,gpu -arch=sm_70 -max_num_threads=1024 -thread_warp_size=32", [-1, 16, 64, 49152, 2147483647, 1024, 8, 32], "", 0, []], [[], [["CI", 2], ["SP", 1, 2, 1000, [32], 1], ["AN", 1, 3, 6], ["FU", 4, [0, 1, 2]], ["SP", 4, 0, 128000, [32], 1], ["AN", 4, 0, 5], ["AN", 4, 1, 6], ["FU", 3, [0, 1]], ["SP", 3, 0, 128, [4], 1], ["AN", 3, 0, 5], ["AN", 3, 1, 6], ["FU", 1, [0, 1]], ["AN", 1, 0, 5], ["PR", 1, 0, "auto_unroll_max_step$64"], ["PR", 3, 0, "auto_unroll_max_step$16"]]]], "r": [[3.79337e-05], 0, 2.32447, 1699437615], "v": "v0.6"}
{"i": [["[\"softmax_layer\", 128, 1, 1000]", "cuda -keys=cuda,gpu -arch=sm_70 -max_num_threads=1024 -thread_warp_size=32", [-1, 16, 64, 49152, 2147483647, 1024, 8, 32], "", 0, []], [[], [["CI", 2], ["SP", 1, 2, 1000, [32], 1], ["AN", 1, 3, 6], ["FU", 4, [0, 1, 2]], ["SP", 4, 0, 128000, [4], 1], ["AN", 4, 0, 5], ["AN", 4, 1, 6], ["FU", 3, [0, 1]], ["SP", 3, 0, 128, [8], 1], ["AN", 3, 0, 5], ["AN", 3, 1, 6], ["FU", 1, [0, 1]], ["AN", 1, 0, 5], ["PR", 1, 0, "auto_unroll_max_step$1024"], ["PR", 3, 0, "auto_unroll_max_step$16"]]]], "r": [[7.87109e-05], 0, 2.38901, 1699437615], "v": "v0.6"}
{"i": [["[\"softmax_layer\", 128, 1, 1000]", "cuda -keys=cuda,gpu -arch=sm_70 -max_num_threads=1024 -thread_warp_size=32", [-1, 16, 64, 49152, 2147483647, 1024, 8, 32], "", 0, []], [[], [["SP", 4, 2, 1000, [2], 1], ["AN", 4, 3, 6], ["FSP", 3, 2, 0, 1], ["AN", 3, 3, 6], ["CA", 3, 4, 1], ["CI", 2], ["FSP", 1, 2, 0, 1], ["AN", 1, 3, 6], ["CA", 1, 4, 1], ["FU", 4, [0, 1]], ["AN", 4, 0, 5], ["PR", 1, 0, "auto_unroll_max_step$512"], ["PR", 3, 0, "auto_unroll_max_step$64"]]]], "r": [[7.56204e-05], 0, 4.18649, 1699437615], "v": "v0.6"}
{"i": [["[\"softmax_layer\", 128, 1, 1000]", "cuda -keys=cuda,gpu -arch=sm_70 -max_num_threads=1024 -thread_warp_size=32", [-1, 16, 64, 49152, 2147483647, 1024, 8, 32], "", 0, []], [[], [["SP", 4, 2, 1000, [1], 1], ["AN", 4, 3, 6], ["FSP", 3, 2, 0, 1], ["AN", 3, 3, 6], ["CA", 3, 4, 1], ["CI", 2], ["FSP", 1, 2, 0, 1], ["AN", 1, 3, 6], ["CA", 1, 4, 1], ["FU", 4, [0, 1]], ["AN", 4, 0, 5], ["PR", 1, 0, "auto_unroll_max_step$512"], ["PR", 3, 0, "auto_unroll_max_step$64"]]]], "r": [[0.000143508], 0, 2.19563, 1699437616], "v": "v0.6"}
{"i": [["[\"softmax_layer\", 128, 1, 1000]", "cuda -keys=cuda,gpu -arch=sm_70 -max_num_threads=1024 -thread_warp_size=32", [-1, 16, 64, 49152, 2147483647, 1024, 8, 32], "", 0, []], [[], [["CI", 2], ["FU", 4, [0, 1, 2]], ["SP", 4, 0, 128000, [32], 1], ["AN", 4, 0, 5], ["AN", 4, 1, 6], ["FU", 3, [0, 1]], ["SP", 3, 0, 128, [32], 1], ["AN", 3, 0, 5], ["AN", 3, 1, 6], ["FU", 1, [0, 1]], ["SP", 1, 0, 128, [8], 1], ["AN", 1, 0, 5], ["AN", 1, 1, 6], ["PR", 1, 0, "auto_unroll_max_step$64"], ["PR", 3, 0, "auto_unroll_max_step$16"]]]], "r": [[5.93732e-05], 0, 2.32776, 1699437616], "v": "v0.6"}
{"i": [["[\"softmax_layer\", 128, 1, 1000]", "cuda -keys=cuda,gpu -arch=sm_70 -max_num_threads=1024 -thread_warp_size=32", [-1, 16, 64, 49152, 2147483647, 1024, 8, 32], "", 0, []], [[], [["CI", 2], ["SP", 1, 2, 1000, [32], 1], ["AN", 1, 3, 6], ["FU", 4, [0, 1, 2]], ["SP", 4, 0, 128000, [1], 1], ["AN", 4, 0, 5], ["AN", 4, 1, 6], ["FU", 3, [0, 1]], ["SP", 3, 0, 128, [32], 1], ["AN", 3, 0, 5], ["AN", 3, 1, 6], ["FU", 1, [0, 1]], ["AN", 1, 0, 5], ["PR", 1, 0, "auto_unroll_max_step$16"], ["PR", 3, 0, "auto_unroll_max_step$0"]]]], "r": [[0.000223546], 0, 2.41277, 1699437616], "v": "v0.6"}
{"i": [["[\"softmax_layer\", 128, 1, 1000]", "cuda -keys=cuda,gpu -arch=sm_70 -max_num_threads=1024 -thread_warp_size=32", [-1, 16, 64, 49152, 2147483647, 1024, 8, 32], "", 0, []], [[], [["SP", 4, 2, 1000, [8], 1], ["AN", 4, 3, 6], ["FSP", 3, 2, 0, 1], ["AN", 3, 3, 6], ["CA", 3, 4, 1], ["CI", 2], ["FU", 4, [0, 1]], ["AN", 4, 0, 5], ["FU", 1, [0, 1]], ["SP", 1, 0, 128, [8], 1], ["AN", 1, 0, 5], ["AN", 1, 1, 6], ["PR", 1, 0, "auto_unroll_max_step$1024"], ["PR", 3, 0, "auto_unroll_max_step$0"]]]], "r": [[3.40494e-05], 0, 2.34151, 1699437617], "v": "v0.6"}
{"i": [["[\"softmax_layer\", 128, 1, 1000]", "cuda -keys=cuda,gpu -arch=sm_70 -max_num_threads=1024 -thread_warp_size=32", [-1, 16, 64, 49152, 2147483647, 1024, 8, 32], "", 0, []], [[], [["SP", 4, 2, 1000, [4], 1], ["AN", 4, 3, 6], ["FSP", 3, 2, 0, 1], ["AN", 3, 3, 6], ["CA", 3, 4, 1], ["CI", 2], ["FSP", 1, 2, 0, 1], ["AN", 1, 3, 6], ["CA", 1, 4, 1], ["FU", 4, [0, 1]], ["AN", 4, 0, 5], ["PR", 1, 0, "auto_unroll_max_step$512"], ["PR", 3, 0, "auto_unroll_max_step$0"]]]], "r": [[3.86061e-05], 0, 2.95315, 1699437617], "v": "v0.6"}
{"i": [["[\"softmax_layer\", 128, 1, 1000]", "cuda -keys=cuda,gpu -arch=sm_70 -max_num_threads=1024 -thread_warp_size=32", [-1, 16, 64, 49152, 2147483647, 1024, 8, 32], "", 0, []], [[], [["CI", 2], ["FU", 4, [0, 1, 2]], ["SP", 4, 0, 128000, [32], 1], ["AN", 4, 0, 5], ["AN", 4, 1, 6], ["FU", 3, [0, 1]], ["SP", 3, 0, 128, [32], 1], ["AN", 3, 0, 5], ["AN", 3, 1, 6], ["FU", 1, [0, 1]], ["SP", 1, 0, 128, [32], 1], ["AN", 1, 0, 5], ["AN", 1, 1, 6], ["PR", 1, 0, "auto_unroll_max_step$16"], ["PR", 3, 0, "auto_unroll_max_step$0"]]]], "r": [[6.82109e-05], 0, 2.35888, 1699437617], "v": "v0.6"}
{"i": [["[\"softmax_layer\", 128, 1, 1000]", "cuda -keys=cuda,gpu -arch=sm_70 -max_num_threads=1024 -thread_warp_size=32", [-1, 16, 64, 49152, 2147483647, 1024, 8, 32], "", 0, []], [[], [["CI", 2], ["SP", 1, 2, 1000, [2], 1], ["AN", 1, 3, 6], ["FU", 4, [0, 1, 2]], ["SP", 4, 0, 128000, [32], 1], ["AN", 4, 0, 5], ["AN", 4, 1, 6], ["FU", 3, [0, 1]], ["SP", 3, 0, 128, [64], 1], ["AN", 3, 0, 5], ["AN", 3, 1, 6], ["FU", 1, [0, 1]], ["AN", 1, 0, 5], ["PR", 1, 0, "auto_unroll_max_step$0"], ["PR", 3, 0, "auto_unroll_max_step$512"]]]], "r": [[5.29464e-05], 0, 2.30865, 1699437618], "v": "v0.6"}
{"i": [["[\"softmax_layer\", 128, 1, 1000]", "cuda -keys=cuda,gpu -arch=sm_70 -max_num_threads=1024 -thread_warp_size=32", [-1, 16, 64, 49152, 2147483647, 1024, 8, 32], "", 0, []], [[], [["CI", 2], ["FU", 4, [0, 1, 2]], ["SP", 4, 0, 128000, [32], 1], ["AN", 4, 0, 5], ["AN", 4, 1, 6], ["FU", 3, [0, 1]], ["SP", 3, 0, 128, [64], 1], ["AN", 3, 0, 5], ["AN", 3, 1, 6], ["FU", 1, [0, 1]], ["SP", 1, 0, 128, [32], 1], ["AN", 1, 0, 5], ["AN", 1, 1, 6], ["PR", 1, 0, "auto_unroll_max_step$512"], ["PR", 3, 0, "auto_unroll_max_step$64"]]]], "r": [[6.99095e-05], 0, 2.13919, 1699437618], "v": "v0.6"}
{"i": [["[\"softmax_layer\", 128, 1, 1000]", "cuda -keys=cuda,gpu -arch=sm_70 -max_num_threads=1024 -thread_warp_size=32", [-1, 16, 64, 49152, 2147483647, 1024, 8, 32], "", 0, []], [[], [["CI", 2], ["SP", 1, 2, 1000, [8], 1], ["AN", 1, 3, 6], ["FU", 4, [0, 1, 2]], ["SP", 4, 0, 128000, [32], 1], ["AN", 4, 0, 5], ["AN", 4, 1, 6], ["FU", 3, [0, 1]], ["SP", 3, 0, 128, [32], 1], ["AN", 3, 0, 5], ["AN", 3, 1, 6], ["FU", 1, [0, 1]], ["AN", 1, 0, 5], ["PR", 1, 0, "auto_unroll_max_step$64"], ["PR", 3, 0, "auto_unroll_max_step$512"]]]], "r": [[4.86683e-05], 0, 2.09502, 1699437618], "v": "v0.6"}
{"i": [["[\"softmax_layer\", 128, 1, 1000]", "cuda -keys=cuda,gpu -arch=sm_70 -max_num_threads=1024 -thread_warp_size=32", [-1, 16, 64, 49152, 2147483647, 1024, 8, 32], "", 0, []], [[], [["CI", 2], ["FU", 4, [0, 1, 2]], ["SP", 4, 0, 128000, [64], 1], ["AN", 4, 0, 5], ["AN", 4, 1, 6], ["FU", 3, [0, 1]], ["SP", 3, 0, 128, [64], 1], ["AN", 3, 0, 5], ["AN", 3, 1, 6], ["FU", 1, [0, 1]], ["SP", 1, 0, 128, [64], 1], ["AN", 1, 0, 5], ["AN", 1, 1, 6], ["PR", 1, 0, "auto_unroll_max_step$512"], ["PR", 3, 0, "auto_unroll_max_step$512"]]]], "r": [[7.17197e-05], 0, 2.02233, 1699437619], "v": "v0.6"}
{"i": [["[\"softmax_layer\", 128, 1, 1000]", "cuda -keys=cuda,gpu -arch=sm_70 -max_num_threads=1024 -thread_warp_size=32", [-1, 16, 64, 49152, 2147483647, 1024, 8, 32], "", 0, []], [[], [["CI", 2], ["SP", 1, 2, 1000, [5], 1], ["AN", 1, 3, 6], ["FU", 4, [0, 1, 2]], ["SP", 4, 0, 128000, [32], 1], ["AN", 4, 0, 5], ["AN", 4, 1, 6], ["FU", 3, [0, 1]], ["SP", 3, 0, 128, [32], 1], ["AN", 3, 0, 5], ["AN", 3, 1, 6], ["FU", 1, [0, 1]], ["AN", 1, 0, 5], ["PR", 1, 0, "auto_unroll_max_step$16"], ["PR", 3, 0, "auto_unroll_max_step$0"]]]], "r": [[4.91323e-05], 0, 2.26962, 1699437619], "v": "v0.6"}
{"i": [["[\"softmax_layer\", 128, 1, 1000]", "cuda -keys=cuda,gpu -arch=sm_70 -max_num_threads=1024 -thread_warp_size=32", [-1, 16, 64, 49152, 2147483647, 1024, 8, 32], "", 0, []], [[], [["SP", 4, 2, 1000, [1], 1], ["AN", 4, 3, 6], ["FSP", 3, 2, 0, 1], ["AN", 3, 3, 6], ["CA", 3, 4, 1], ["CI", 2], ["FSP", 1, 2, 0, 1], ["AN", 1, 3, 6], ["CA", 1, 4, 1], ["FU", 4, [0, 1]], ["AN", 4, 0, 5], ["PR", 1, 0, "auto_unroll_max_step$64"], ["PR", 3, 0, "auto_unroll_max_step$0"]]]], "r": [[0.000143507], 0, 1.83217, 1699437620], "v": "v0.6"}
{"i": [["[\"softmax_layer\", 128, 1, 1000]", "cuda -keys=cuda,gpu -arch=sm_70 -max_num_threads=1024 -thread_warp_size=32", [-1, 16, 64, 49152, 2147483647, 1024, 8, 32], "", 0, []], [[], [["CI", 2], ["FU", 4, [0, 1, 2]], ["SP", 4, 0, 128000, [32], 1], ["AN", 4, 0, 5], ["AN", 4, 1, 6], ["FU", 3, [0, 1]], ["SP", 3, 0, 128, [1], 1], ["AN", 3, 0, 5], ["AN", 3, 1, 6], ["FU", 1, [0, 1]], ["SP", 1, 0, 128, [64], 1], ["AN", 1, 0, 5], ["AN", 1, 1, 6], ["PR", 1, 0, "auto_unroll_max_step$64"], ["PR", 3, 0, "auto_unroll_max_step$64"]]]], "r": [[6.18907e-05], 0, 1.87321, 1699437620], "v": "v0.6"}
{"i": [["[\"softmax_layer\", 128, 1, 1000]", "cuda -keys=cuda,gpu -arch=sm_70 -max_num_threads=1024 -thread_warp_size=32", [-1, 16, 64, 49152, 2147483647, 1024, 8, 32], "", 0, []], [[], [["CI", 2], ["FU", 4, [0, 1, 2]], ["SP", 4, 0, 128000, [1], 1], ["AN", 4, 0, 5], ["AN", 4, 1, 6], ["FU", 3, [0, 1]], ["SP", 3, 0, 128, [32], 1], ["AN", 3, 0, 5], ["AN", 3, 1, 6], ["FU", 1, [0, 1]], ["SP", 1, 0, 128, [64], 1], ["AN", 1, 0, 5], ["AN", 1, 1, 6], ["PR", 1, 0, "auto_unroll_max_step$64"], ["PR", 3, 0, "auto_unroll_max_step$64"]]]], "r": [[0.000247757], 0, 1.8615, 1699437620], "v": "v0.6"}
{"i": [["[\"softmax_layer\", 128, 1, 1000]", "cuda -keys=cuda,gpu -arch=sm_70 -max_num_threads=1024 -thread_warp_size=32", [-1, 16, 64, 49152, 2147483647, 1024, 8, 32], "", 0, []], [[], [["CI", 2], ["SP", 1, 2, 1000, [20], 1], ["AN", 1, 3, 6], ["FU", 4, [0, 1, 2]], ["SP", 4, 0, 128000, [64], 1], ["AN", 4, 0, 5], ["AN", 4, 1, 6], ["FU", 3, [0, 1]], ["SP", 3, 0, 128, [32], 1], ["AN", 3, 0, 5], ["AN", 3, 1, 6], ["FU", 1, [0, 1]], ["AN", 1, 0, 5], ["PR", 1, 0, "auto_unroll_max_step$512"], ["PR", 3, 0, "auto_unroll_max_step$512"]]]], "r": [[4.55947e-05], 0, 2.13708, 1699437621], "v": "v0.6"}
{"i": [["[\"softmax_layer\", 128, 1, 1000]", "cuda -keys=cuda,gpu -arch=sm_70 -max_num_threads=1024 -thread_warp_size=32", [-1, 16, 64, 49152, 2147483647, 1024, 8, 32], "", 0, []], [[], [["SP", 4, 2, 1000, [4], 1], ["AN", 4, 3, 6], ["FSP", 3, 2, 0, 1], ["AN", 3, 3, 6], ["CA", 3, 4, 1], ["CI", 2], ["FU", 4, [0, 1]], ["AN", 4, 0, 5], ["FU", 1, [0, 1]], ["SP", 1, 0, 128, [64], 1], ["AN", 1, 0, 5], ["AN", 1, 1, 6], ["PR", 1, 0, "auto_unroll_max_step$1024"], ["PR", 3, 0, "auto_unroll_max_step$512"]]]], "r": [[6.55105e-05], 0, 2.83908, 1699437621], "v": "v0.6"}
{"i": [["[\"softmax_layer\", 128, 1, 1000]", "cuda -keys=cuda,gpu -arch=sm_70 -max_num_threads=1024 -thread_warp_size=32", [-1, 16, 64, 49152, 2147483647, 1024, 8, 32], "", 0, []], [[], [["CI", 2], ["SP", 1, 2, 1000, [32], 1], ["AN", 1, 3, 6], ["FU", 4, [0, 1, 2]], ["SP", 4, 0, 128000, [64], 1], ["AN", 4, 0, 5], ["AN", 4, 1, 6], ["FU", 3, [0, 1]], ["SP", 3, 0, 128, [64], 1], ["AN", 3, 0, 5], ["AN", 3, 1, 6], ["FU", 1, [0, 1]], ["AN", 1, 0, 5], ["PR", 1, 0, "auto_unroll_max_step$16"], ["PR", 3, 0, "auto_unroll_max_step$16"]]]], "r": [[4.7532e-05], 0, 2.19525, 1699437621], "v": "v0.6"}
{"i": [["[\"softmax_layer\", 128, 1, 1000]", "cuda -keys=cuda,gpu -arch=sm_70 -max_num_threads=1024 -thread_warp_size=32", [-1, 16, 64, 49152, 2147483647, 1024, 8, 32], "", 0, []], [[], [["SP", 4, 2, 1000, [40], 1], ["AN", 4, 3, 6], ["FSP", 3, 2, 0, 1], ["AN", 3, 3, 6], ["CA", 3, 4, 1], ["CI", 2], ["FSP", 1, 2, 0, 1], ["AN", 1, 3, 6], ["CA", 1, 4, 1], ["FU", 4, [0, 1]], ["AN", 4, 0, 5], ["PR", 1, 0, "auto_unroll_max_step$0"], ["PR", 3, 0, "auto_unroll_max_step$0"]]]], "r": [[6.24616e-06], 0, 1.66729, 1699437622], "v": "v0.6"}
{"i": [["[\"softmax_layer\", 128, 1, 1000]", "cuda -keys=cuda,gpu -arch=sm_70 -max_num_threads=1024 -thread_warp_size=32", [-1, 16, 64, 49152, 2147483647, 1024, 8, 32], "", 0, []], [[], [["CI", 2], ["FU", 4, [0, 1, 2]], ["SP", 4, 0, 128000, [32], 1], ["AN", 4, 0, 5], ["AN", 4, 1, 6], ["FU", 3, [0, 1]], ["SP", 3, 0, 128, [64], 1], ["AN", 3, 0, 5], ["AN", 3, 1, 6], ["FU", 1, [0, 1]], ["SP", 1, 0, 128, [32], 1], ["AN", 1, 0, 5], ["AN", 1, 1, 6], ["PR", 1, 0, "auto_unroll_max_step$0"], ["PR", 3, 0, "auto_unroll_max_step$16"]]]], "r": [[6.99194e-05], 0, 2.14991, 1699437622], "v": "v0.6"}
{"i": [["[\"softmax_layer\", 128, 1, 1000]", "cuda -keys=cuda,gpu -arch=sm_70 -max_num_threads=1024 -thread_warp_size=32", [-1, 16, 64, 49152, 2147483647, 1024, 8, 32], "", 0, []], [[], [["SP", 4, 2, 1000, [4], 1], ["AN", 4, 3, 6], ["FSP", 3, 2, 0, 1], ["AN", 3, 3, 6], ["CA", 3, 4, 1], ["CI", 2], ["FU", 4, [0, 1]], ["AN", 4, 0, 5], ["FU", 1, [0, 1]], ["SP", 1, 0, 128, [64], 1], ["AN", 1, 0, 5], ["AN", 1, 1, 6], ["PR", 1, 0, "auto_unroll_max_step$512"], ["PR", 3, 0, "auto_unroll_max_step$1024"]]]], "r": [[6.55258e-05], 0, 2.50149, 1699437622], "v": "v0.6"}
{"i": [["[\"softmax_layer\", 128, 1, 1000]", "cuda -keys=cuda,gpu -arch=sm_70 -max_num_threads=1024 -thread_warp_size=32", [-1, 16, 64, 49152, 2147483647, 1024, 8, 32], "", 0, []], [[], [["CI", 2], ["FU", 4, [0, 1, 2]], ["SP", 4, 0, 128000, [32], 1], ["AN", 4, 0, 5], ["AN", 4, 1, 6], ["FU", 3, [0, 1]], ["SP", 3, 0, 128, [1], 1], ["AN", 3, 0, 5], ["AN", 3, 1, 6], ["FU", 1, [0, 1]], ["SP", 1, 0, 128, [64], 1], ["AN", 1, 0, 5], ["AN", 1, 1, 6], ["PR", 1, 0, "auto_unroll_max_step$1024"], ["PR", 3, 0, "auto_unroll_max_step$512"]]]], "r": [[6.18861e-05], 0, 2.05583, 1699437623], "v": "v0.6"}
{"i": [["[\"softmax_layer\", 128, 1, 1000]", "cuda -keys=cuda,gpu -arch=sm_70 -max_num_threads=1024 -thread_warp_size=32", [-1, 16, 64, 49152, 2147483647, 1024, 8, 32], "", 0, []], [[], [["CI", 2], ["FU", 4, [0, 1, 2]], ["SP", 4, 0, 128000, [1], 1], ["AN", 4, 0, 5], ["AN", 4, 1, 6], ["FU", 3, [0, 1]], ["SP", 3, 0, 128, [2], 1], ["AN", 3, 0, 5], ["AN", 3, 1, 6], ["FU", 1, [0, 1]], ["SP", 1, 0, 128, [32], 1], ["AN", 1, 0, 5], ["AN", 1, 1, 6], ["PR", 1, 0, "auto_unroll_max_step$1024"], ["PR", 3, 0, "auto_unroll_max_step$64"]]]], "r": [[0.000232038], 0, 1.79487, 1699437623], "v": "v0.6"}
{"i": [["[\"softmax_layer\", 128, 1, 1000]", "cuda -keys=cuda,gpu -arch=sm_70 -max_num_threads=1024 -thread_warp_size=32", [-1, 16, 64, 49152, 2147483647, 1024, 8, 32], "", 0, []], [[], [["SP", 4, 2, 1000, [20], 1], ["AN", 4, 3, 6], ["FSP", 3, 2, 0, 1], ["AN", 3, 3, 6], ["CA", 3, 4, 1], ["CI", 2], ["FSP", 1, 2, 0, 1], ["AN", 1, 3, 6], ["CA", 1, 4, 1], ["FU", 4, [0, 1]], ["AN", 4, 0, 5], ["PR", 1, 0, "auto_unroll_max_step$64"], ["PR", 3, 0, "auto_unroll_max_step$16"]]]], "r": [[9.53075e-06], 0, 1.95079, 1699437623], "v": "v0.6"}
{"i": [["[\"softmax_layer\", 128, 1, 1000]", "cuda -keys=cuda,gpu -arch=sm_70 -max_num_threads=1024 -thread_warp_size=32", [-1, 16, 64, 49152, 2147483647, 1024, 8, 32], "", 0, []], [[], [["SP", 4, 2, 1000, [8], 1], ["AN", 4, 3, 6], ["FSP", 3, 2, 0, 1], ["AN", 3, 3, 6], ["CA", 3, 4, 1], ["CI", 2], ["FU", 4, [0, 1]], ["AN", 4, 0, 5], ["FU", 1, [0, 1]], ["SP", 1, 0, 128, [32], 1], ["AN", 1, 0, 5], ["AN", 1, 1, 6], ["PR", 1, 0, "auto_unroll_max_step$16"], ["PR", 3, 0, "auto_unroll_max_step$64"]]]], "r": [[4.28911e-05], 0, 1.90245, 1699437624], "v": "v0.6"}
{"i": [["[\"softmax_layer\", 128, 1, 1000]", "cuda -keys=cuda,gpu -arch=sm_70 -max_num_threads=1024 -thread_warp_size=32", [-1, 16, 64, 49152, 2147483647, 1024, 8, 32], "", 0, []], [[], [["SP", 4, 2, 1000, [32], 1], ["AN", 4, 3, 6], ["FSP", 3, 2, 0, 1], ["AN", 3, 3, 6], ["CA", 3, 4, 1], ["CI", 2], ["FU", 4, [0, 1]], ["AN", 4, 0, 5], ["FU", 1, [0, 1]], ["SP", 1, 0, 128, [32], 1], ["AN", 1, 0, 5], ["AN", 1, 1, 6], ["PR", 1, 0, "auto_unroll_max_step$1024"], ["PR", 3, 0, "auto_unroll_max_step$64"]]]], "r": [[3.00872e-05], 0, 1.8939, 1699437624], "v": "v0.6"}
{"i": [["[\"softmax_layer\", 128, 1, 1000]", "cuda -keys=cuda,gpu -arch=sm_70 -max_num_threads=1024 -thread_warp_size=32", [-1, 16, 64, 49152, 2147483647, 1024, 8, 32], "", 0, []], [[], [["CI", 2], ["SP", 1, 2, 1000, [32], 1], ["AN", 1, 3, 6], ["FU", 4, [0, 1, 2]], ["SP", 4, 0, 128000, [64], 1], ["AN", 4, 0, 5], ["AN", 4, 1, 6], ["FU", 3, [0, 1]], ["SP", 3, 0, 128, [2], 1], ["AN", 3, 0, 5], ["AN", 3, 1, 6], ["FU", 1, [0, 1]], ["AN", 1, 0, 5], ["PR", 1, 0, "auto_unroll_max_step$512"], ["PR", 3, 0, "auto_unroll_max_step$0"]]]], "r": [[3.47226e-05], 0, 2.06466, 1699437624], "v": "v0.6"}
{"i": [["[\"softmax_layer\", 128, 1, 1000]", "cuda -keys=cuda,gpu -arch=sm_70 -max_num_threads=1024 -thread_warp_size=32", [-1, 16, 64, 49152, 2147483647, 1024, 8, 32], "", 0, []], [[], [["SP", 4, 2, 1000, [4], 1], ["AN", 4, 3, 6], ["FSP", 3, 2, 0, 1], ["AN", 3, 3, 6], ["CA", 3, 4, 1], ["CI", 2], ["FU", 4, [0, 1]], ["AN", 4, 0, 5], ["FU", 1, [0, 1]], ["SP", 1, 0, 128, [32], 1], ["AN", 1, 0, 5], ["AN", 1, 1, 6], ["PR", 1, 0, "auto_unroll_max_step$0"], ["PR", 3, 0, "auto_unroll_max_step$64"]]]], "r": [[6.21511e-05], 0, 1.96739, 1699437625], "v": "v0.6"}
{"i": [["[\"softmax_layer\", 128, 1, 1000]", "cuda -keys=cuda,gpu -arch=sm_70 -max_num_threads=1024 -thread_warp_size=32", [-1, 16, 64, 49152, 2147483647, 1024, 8, 32], "", 0, []], [[], [["CI", 2], ["SP", 1, 2, 1000, [32], 1], ["AN", 1, 3, 6], ["FU", 4, [0, 1, 2]], ["SP", 4, 0, 128000, [32], 1], ["AN", 4, 0, 5], ["AN", 4, 1, 6], ["FU", 3, [0, 1]], ["SP", 3, 0, 128, [32], 1], ["AN", 3, 0, 5], ["AN", 3, 1, 6], ["FU", 1, [0, 1]], ["AN", 1, 0, 5], ["PR", 1, 0, "auto_unroll_max_step$1024"], ["PR", 3, 0, "auto_unroll_max_step$1024"]]]], "r": [[4.86664e-05], 0, 2.12089, 1699437625], "v": "v0.6"}
{"i": [["[\"softmax_layer\", 128, 1, 1000]", "cuda -keys=cuda,gpu -arch=sm_70 -max_num_threads=1024 -thread_warp_size=32", [-1, 16, 64, 49152, 2147483647, 1024, 8, 32], "", 0, []], [[], [["SP", 4, 2, 1000, [32], 1], ["AN", 4, 3, 6], ["FSP", 3, 2, 0, 1], ["AN", 3, 3, 6], ["CA", 3, 4, 1], ["CI", 2], ["FU", 4, [0, 1]], ["AN", 4, 0, 5], ["FU", 1, [0, 1]], ["SP", 1, 0, 128, [32], 1], ["AN", 1, 0, 5], ["AN", 1, 1, 6], ["PR", 1, 0, "auto_unroll_max_step$1024"], ["PR", 3, 0, "auto_unroll_max_step$512"]]]], "r": [[3.00778e-05], 0, 2.12925, 1699437625], "v": "v0.6"}
{"i": [["[\"softmax_layer\", 128, 1, 1000]", "cuda -keys=cuda,gpu -arch=sm_70 -max_num_threads=1024 -thread_warp_size=32", [-1, 16, 64, 49152, 2147483647, 1024, 8, 32], "", 0, []], [[], [["CI", 2], ["FU", 4, [0, 1, 2]], ["SP", 4, 0, 128000, [32], 1], ["AN", 4, 0, 5], ["AN", 4, 1, 6], ["FU", 3, [0, 1]], ["SP", 3, 0, 128, [32], 1], ["AN", 3, 0, 5], ["AN", 3, 1, 6], ["FU", 1, [0, 1]], ["SP", 1, 0, 128, [32], 1], ["AN", 1, 0, 5], ["AN", 1, 1, 6], ["PR", 1, 0, "auto_unroll_max_step$64"], ["PR", 3, 0, "auto_unroll_max_step$16"]]]], "r": [[6.8209e-05], 0, 1.81601, 1699437626], "v": "v0.6"}
{"i": [["[\"softmax_layer\", 128, 1, 1000]", "cuda -keys=cuda,gpu -arch=sm_70 -max_num_threads=1024 -thread_warp_size=32", [-1, 16, 64, 49152, 2147483647, 1024, 8, 32], "", 0, []], [[], [["CI", 2], ["FU", 4, [0, 1, 2]], ["SP", 4, 0, 128000, [32], 1], ["AN", 4, 0, 5], ["AN", 4, 1, 6], ["FU", 3, [0, 1]], ["SP", 3, 0, 128, [32], 1], ["AN", 3, 0, 5], ["AN", 3, 1, 6], ["FU", 1, [0, 1]], ["SP", 1, 0, 128, [32], 1], ["AN", 1, 0, 5], ["AN", 1, 1, 6], ["PR", 1, 0, "auto_unroll_max_step$512"], ["PR", 3, 0, "auto_unroll_max_step$1024"]]]], "r": [[7.40624e-05], 0, 2.48481, 1699437655], "v": "v0.6"}
{"i": [["[\"softmax_layer\", 128, 1, 1000]", "cuda -keys=cuda,gpu -arch=sm_70 -max_num_threads=1024 -thread_warp_size=32", [-1, 16, 64, 49152, 2147483647, 1024, 8, 32], "", 0, []], [[], [["CI", 2], ["FU", 4, [0, 1, 2]], ["SP", 4, 0, 128000, [1], 1], ["AN", 4, 0, 5], ["AN", 4, 1, 6], ["FU", 3, [0, 1]], ["SP", 3, 0, 128, [8], 1], ["AN", 3, 0, 5], ["AN", 3, 1, 6], ["FU", 1, [0, 1]], ["SP", 1, 0, 128, [2], 1], ["AN", 1, 0, 5], ["AN", 1, 1, 6], ["PR", 1, 0, "auto_unroll_max_step$512"], ["PR", 3, 0, "auto_unroll_max_step$512"]]]], "r": [[0.000223743], 0, 2.29554, 1699437656], "v": "v0.6"}
{"i": [["[\"softmax_layer\", 128, 1, 1000]", "cuda -keys=cuda,gpu -arch=sm_70 -max_num_threads=1024 -thread_warp_size=32", [-1, 16, 64, 49152, 2147483647, 1024, 8, 32], "", 0, []], [[], [["CI", 2], ["SP", 1, 2, 1000, [32], 1], ["AN", 1, 3, 6], ["FU", 4, [0, 1, 2]], ["SP", 4, 0, 128000, [32], 1], ["AN", 4, 0, 5], ["AN", 4, 1, 6], ["FU", 3, [0, 1]], ["SP", 3, 0, 128, [64], 1], ["AN", 3, 0, 5], ["AN", 3, 1, 6], ["FU", 1, [0, 1]], ["AN", 1, 0, 5], ["PR", 1, 0, "auto_unroll_max_step$16"], ["PR", 3, 0, "auto_unroll_max_step$1024"]]]], "r": [[5.04667e-05], 0, 2.38427, 1699437656], "v": "v0.6"}
{"i": [["[\"softmax_layer\", 128, 1, 1000]", "cuda -keys=cuda,gpu -arch=sm_70 -max_num_threads=1024 -thread_warp_size=32", [-1, 16, 64, 49152, 2147483647, 1024, 8, 32], "", 0, []], [[], [["CI", 2], ["SP", 1, 2, 1000, [32], 1], ["AN", 1, 3, 6], ["FU", 4, [0, 1, 2]], ["SP", 4, 0, 128000, [16], 1], ["AN", 4, 0, 5], ["AN", 4, 1, 6], ["FU", 3, [0, 1]], ["SP", 3, 0, 128, [32], 1], ["AN", 3, 0, 5], ["AN", 3, 1, 6], ["FU", 1, [0, 1]], ["AN", 1, 0, 5], ["PR", 1, 0, "auto_unroll_max_step$0"], ["PR", 3, 0, "auto_unroll_max_step$512"]]]], "r": [[5.4351e-05], 0, 2.46681, 1699437656], "v": "v0.6"}
{"i": [["[\"softmax_layer\", 128, 1, 1000]", "cuda -keys=cuda,gpu -arch=sm_70 -max_num_threads=1024 -thread_warp_size=32", [-1, 16, 64, 49152, 2147483647, 1024, 8, 32], "", 0, []], [[], [["SP", 4, 2, 1000, [16], 1], ["AN", 4, 3, 6], ["FSP", 3, 2, 0, 1], ["AN", 3, 3, 6], ["CA", 3, 4, 1], ["CI", 2], ["FU", 4, [0, 1]], ["AN", 4, 0, 5], ["FU", 1, [0, 1]], ["SP", 1, 0, 128, [32], 1], ["AN", 1, 0, 5], ["AN", 1, 1, 6], ["PR", 1, 0, "auto_unroll_max_step$64"], ["PR", 3, 0, "auto_unroll_max_step$64"]]]], "r": [[3.54322e-05], 0, 2.54083, 1699437657], "v": "v0.6"}
{"i": [["[\"softmax_layer\", 128, 1, 1000]", "cuda -keys=cuda,gpu -arch=sm_70 -max_num_threads=1024 -thread_warp_size=32", [-1, 16, 64, 49152, 2147483647, 1024, 8, 32], "", 0, []], [[], [["SP", 4, 2, 1000, [4], 1], ["AN", 4, 3, 6], ["FSP", 3, 2, 0, 1], ["AN", 3, 3, 6], ["CA", 3, 4, 1], ["CI", 2], ["FU", 4, [0, 1]], ["AN", 4, 0, 5], ["FU", 1, [0, 1]], ["SP", 1, 0, 128, [32], 1], ["AN", 1, 0, 5], ["AN", 1, 1, 6], ["PR", 1, 0, "auto_unroll_max_step$1024"], ["PR", 3, 0, "auto_unroll_max_step$16"]]]], "r": [[6.20678e-05], 0, 2.24461, 1699437657], "v": "v0.6"}
{"i": [["[\"softmax_layer\", 128, 1, 1000]", "cuda -keys=cuda,gpu -arch=sm_70 -max_num_threads=1024 -thread_warp_size=32", [-1, 16, 64, 49152, 2147483647, 1024, 8, 32], "", 0, []], [[], [["CI", 2], ["SP", 1, 2, 1000, [8], 1], ["AN", 1, 3, 6], ["FU", 4, [0, 1, 2]], ["SP", 4, 0, 128000, [4], 1], ["AN", 4, 0, 5], ["AN", 4, 1, 6], ["FU", 3, [0, 1]], ["SP", 3, 0, 128, [32], 1], ["AN", 3, 0, 5], ["AN", 3, 1, 6], ["FU", 1, [0, 1]], ["AN", 1, 0, 5], ["PR", 1, 0, "auto_unroll_max_step$0"], ["PR", 3, 0, "auto_unroll_max_step$0"]]]], "r": [[8.81542e-05], 0, 2.35676, 1699437657], "v": "v0.6"}
{"i": [["[\"softmax_layer\", 128, 1, 1000]", "cuda -keys=cuda,gpu -arch=sm_70 -max_num_threads=1024 -thread_warp_size=32", [-1, 16, 64, 49152, 2147483647, 1024, 8, 32], "", 0, []], [[], [["SP", 4, 2, 1000, [1], 1], ["AN", 4, 3, 6], ["FSP", 3, 2, 0, 1], ["AN", 3, 3, 6], ["CA", 3, 4, 1], ["CI", 2], ["FSP", 1, 2, 0, 1], ["AN", 1, 3, 6], ["CA", 1, 4, 1], ["FU", 4, [0, 1]], ["AN", 4, 0, 5], ["PR", 1, 0, "auto_unroll_max_step$1024"], ["PR", 3, 0, "auto_unroll_max_step$64"]]]], "r": [[0.000143312], 0, 5.81088, 1699437658], "v": "v0.6"}
{"i": [["[\"softmax_layer\", 128, 1, 1000]", "cuda -keys=cuda,gpu -arch=sm_70 -max_num_threads=1024 -thread_warp_size=32", [-1, 16, 64, 49152, 2147483647, 1024, 8, 32], "", 0, []], [[], [["SP", 4, 2, 1000, [4], 1], ["AN", 4, 3, 6], ["FSP", 3, 2, 0, 1], ["AN", 3, 3, 6], ["CA", 3, 4, 1], ["CI", 2], ["FSP", 1, 2, 0, 1], ["AN", 1, 3, 6], ["CA", 1, 4, 1], ["FU", 4, [0, 1]], ["AN", 4, 0, 5], ["PR", 1, 0, "auto_unroll_max_step$0"], ["PR", 3, 0, "auto_unroll_max_step$0"]]]], "r": [[3.90187e-05], 0, 2.28211, 1699437658], "v": "v0.6"}
{"i": [["[\"softmax_layer\", 128, 1, 1000]", "cuda -keys=cuda,gpu -arch=sm_70 -max_num_threads=1024 -thread_warp_size=32", [-1, 16, 64, 49152, 2147483647, 1024, 8, 32], "", 0, []], [[], [["SP", 4, 2, 1000, [40], 1], ["AN", 4, 3, 6], ["FSP", 3, 2, 0, 1], ["AN", 3, 3, 6], ["CA", 3, 4, 1], ["CI", 2], ["FSP", 1, 2, 0, 1], ["AN", 1, 3, 6], ["CA", 1, 4, 1], ["FU", 4, [0, 1]], ["AN", 4, 0, 5], ["PR", 1, 0, "auto_unroll_max_step$64"], ["PR", 3, 0, "auto_unroll_max_step$1024"]]]], "r": [[6.21521e-06], 0, 2.18676, 1699437658], "v": "v0.6"}
{"i": [["[\"softmax_layer\", 128, 1, 1000]", "cuda -keys=cuda,gpu -arch=sm_70 -max_num_threads=1024 -thread_warp_size=32", [-1, 16, 64, 49152, 2147483647, 1024, 8, 32], "", 0, []], [[], [["SP", 4, 2, 1000, [50], 1], ["AN", 4, 3, 6], ["FSP", 3, 2, 0, 1], ["AN", 3, 3, 6], ["CA", 3, 4, 1], ["CI", 2], ["FSP", 1, 2, 0, 1], ["AN", 1, 3, 6], ["CA", 1, 4, 1], ["FU", 4, [0, 1]], ["AN", 4, 0, 5], ["PR", 1, 0, "auto_unroll_max_step$1024"], ["PR", 3, 0, "auto_unroll_max_step$0"]]]], "r": [[5.43644e-06], 0, 2.12116, 1699437659], "v": "v0.6"}
{"i": [["[\"softmax_layer\", 128, 1, 1000]", "cuda -keys=cuda,gpu -arch=sm_70 -max_num_threads=1024 -thread_warp_size=32", [-1, 16, 64, 49152, 2147483647, 1024, 8, 32], "", 0, []], [[], [["CI", 2], ["FU", 4, [0, 1, 2]], ["SP", 4, 0, 128000, [16], 1], ["AN", 4, 0, 5], ["AN", 4, 1, 6], ["FU", 3, [0, 1]], ["SP", 3, 0, 128, [32], 1], ["AN", 3, 0, 5], ["AN", 3, 1, 6], ["FU", 1, [0, 1]], ["SP", 1, 0, 128, [32], 1], ["AN", 1, 0, 5], ["AN", 1, 1, 6], ["PR", 1, 0, "auto_unroll_max_step$16"], ["PR", 3, 0, "auto_unroll_max_step$0"]]]], "r": [[7.37127e-05], 0, 2.37333, 1699437659], "v": "v0.6"}
{"i": [["[\"softmax_layer\", 128, 1, 1000]", "cuda -keys=cuda,gpu -arch=sm_70 -max_num_threads=1024 -thread_warp_size=32", [-1, 16, 64, 49152, 2147483647, 1024, 8, 32], "", 0, []], [[], [["CI", 2], ["SP", 1, 2, 1000, [8], 1], ["AN", 1, 3, 6], ["FU", 4, [0, 1, 2]], ["SP", 4, 0, 128000, [32], 1], ["AN", 4, 0, 5], ["AN", 4, 1, 6], ["FU", 3, [0, 1]], ["SP", 3, 0, 128, [4], 1], ["AN", 3, 0, 5], ["AN", 3, 1, 6], ["FU", 1, [0, 1]], ["AN", 1, 0, 5], ["PR", 1, 0, "auto_unroll_max_step$64"], ["PR", 3, 0, "auto_unroll_max_step$16"]]]], "r": [[3.79158e-05], 0, 2.35767, 1699437659], "v": "v0.6"}
{"i": [["[\"softmax_layer\", 128, 1, 1000]", "cuda -keys=cuda,gpu -arch=sm_70 -max_num_threads=1024 -thread_warp_size=32", [-1, 16, 64, 49152, 2147483647, 1024, 8, 32], "", 0, []], [[], [["SP", 4, 2, 1000, [16], 1], ["AN", 4, 3, 6], ["FSP", 3, 2, 0, 1], ["AN", 3, 3, 6], ["CA", 3, 4, 1], ["CI", 2], ["FSP", 1, 2, 0, 1], ["AN", 1, 3, 6], ["CA", 1, 4, 1], ["FU", 4, [0, 1]], ["AN", 4, 0, 5], ["PR", 1, 0, "auto_unroll_max_step$16"], ["PR", 3, 0, "auto_unroll_max_step$1024"]]]], "r": [[1.48661e-05], 0, 2.39889, 1699437660], "v": "v0.6"}
{"i": [["[\"softmax_layer\", 128, 1, 1000]", "cuda -keys=cuda,gpu -arch=sm_70 -max_num_threads=1024 -thread_warp_size=32", [-1, 16, 64, 49152, 2147483647, 1024, 8, 32], "", 0, []], [[], [["CI", 2], ["FU", 4, [0, 1, 2]], ["SP", 4, 0, 128000, [2], 1], ["AN", 4, 0, 5], ["AN", 4, 1, 6], ["FU", 3, [0, 1]], ["SP", 3, 0, 128, [1], 1], ["AN", 3, 0, 5], ["AN", 3, 1, 6], ["FU", 1, [0, 1]], ["SP", 1, 0, 128, [32], 1], ["AN", 1, 0, 5], ["AN", 1, 1, 6], ["PR", 1, 0, "auto_unroll_max_step$64"], ["PR", 3, 0, "auto_unroll_max_step$1024"]]]], "r": [[0.000141781], 0, 2.29382, 1699437660], "v": "v0.6"}
{"i": [["[\"softmax_layer\", 128, 1, 1000]", "cuda -keys=cuda,gpu -arch=sm_70 -max_num_threads=1024 -thread_warp_size=32", [-1, 16, 64, 49152, 2147483647, 1024, 8, 32], "", 0, []], [[], [["SP", 4, 2, 1000, [2], 1], ["AN", 4, 3, 6], ["FSP", 3, 2, 0, 1], ["AN", 3, 3, 6], ["CA", 3, 4, 1], ["CI", 2], ["FSP", 1, 2, 0, 1], ["AN", 1, 3, 6], ["CA", 1, 4, 1], ["FU", 4, [0, 1]], ["AN", 4, 0, 5], ["PR", 1, 0, "auto_unroll_max_step$16"], ["PR", 3, 0, "auto_unroll_max_step$16"]]]], "r": [[7.53606e-05], 0, 2.18357, 1699437660], "v": "v0.6"}
{"i": [["[\"softmax_layer\", 128, 1, 1000]", "cuda -keys=cuda,gpu -arch=sm_70 -max_num_threads=1024 -thread_warp_size=32", [-1, 16, 64, 49152, 2147483647, 1024, 8, 32], "", 0, []], [[], [["SP", 4, 2, 1000, [32], 1], ["AN", 4, 3, 6], ["FSP", 3, 2, 0, 1], ["AN", 3, 3, 6], ["CA", 3, 4, 1], ["CI", 2], ["FU", 4, [0, 1]], ["AN", 4, 0, 5], ["FU", 1, [0, 1]], ["SP", 1, 0, 128, [8], 1], ["AN", 1, 0, 5], ["AN", 1, 1, 6], ["PR", 1, 0, "auto_unroll_max_step$64"], ["PR", 3, 0, "auto_unroll_max_step$512"]]]], "r": [[2.11385e-05], 0, 2.32327, 1699437661], "v": "v0.6"}
{"i": [["[\"softmax_layer\", 128, 1, 1000]", "cuda -keys=cuda,gpu -arch=sm_70 -max_num_threads=1024 -thread_warp_size=32", [-1, 16, 64, 49152, 2147483647, 1024, 8, 32], "", 0, []], [[], [["CI", 2], ["FU", 4, [0, 1, 2]], ["SP", 4, 0, 128000, [1], 1], ["AN", 4, 0, 5], ["AN", 4, 1, 6], ["FU", 3, [0, 1]], ["SP", 3, 0, 128, [8], 1], ["AN", 3, 0, 5], ["AN", 3, 1, 6], ["FU", 1, [0, 1]], ["SP", 1, 0, 128, [1], 1], ["AN", 1, 0, 5], ["AN", 1, 1, 6], ["PR", 1, 0, "auto_unroll_max_step$512"], ["PR", 3, 0, "auto_unroll_max_step$512"]]]], "r": [[0.000224139], 0, 2.32218, 1699437661], "v": "v0.6"}
{"i": [["[\"softmax_layer\", 128, 1, 1000]", "cuda -keys=cuda,gpu -arch=sm_70 -max_num_threads=1024 -thread_warp_size=32", [-1, 16, 64, 49152, 2147483647, 1024, 8, 32], "", 0, []], [[], [["CI", 2], ["FU", 4, [0, 1, 2]], ["SP", 4, 0, 128000, [32], 1], ["AN", 4, 0, 5], ["AN", 4, 1, 6], ["FU", 3, [0, 1]], ["SP", 3, 0, 128, [32], 1], ["AN", 3, 0, 5], ["AN", 3, 1, 6], ["FU", 1, [0, 1]], ["SP", 1, 0, 128, [64], 1], ["AN", 1, 0, 5], ["AN", 1, 1, 6], ["PR", 1, 0, "auto_unroll_max_step$0"], ["PR", 3, 0, "auto_unroll_max_step$16"]]]], "r": [[7.27102e-05], 0, 2.35893, 1699437661], "v": "v0.6"}
{"i": [["[\"softmax_layer\", 128, 1, 1000]", "cuda -keys=cuda,gpu -arch=sm_70 -max_num_threads=1024 -thread_warp_size=32", [-1, 16, 64, 49152, 2147483647, 1024, 8, 32], "", 0, []], [[], [["CI", 2], ["FU", 4, [0, 1, 2]], ["SP", 4, 0, 128000, [8], 1], ["AN", 4, 0, 5], ["AN", 4, 1, 6], ["FU", 3, [0, 1]], ["SP", 3, 0, 128, [64], 1], ["AN", 3, 0, 5], ["AN", 3, 1, 6], ["FU", 1, [0, 1]], ["SP", 1, 0, 128, [64], 1], ["AN", 1, 0, 5], ["AN", 1, 1, 6], ["PR", 1, 0, "auto_unroll_max_step$64"], ["PR", 3, 0, "auto_unroll_max_step$512"]]]], "r": [[9.13214e-05], 0, 2.48599, 1699437662], "v": "v0.6"}
{"i": [["[\"softmax_layer\", 128, 1, 1000]", "cuda -keys=cuda,gpu -arch=sm_70 -max_num_threads=1024 -thread_warp_size=32", [-1, 16, 64, 49152, 2147483647, 1024, 8, 32], "", 0, []], [[], [["SP", 4, 2, 1000, [2], 1], ["AN", 4, 3, 6], ["FSP", 3, 2, 0, 1], ["AN", 3, 3, 6], ["CA", 3, 4, 1], ["CI", 2], ["FU", 4, [0, 1]], ["AN", 4, 0, 5], ["FU", 1, [0, 1]], ["SP", 1, 0, 128, [16], 1], ["AN", 1, 0, 5], ["AN", 1, 1, 6], ["PR", 1, 0, "auto_unroll_max_step$1024"], ["PR", 3, 0, "auto_unroll_max_step$64"]]]], "r": [[9.43675e-05], 0, 2.35004, 1699437662], "v": "v0.6"}
{"i": [["[\"softmax_layer\", 128, 1, 1000]", "cuda -keys=cuda,gpu -arch=sm_70 -max_num_threads=1024 -thread_warp_size=32", [-1, 16, 64, 49152, 2147483647, 1024, 8, 32], "", 0, []], [[], [["CI", 2], ["SP", 1, 2, 1000, [8], 1], ["AN", 1, 3, 6], ["FU", 4, [0, 1, 2]], ["SP", 4, 0, 128000, [32], 1], ["AN", 4, 0, 5], ["AN", 4, 1, 6], ["FU", 3, [0, 1]], ["SP", 3, 0, 128, [32], 1], ["AN", 3, 0, 5], ["AN", 3, 1, 6], ["FU", 1, [0, 1]], ["AN", 1, 0, 5], ["PR", 1, 0, "auto_unroll_max_step$0"], ["PR", 3, 0, "auto_unroll_max_step$16"]]]], "r": [[4.86734e-05], 0, 2.31597, 1699437663], "v": "v0.6"}
{"i": [["[\"softmax_layer\", 128, 1, 1000]", "cuda -keys=cuda,gpu -arch=sm_70 -max_num_threads=1024 -thread_warp_size=32", [-1, 16, 64, 49152, 2147483647, 1024, 8, 32], "", 0, []], [[], [["CI", 2], ["SP", 1, 2, 1000, [32], 1], ["AN", 1, 3, 6], ["FU", 4, [0, 1, 2]], ["SP", 4, 0, 128000, [32], 1], ["AN", 4, 0, 5], ["AN", 4, 1, 6], ["FU", 3, [0, 1]], ["SP", 3, 0, 128, [32], 1], ["AN", 3, 0, 5], ["AN", 3, 1, 6], ["FU", 1, [0, 1]], ["AN", 1, 0, 5], ["PR", 1, 0, "auto_unroll_max_step$16"], ["PR", 3, 0, "auto_unroll_max_step$1024"]]]], "r": [[4.86111e-05], 0, 2.34649, 1699437663], "v": "v0.6"}
{"i": [["[\"softmax_layer\", 128, 1, 1000]", "cuda -keys=cuda,gpu -arch=sm_70 -max_num_threads=1024 -thread_warp_size=32", [-1, 16, 64, 49152, 2147483647, 1024, 8, 32], "", 0, []], [[], [["SP", 4, 2, 1000, [32], 1], ["AN", 4, 3, 6], ["FSP", 3, 2, 0, 1], ["AN", 3, 3, 6], ["CA", 3, 4, 1], ["CI", 2], ["FU", 4, [0, 1]], ["AN", 4, 0, 5], ["FU", 1, [0, 1]], ["SP", 1, 0, 128, [1], 1], ["AN", 1, 0, 5], ["AN", 1, 1, 6], ["PR", 1, 0, "auto_unroll_max_step$64"], ["PR", 3, 0, "auto_unroll_max_step$1024"]]]], "r": [[2.05524e-05], 0, 2.36432, 1699437663], "v": "v0.6"}
{"i": [["[\"softmax_layer\", 128, 1, 1000]", "cuda -keys=cuda,gpu -arch=sm_70 -max_num_threads=1024 -thread_warp_size=32", [-1, 16, 64, 49152, 2147483647, 1024, 8, 32], "", 0, []], [[], [["CI", 2], ["SP", 1, 2, 1000, [32], 1], ["AN", 1, 3, 6], ["FU", 4, [0, 1, 2]], ["SP", 4, 0, 128000, [32], 1], ["AN", 4, 0, 5], ["AN", 4, 1, 6], ["FU", 3, [0, 1]], ["SP", 3, 0, 128, [64], 1], ["AN", 3, 0, 5], ["AN", 3, 1, 6], ["FU", 1, [0, 1]], ["AN", 1, 0, 5], ["PR", 1, 0, "auto_unroll_max_step$1024"], ["PR", 3, 0, "auto_unroll_max_step$1024"]]]], "r": [[5.0323e-05], 0, 2.36827, 1699437664], "v": "v0.6"}
{"i": [["[\"softmax_layer\", 128, 1, 1000]", "cuda -keys=cuda,gpu -arch=sm_70 -max_num_threads=1024 -thread_warp_size=32", [-1, 16, 64, 49152, 2147483647, 1024, 8, 32], "", 0, []], [[], [["SP", 4, 2, 1000, [10], 1], ["AN", 4, 3, 6], ["FSP", 3, 2, 0, 1], ["AN", 3, 3, 6], ["CA", 3, 4, 1], ["CI", 2], ["FSP", 1, 2, 0, 1], ["AN", 1, 3, 6], ["CA", 1, 4, 1], ["FU", 4, [0, 1]], ["AN", 4, 0, 5], ["PR", 1, 0, "auto_unroll_max_step$64"], ["PR", 3, 0, "auto_unroll_max_step$0"]]]], "r": [[1.66413e-05], 0, 2.10306, 1699437664], "v": "v0.6"}
{"i": [["[\"softmax_layer\", 128, 1, 1000]", "cuda -keys=cuda,gpu -arch=sm_70 -max_num_threads=1024 -thread_warp_size=32", [-1, 16, 64, 49152, 2147483647, 1024, 8, 32], "", 0, []], [[], [["CI", 2], ["SP", 1, 2, 1000, [32], 1], ["AN", 1, 3, 6], ["FU", 4, [0, 1, 2]], ["SP", 4, 0, 128000, [2], 1], ["AN", 4, 0, 5], ["AN", 4, 1, 6], ["FU", 3, [0, 1]], ["SP", 3, 0, 128, [4], 1], ["AN", 3, 0, 5], ["AN", 3, 1, 6], ["FU", 1, [0, 1]], ["AN", 1, 0, 5], ["PR", 1, 0, "auto_unroll_max_step$64"], ["PR", 3, 0, "auto_unroll_max_step$512"]]]], "r": [[0.000122608], 0, 2.3117, 1699437664], "v": "v0.6"}
{"i": [["[\"softmax_layer\", 128, 1, 1000]", "cuda -keys=cuda,gpu -arch=sm_70 -max_num_threads=1024 -thread_warp_size=32", [-1, 16, 64, 49152, 2147483647, 1024, 8, 32], "", 0, []], [[], [["SP", 4, 2, 1000, [20], 1], ["AN", 4, 3, 6], ["FSP", 3, 2, 0, 1], ["AN", 3, 3, 6], ["CA", 3, 4, 1], ["CI", 2], ["FU", 4, [0, 1]], ["AN", 4, 0, 5], ["FU", 1, [0, 1]], ["SP", 1, 0, 128, [32], 1], ["AN", 1, 0, 5], ["AN", 1, 1, 6], ["PR", 1, 0, "auto_unroll_max_step$1024"], ["PR", 3, 0, "auto_unroll_max_step$64"]]]], "r": [[3.11707e-05], 0, 2.43059, 1699437665], "v": "v0.6"}
{"i": [["[\"softmax_layer\", 128, 1, 1000]", "cuda -keys=cuda,gpu -arch=sm_70 -max_num_threads=1024 -thread_warp_size=32", [-1, 16, 64, 49152, 2147483647, 1024, 8, 32], "", 0, []], [[], [["SP", 4, 2, 1000, [50], 1], ["AN", 4, 3, 6], ["FSP", 3, 2, 0, 1], ["AN", 3, 3, 6], ["CA", 3, 4, 1], ["CI", 2], ["FSP", 1, 2, 0, 1], ["AN", 1, 3, 6], ["CA", 1, 4, 1], ["FU", 4, [0, 1]], ["AN", 4, 0, 5], ["PR", 1, 0, "auto_unroll_max_step$0"], ["PR", 3, 0, "auto_unroll_max_step$0"]]]], "r": [[5.42706e-06], 0, 2.15475, 1699437665], "v": "v0.6"}
{"i": [["[\"softmax_layer\", 128, 1, 1000]", "cuda -keys=cuda,gpu -arch=sm_70 -max_num_threads=1024 -thread_warp_size=32", [-1, 16, 64, 49152, 2147483647, 1024, 8, 32], "", 0, []], [[], [["CI", 2], ["FU", 4, [0, 1, 2]], ["SP", 4, 0, 128000, [64], 1], ["AN", 4, 0, 5], ["AN", 4, 1, 6], ["FU", 3, [0, 1]], ["SP", 3, 0, 128, [32], 1], ["AN", 3, 0, 5], ["AN", 3, 1, 6], ["FU", 1, [0, 1]], ["SP", 1, 0, 128, [32], 1], ["AN", 1, 0, 5], ["AN", 1, 1, 6], ["PR", 1, 0, "auto_unroll_max_step$64"], ["PR", 3, 0, "auto_unroll_max_step$64"]]]], "r": [[6.52396e-05], 0, 2.32772, 1699437665], "v": "v0.6"}
{"i": [["[\"softmax_layer\", 128, 1, 1000]", "cuda -keys=cuda,gpu -arch=sm_70 -max_num_threads=1024 -thread_warp_size=32", [-1, 16, 64, 49152, 2147483647, 1024, 8, 32], "", 0, []], [[], [["SP", 4, 2, 1000, [4], 1], ["AN", 4, 3, 6], ["FSP", 3, 2, 0, 1], ["AN", 3, 3, 6], ["CA", 3, 4, 1], ["CI", 2], ["FSP", 1, 2, 0, 1], ["AN", 1, 3, 6], ["CA", 1, 4, 1], ["FU", 4, [0, 1]], ["AN", 4, 0, 5], ["PR", 1, 0, "auto_unroll_max_step$0"], ["PR", 3, 0, "auto_unroll_max_step$64"]]]], "r": [[3.90103e-05], 0, 2.17268, 1699437666], "v": "v0.6"}
{"i": [["[\"softmax_layer\", 128, 1, 1000]", "cuda -keys=cuda,gpu -arch=sm_70 -max_num_threads=1024 -thread_warp_size=32", [-1, 16, 64, 49152, 2147483647, 1024, 8, 32], "", 0, []], [[], [["CI", 2], ["FU", 4, [0, 1, 2]], ["SP", 4, 0, 128000, [10], 1], ["AN", 4, 0, 5], ["AN", 4, 1, 6], ["FU", 3, [0, 1]], ["SP", 3, 0, 128, [4], 1], ["AN", 3, 0, 5], ["AN", 3, 1, 6], ["FU", 1, [0, 1]], ["SP", 1, 0, 128, [64], 1], ["AN", 1, 0, 5], ["AN", 1, 1, 6], ["PR", 1, 0, "auto_unroll_max_step$64"], ["PR", 3, 0, "auto_unroll_max_step$1024"]]]], "r": [[7.44149e-05], 0, 2.36693, 1699437666], "v": "v0.6"}
{"i": [["[\"softmax_layer\", 128, 1, 1000]", "cuda -keys=cuda,gpu -arch=sm_70 -max_num_threads=1024 -thread_warp_size=32", [-1, 16, 64, 49152, 2147483647, 1024, 8, 32], "", 0, []], [[], [["SP", 4, 2, 1000, [20], 1], ["AN", 4, 3, 6], ["FSP", 3, 2, 0, 1], ["AN", 3, 3, 6], ["CA", 3, 4, 1], ["CI", 2], ["FU", 4, [0, 1]], ["AN", 4, 0, 5], ["FU", 1, [0, 1]], ["SP", 1, 0, 128, [2], 1], ["AN", 1, 0, 5], ["AN", 1, 1, 6], ["PR", 1, 0, "auto_unroll_max_step$0"], ["PR", 3, 0, "auto_unroll_max_step$64"]]]], "r": [[2.13391e-05], 0, 2.52118, 1699437666], "v": "v0.6"}
{"i": [["[\"softmax_layer\", 128, 1, 1000]", "cuda -keys=cuda,gpu -arch=sm_70 -max_num_threads=1024 -thread_warp_size=32", [-1, 16, 64, 49152, 2147483647, 1024, 8, 32], "", 0, []], [[], [["CI", 2], ["SP", 1, 2, 1000, [8], 1], ["AN", 1, 3, 6], ["FU", 4, [0, 1, 2]], ["SP", 4, 0, 128000, [40], 1], ["AN", 4, 0, 5], ["AN", 4, 1, 6], ["FU", 3, [0, 1]], ["SP", 3, 0, 128, [64], 1], ["AN", 3, 0, 5], ["AN", 3, 1, 6], ["FU", 1, [0, 1]], ["AN", 1, 0, 5], ["PR", 1, 0, "auto_unroll_max_step$0"], ["PR", 3, 0, "auto_unroll_max_step$1024"]]]], "r": [[4.92894e-05], 0, 2.32039, 1699437667], "v": "v0.6"}
{"i": [["[\"softmax_layer\", 128, 1, 1000]", "cuda -keys=cuda,gpu -arch=sm_70 -max_num_threads=1024 -thread_warp_size=32", [-1, 16, 64, 49152, 2147483647, 1024, 8, 32], "", 0, []], [[], [["SP", 4, 2, 1000, [16], 1], ["AN", 4, 3, 6], ["FSP", 3, 2, 0, 1], ["AN", 3, 3, 6], ["CA", 3, 4, 1], ["CI", 2], ["FU", 4, [0, 1]], ["AN", 4, 0, 5], ["FU", 1, [0, 1]], ["SP", 1, 0, 128, [64], 1], ["AN", 1, 0, 5], ["AN", 1, 1, 6], ["PR", 1, 0, "auto_unroll_max_step$0"], ["PR", 3, 0, "auto_unroll_max_step$0"]]]], "r": [[5.17269e-05], 0, 2.26796, 1699437667], "v": "v0.6"}
{"i": [["[\"softmax_layer\", 128, 1, 1000]", "cuda -keys=cuda,gpu -arch=sm_70 -max_num_threads=1024 -thread_warp_size=32", [-1, 16, 64, 49152, 2147483647, 1024, 8, 32], "", 0, []], [[], [["SP", 4, 2, 1000, [32], 1], ["AN", 4, 3, 6], ["FSP", 3, 2, 0, 1], ["AN", 3, 3, 6], ["CA", 3, 4, 1], ["CI", 2], ["FU", 4, [0, 1]], ["AN", 4, 0, 5], ["FU", 1, [0, 1]], ["SP", 1, 0, 128, [8], 1], ["AN", 1, 0, 5], ["AN", 1, 1, 6], ["PR", 1, 0, "auto_unroll_max_step$1024"], ["PR", 3, 0, "auto_unroll_max_step$0"]]]], "r": [[2.69802e-05], 0, 2.25872, 1699437667], "v": "v0.6"}
{"i": [["[\"softmax_layer\", 128, 1, 1000]", "cuda -keys=cuda,gpu -arch=sm_70 -max_num_threads=1024 -thread_warp_size=32", [-1, 16, 64, 49152, 2147483647, 1024, 8, 32], "", 0, []], [[], [["SP", 4, 2, 1000, [1], 1], ["AN", 4, 3, 6], ["FSP", 3, 2, 0, 1], ["AN", 3, 3, 6], ["CA", 3, 4, 1], ["CI", 2], ["FU", 4, [0, 1]], ["AN", 4, 0, 5], ["FU", 1, [0, 1]], ["SP", 1, 0, 128, [16], 1], ["AN", 1, 0, 5], ["AN", 1, 1, 6], ["PR", 1, 0, "auto_unroll_max_step$512"], ["PR", 3, 0, "auto_unroll_max_step$64"]]]], "r": [[0.000161956], 0, 2.24773, 1699437668], "v": "v0.6"}
{"i": [["[\"softmax_layer\", 128, 1, 1000]", "cuda -keys=cuda,gpu -arch=sm_70 -max_num_threads=1024 -thread_warp_size=32", [-1, 16, 64, 49152, 2147483647, 1024, 8, 32], "", 0, []], [[], [["CI", 2], ["FU", 4, [0, 1, 2]], ["SP", 4, 0, 128000, [64], 1], ["AN", 4, 0, 5], ["AN", 4, 1, 6], ["FU", 3, [0, 1]], ["SP", 3, 0, 128, [2], 1], ["AN", 3, 0, 5], ["AN", 3, 1, 6], ["FU", 1, [0, 1]], ["SP", 1, 0, 128, [32], 1], ["AN", 1, 0, 5], ["AN", 1, 1, 6], ["PR", 1, 0, "auto_unroll_max_step$512"], ["PR", 3, 0, "auto_unroll_max_step$1024"]]]], "r": [[5.41253e-05], 0, 2.30109, 1699437668], "v": "v0.6"}
{"i": [["[\"softmax_layer\", 128, 1, 1000]", "cuda -keys=cuda,gpu -arch=sm_70 -max_num_threads=1024 -thread_warp_size=32", [-1, 16, 64, 49152, 2147483647, 1024, 8, 32], "", 0, []], [[], [["CI", 2], ["SP", 1, 2, 1000, [20], 1], ["AN", 1, 3, 6], ["FU", 4, [0, 1, 2]], ["SP", 4, 0, 128000, [32], 1], ["AN", 4, 0, 5], ["AN", 4, 1, 6], ["FU", 3, [0, 1]], ["SP", 3, 0, 128, [2], 1], ["AN", 3, 0, 5], ["AN", 3, 1, 6], ["FU", 1, [0, 1]], ["AN", 1, 0, 5], ["PR", 1, 0, "auto_unroll_max_step$64"], ["PR", 3, 0, "auto_unroll_max_step$0"]]]], "r": [[3.71273e-05], 0, 2.31069, 1699437668], "v": "v0.6"}
{"i": [["[\"softmax_layer\", 128, 1, 1000]", "cuda -keys=cuda,gpu -arch=sm_70 -max_num_threads=1024 -thread_warp_size=32", [-1, 16, 64, 49152, 2147483647, 1024, 8, 32], "", 0, []], [[], [["SP", 4, 2, 1000, [8], 1], ["AN", 4, 3, 6], ["FSP", 3, 2, 0, 1], ["AN", 3, 3, 6], ["CA", 3, 4, 1], ["CI", 2], ["FU", 4, [0, 1]], ["AN", 4, 0, 5], ["FU", 1, [0, 1]], ["SP", 1, 0, 128, [16], 1], ["AN", 1, 0, 5], ["AN", 1, 1, 6], ["PR", 1, 0, "auto_unroll_max_step$0"], ["PR", 3, 0, "auto_unroll_max_step$1024"]]]], "r": [[3.74493e-05], 0, 2.66126, 1699437669], "v": "v0.6"}
{"i": [["[\"softmax_layer\", 128, 1, 1000]", "cuda -keys=cuda,gpu -arch=sm_70 -max_num_threads=1024 -thread_warp_size=32", [-1, 16, 64, 49152, 2147483647, 1024, 8, 32], "", 0, []], [[], [["SP", 4, 2, 1000, [20], 1], ["AN", 4, 3, 6], ["FSP", 3, 2, 0, 1], ["AN", 3, 3, 6], ["CA", 3, 4, 1], ["CI", 2], ["FU", 4, [0, 1]], ["AN", 4, 0, 5], ["FU", 1, [0, 1]], ["SP", 1, 0, 128, [16], 1], ["AN", 1, 0, 5], ["AN", 1, 1, 6], ["PR", 1, 0, "auto_unroll_max_step$1024"], ["PR", 3, 0, "auto_unroll_max_step$64"]]]], "r": [[2.54276e-05], 0, 2.2803, 1699437669], "v": "v0.6"}
{"i": [["[\"softmax_layer\", 128, 1, 1000]", "cuda -keys=cuda,gpu -arch=sm_70 -max_num_threads=1024 -thread_warp_size=32", [-1, 16, 64, 49152, 2147483647, 1024, 8, 32], "", 0, []], [[], [["CI", 2], ["FU", 4, [0, 1, 2]], ["SP", 4, 0, 128000, [1], 1], ["AN", 4, 0, 5], ["AN", 4, 1, 6], ["FU", 3, [0, 1]], ["SP", 3, 0, 128, [1], 1], ["AN", 3, 0, 5], ["AN", 3, 1, 6], ["FU", 1, [0, 1]], ["SP", 1, 0, 128, [16], 1], ["AN", 1, 0, 5], ["AN", 1, 1, 6], ["PR", 1, 0, "auto_unroll_max_step$1024"], ["PR", 3, 0, "auto_unroll_max_step$64"]]]], "r": [[0.000226318], 0, 2.16316, 1699437670], "v": "v0.6"}
{"i": [["[\"softmax_layer\", 128, 1, 1000]", "cuda -keys=cuda,gpu -arch=sm_70 -max_num_threads=1024 -thread_warp_size=32", [-1, 16, 64, 49152, 2147483647, 1024, 8, 32], "", 0, []], [[], [["SP", 4, 2, 1000, [10], 1], ["AN", 4, 3, 6], ["FSP", 3, 2, 0, 1], ["AN", 3, 3, 6], ["CA", 3, 4, 1], ["CI", 2], ["FSP", 1, 2, 0, 1], ["AN", 1, 3, 6], ["CA", 1, 4, 1], ["FU", 4, [0, 1]], ["AN", 4, 0, 5], ["PR", 1, 0, "auto_unroll_max_step$16"], ["PR", 3, 0, "auto_unroll_max_step$1024"]]]], "r": [[1.73142e-05], 0, 2.31419, 1699437670], "v": "v0.6"}
{"i": [["[\"softmax_layer\", 128, 1, 1000]", "cuda -keys=cuda,gpu -arch=sm_70 -max_num_threads=1024 -thread_warp_size=32", [-1, 16, 64, 49152, 2147483647, 1024, 8, 32], "", 0, []], [[], [["SP", 4, 2, 1000, [1], 1], ["AN", 4, 3, 6], ["FSP", 3, 2, 0, 1], ["AN", 3, 3, 6], ["CA", 3, 4, 1], ["CI", 2], ["FU", 4, [0, 1]], ["AN", 4, 0, 5], ["FU", 1, [0, 1]], ["SP", 1, 0, 128, [64], 1], ["AN", 1, 0, 5], ["AN", 1, 1, 6], ["PR", 1, 0, "auto_unroll_max_step$1024"], ["PR", 3, 0, "auto_unroll_max_step$0"]]]], "r": [[0.000172412], 0, 1.8532, 1699437670], "v": "v0.6"}
{"i": [["[\"softmax_layer\", 128, 1, 1000]", "cuda -keys=cuda,gpu -arch=sm_70 -max_num_threads=1024 -thread_warp_size=32", [-1, 16, 64, 49152, 2147483647, 1024, 8, 32], "", 0, []], [[], [["CI", 2], ["SP", 1, 2, 1000, [32], 1], ["AN", 1, 3, 6], ["FU", 4, [0, 1, 2]], ["SP", 4, 0, 128000, [16], 1], ["AN", 4, 0, 5], ["AN", 4, 1, 6], ["FU", 3, [0, 1]], ["SP", 3, 0, 128, [32], 1], ["AN", 3, 0, 5], ["AN", 3, 1, 6], ["FU", 1, [0, 1]], ["AN", 1, 0, 5], ["PR", 1, 0, "auto_unroll_max_step$1024"], ["PR", 3, 0, "auto_unroll_max_step$512"]]]], "r": [[5.42731e-05], 0, 1.84522, 1699437671], "v": "v0.6"}
{"i": [["[\"softmax_layer\", 128, 1, 1000]", "cuda -keys=cuda,gpu -arch=sm_70 -max_num_threads=1024 -thread_warp_size=32", [-1, 16, 64, 49152, 2147483647, 1024, 8, 32], "", 0, []], [[], [["CI", 2], ["FU", 4, [0, 1, 2]], ["SP", 4, 0, 128000, [64], 1], ["AN", 4, 0, 5], ["AN", 4, 1, 6], ["FU", 3, [0, 1]], ["SP", 3, 0, 128, [32], 1], ["AN", 3, 0, 5], ["AN", 3, 1, 6], ["FU", 1, [0, 1]], ["SP", 1, 0, 128, [32], 1], ["AN", 1, 0, 5], ["AN", 1, 1, 6], ["PR", 1, 0, "auto_unroll_max_step$1024"], ["PR", 3, 0, "auto_unroll_max_step$1024"]]]], "r": [[6.52535e-05], 0, 2.18614, 1699437671], "v": "v0.6"}
{"i": [["[\"softmax_layer\", 128, 1, 1000]", "cuda -keys=cuda,gpu -arch=sm_70 -max_num_threads=1024 -thread_warp_size=32", [-1, 16, 64, 49152, 2147483647, 1024, 8, 32], "", 0, []], [[], [["CI", 2], ["SP", 1, 2, 1000, [32], 1], ["AN", 1, 3, 6], ["FU", 4, [0, 1, 2]], ["SP", 4, 0, 128000, [8], 1], ["AN", 4, 0, 5], ["AN", 4, 1, 6], ["FU", 3, [0, 1]], ["SP", 3, 0, 128, [32], 1], ["AN", 3, 0, 5], ["AN", 3, 1, 6], ["FU", 1, [0, 1]], ["AN", 1, 0, 5], ["PR", 1, 0, "auto_unroll_max_step$16"], ["PR", 3, 0, "auto_unroll_max_step$1024"]]]], "r": [[6.55325e-05], 0, 2.20469, 1699437671], "v": "v0.6"}
