test/eval/scripts/log/softmax.json
{"i": [["[\"softmax_layer\", 512, 1000]", "cuda -keys=cuda,gpu -arch=sm_70 -max_num_threads=1024 -thread_warp_size=32", [-1, 16, 64, 49152, 2147483647, 1024, 8, 32], "", 0, []], [[], [["SP", 4, 1, 1000, [4], 1], ["AN", 4, 2, 6], ["FSP", 3, 1, 0, 1], ["AN", 3, 2, 6], ["CA", 3, 4, 0], ["CI", 2], ["AN", 4, 0, 5], ["SP", 1, 0, 512, [4], 1], ["AN", 1, 0, 5], ["AN", 1, 1, 6], ["PR", 1, 0, "auto_unroll_max_step$512"], ["PR", 3, 0, "auto_unroll_max_step$0"]]]], "r": [[6.4316e-05], 0, 2.36273, 1708781103], "v": "v0.6"}
{"i": [["[\"softmax_layer\", 512, 1000]", "cuda -keys=cuda,gpu -arch=sm_70 -max_num_threads=1024 -thread_warp_size=32", [-1, 16, 64, 49152, 2147483647, 1024, 8, 32], "", 0, []], [[], [["CI", 2], ["FU", 4, [0, 1]], ["SP", 4, 0, 512000, [32], 1], ["AN", 4, 0, 5], ["AN", 4, 1, 6], ["SP", 3, 0, 512, [64], 1], ["AN", 3, 0, 5], ["AN", 3, 1, 6], ["SP", 1, 0, 512, [64], 1], ["AN", 1, 0, 5], ["AN", 1, 1, 6], ["PR", 1, 0, "auto_unroll_max_step$512"], ["PR", 3, 0, "auto_unroll_max_step$16"]]]], "r": [[9.50228e-05], 0, 2.25417, 1708781104], "v": "v0.6"}
{"i": [["[\"softmax_layer\", 512, 1000]", "cuda -keys=cuda,gpu -arch=sm_70 -max_num_threads=1024 -thread_warp_size=32", [-1, 16, 64, 49152, 2147483647, 1024, 8, 32], "", 0, []], [[], [["CI", 2], ["FU", 4, [0, 1]], ["SP", 4, 0, 512000, [4], 1], ["AN", 4, 0, 5], ["AN", 4, 1, 6], ["SP", 3, 0, 512, [32], 1], ["AN", 3, 0, 5], ["AN", 3, 1, 6], ["SP", 1, 0, 512, [32], 1], ["AN", 1, 0, 5], ["AN", 1, 1, 6], ["PR", 1, 0, "auto_unroll_max_step$16"], ["PR", 3, 0, "auto_unroll_max_step$16"]]]], "r": [[0.000243268], 0, 2.25716, 1708781104], "v": "v0.6"}
{"i": [["[\"softmax_layer\", 512, 1000]", "cuda -keys=cuda,gpu -arch=sm_70 -max_num_threads=1024 -thread_warp_size=32", [-1, 16, 64, 49152, 2147483647, 1024, 8, 32], "", 0, []], [[], [["SP", 4, 1, 1000, [16], 1], ["AN", 4, 2, 6], ["FSP", 3, 1, 0, 1], ["AN", 3, 2, 6], ["CA", 3, 4, 0], ["CI", 2], ["FSP", 1, 1, 0, 1], ["AN", 1, 2, 6], ["CA", 1, 4, 0], ["AN", 4, 0, 5], ["PR", 1, 0, "auto_unroll_max_step$16"], ["PR", 3, 0, "auto_unroll_max_step$16"]]]], "r": [[2.33906e-05], 0, 2.17178, 1708781104], "v": "v0.6"}
{"i": [["[\"softmax_layer\", 512, 1000]", "cuda -keys=cuda,gpu -arch=sm_70 -max_num_threads=1024 -thread_warp_size=32", [-1, 16, 64, 49152, 2147483647, 1024, 8, 32], "", 0, []], [[], [["SP", 4, 1, 1000, [20], 1], ["AN", 4, 2, 6], ["FSP", 3, 1, 0, 1], ["AN", 3, 2, 6], ["CA", 3, 4, 0], ["CI", 2], ["FSP", 1, 1, 0, 1], ["AN", 1, 2, 6], ["CA", 1, 4, 0], ["AN", 4, 0, 5], ["PR", 1, 0, "auto_unroll_max_step$16"], ["PR", 3, 0, "auto_unroll_max_step$1024"]]]], "r": [[1.07366e-05], 0, 2.18445, 1708781105], "v": "v0.6"}
{"i": [["[\"softmax_layer\", 512, 1000]", "cuda -keys=cuda,gpu -arch=sm_70 -max_num_threads=1024 -thread_warp_size=32", [-1, 16, 64, 49152, 2147483647, 1024, 8, 32], "", 0, []], [[], [["CI", 2], ["SP", 1, 1, 1000, [32], 1], ["AN", 1, 2, 6], ["FU", 4, [0, 1]], ["SP", 4, 0, 512000, [32], 1], ["AN", 4, 0, 5], ["AN", 4, 1, 6], ["SP", 3, 0, 512, [64], 1], ["AN", 3, 0, 5], ["AN", 3, 1, 6], ["AN", 1, 0, 5], ["PR", 1, 0, "auto_unroll_max_step$16"], ["PR", 3, 0, "auto_unroll_max_step$512"]]]], "r": [[6.89292e-05], 0, 2.35439, 1708781105], "v": "v0.6"}
{"i": [["[\"softmax_layer\", 512, 1000]", "cuda -keys=cuda,gpu -arch=sm_70 -max_num_threads=1024 -thread_warp_size=32", [-1, 16, 64, 49152, 2147483647, 1024, 8, 32], "", 0, []], [[], [["CI", 2], ["FU", 4, [0, 1]], ["SP", 4, 0, 512000, [4], 1], ["AN", 4, 0, 5], ["AN", 4, 1, 6], ["SP", 3, 0, 512, [64], 1], ["AN", 3, 0, 5], ["AN", 3, 1, 6], ["SP", 1, 0, 512, [32], 1], ["AN", 1, 0, 5], ["AN", 1, 1, 6], ["PR", 1, 0, "auto_unroll_max_step$1024"], ["PR", 3, 0, "auto_unroll_max_step$1024"]]]], "r": [[0.000245774], 0, 2.33607, 1708781106], "v": "v0.6"}
{"i": [["[\"softmax_layer\", 512, 1000]", "cuda -keys=cuda,gpu -arch=sm_70 -max_num_threads=1024 -thread_warp_size=32", [-1, 16, 64, 49152, 2147483647, 1024, 8, 32], "", 0, []], [[], [["CI", 2], ["SP", 1, 1, 1000, [16], 1], ["AN", 1, 2, 6], ["FU", 4, [0, 1]], ["SP", 4, 0, 512000, [64], 1], ["AN", 4, 0, 5], ["AN", 4, 1, 6], ["SP", 3, 0, 512, [32], 1], ["AN", 3, 0, 5], ["AN", 3, 1, 6], ["AN", 1, 0, 5], ["PR", 1, 0, "auto_unroll_max_step$16"], ["PR", 3, 0, "auto_unroll_max_step$64"]]]], "r": [[5.55288e-05], 0, 2.2706, 1708781106], "v": "v0.6"}
{"i": [["[\"softmax_layer\", 512, 1000]", "cuda -keys=cuda,gpu -arch=sm_70 -max_num_threads=1024 -thread_warp_size=32", [-1, 16, 64, 49152, 2147483647, 1024, 8, 32], "", 0, []], [[], [["SP", 4, 1, 1000, [8], 1], ["AN", 4, 2, 6], ["FSP", 3, 1, 0, 1], ["AN", 3, 2, 6], ["CA", 3, 4, 0], ["CI", 2], ["AN", 4, 0, 5], ["SP", 1, 0, 512, [2], 1], ["AN", 1, 0, 5], ["AN", 1, 1, 6], ["PR", 1, 0, "auto_unroll_max_step$16"], ["PR", 3, 0, "auto_unroll_max_step$512"]]]], "r": [[3.85685e-05], 0, 2.76171, 1708781106], "v": "v0.6"}
{"i": [["[\"softmax_layer\", 512, 1000]", "cuda -keys=cuda,gpu -arch=sm_70 -max_num_threads=1024 -thread_warp_size=32", [-1, 16, 64, 49152, 2147483647, 1024, 8, 32], "", 0, []], [[], [["CI", 2], ["SP", 1, 1, 1000, [8], 1], ["AN", 1, 2, 6], ["FU", 4, [0, 1]], ["SP", 4, 0, 512000, [32], 1], ["AN", 4, 0, 5], ["AN", 4, 1, 6], ["SP", 3, 0, 512, [32], 1], ["AN", 3, 0, 5], ["AN", 3, 1, 6], ["AN", 1, 0, 5], ["PR", 1, 0, "auto_unroll_max_step$1024"], ["PR", 3, 0, "auto_unroll_max_step$512"]]]], "r": [[6.63081e-05], 0, 2.29261, 1708781107], "v": "v0.6"}
{"i": [["[\"softmax_layer\", 512, 1000]", "cuda -keys=cuda,gpu -arch=sm_70 -max_num_threads=1024 -thread_warp_size=32", [-1, 16, 64, 49152, 2147483647, 1024, 8, 32], "", 0, []], [[], [["CI", 2], ["FU", 4, [0, 1]], ["SP", 4, 0, 512000, [32], 1], ["AN", 4, 0, 5], ["AN", 4, 1, 6], ["SP", 3, 0, 512, [32], 1], ["AN", 3, 0, 5], ["AN", 3, 1, 6], ["SP", 1, 0, 512, [32], 1], ["AN", 1, 0, 5], ["AN", 1, 1, 6], ["PR", 1, 0, "auto_unroll_max_step$1024"], ["PR", 3, 0, "auto_unroll_max_step$0"]]]], "r": [[8.50746e-05], 0, 2.31281, 1708781107], "v": "v0.6"}
{"i": [["[\"softmax_layer\", 512, 1000]", "cuda -keys=cuda,gpu -arch=sm_70 -max_num_threads=1024 -thread_warp_size=32", [-1, 16, 64, 49152, 2147483647, 1024, 8, 32], "", 0, []], [[], [["SP", 4, 1, 1000, [8], 1], ["AN", 4, 2, 6], ["FSP", 3, 1, 0, 1], ["AN", 3, 2, 6], ["CA", 3, 4, 0], ["CI", 2], ["AN", 4, 0, 5], ["SP", 1, 0, 512, [64], 1], ["AN", 1, 0, 5], ["AN", 1, 1, 6], ["PR", 1, 0, "auto_unroll_max_step$16"], ["PR", 3, 0, "auto_unroll_max_step$1024"]]]], "r": [[5.28399e-05], 0, 2.61777, 1708781107], "v": "v0.6"}
{"i": [["[\"softmax_layer\", 512, 1000]", "cuda -keys=cuda,gpu -arch=sm_70 -max_num_threads=1024 -thread_warp_size=32", [-1, 16, 64, 49152, 2147483647, 1024, 8, 32], "", 0, []], [[], [["CI", 2], ["SP", 1, 1, 1000, [2], 1], ["AN", 1, 2, 6], ["FU", 4, [0, 1]], ["SP", 4, 0, 512000, [16], 1], ["AN", 4, 0, 5], ["AN", 4, 1, 6], ["SP", 3, 0, 512, [32], 1], ["AN", 3, 0, 5], ["AN", 3, 1, 6], ["AN", 1, 0, 5], ["PR", 1, 0, "auto_unroll_max_step$16"], ["PR", 3, 0, "auto_unroll_max_step$64"]]]], "r": [[9.21421e-05], 0, 2.31963, 1708781108], "v": "v0.6"}
{"i": [["[\"softmax_layer\", 512, 1000]", "cuda -keys=cuda,gpu -arch=sm_70 -max_num_threads=1024 -thread_warp_size=32", [-1, 16, 64, 49152, 2147483647, 1024, 8, 32], "", 0, []], [[], [["CI", 2], ["SP", 1, 1, 1000, [32], 1], ["AN", 1, 2, 6], ["FU", 4, [0, 1]], ["SP", 4, 0, 512000, [32], 1], ["AN", 4, 0, 5], ["AN", 4, 1, 6], ["SP", 3, 0, 512, [32], 1], ["AN", 3, 0, 5], ["AN", 3, 1, 6], ["AN", 1, 0, 5], ["PR", 1, 0, "auto_unroll_max_step$16"], ["PR", 3, 0, "auto_unroll_max_step$0"]]]], "r": [[6.62476e-05], 0, 2.32347, 1708781108], "v": "v0.6"}
{"i": [["[\"softmax_layer\", 512, 1000]", "cuda -keys=cuda,gpu -arch=sm_70 -max_num_threads=1024 -thread_warp_size=32", [-1, 16, 64, 49152, 2147483647, 1024, 8, 32], "", 0, []], [[], [["SP", 4, 1, 1000, [50], 1], ["AN", 4, 2, 6], ["FSP", 3, 1, 0, 1], ["AN", 3, 2, 6], ["CA", 3, 4, 0], ["CI", 2], ["FSP", 1, 1, 0, 1], ["AN", 1, 2, 6], ["CA", 1, 4, 0], ["AN", 4, 0, 5], ["PR", 1, 0, "auto_unroll_max_step$64"], ["PR", 3, 0, "auto_unroll_max_step$512"]]]], "r": [[6.58957e-06], 0, 2.1211, 1708781108], "v": "v0.6"}
{"i": [["[\"softmax_layer\", 512, 1000]", "cuda -keys=cuda,gpu -arch=sm_70 -max_num_threads=1024 -thread_warp_size=32", [-1, 16, 64, 49152, 2147483647, 1024, 8, 32], "", 0, []], [[], [["CI", 2], ["SP", 1, 1, 1000, [1], 1], ["AN", 1, 2, 6], ["FU", 4, [0, 1]], ["SP", 4, 0, 512000, [32], 1], ["AN", 4, 0, 5], ["AN", 4, 1, 6], ["SP", 3, 0, 512, [32], 1], ["AN", 3, 0, 5], ["AN", 3, 1, 6], ["AN", 1, 0, 5], ["PR", 1, 0, "auto_unroll_max_step$1024"], ["PR", 3, 0, "auto_unroll_max_step$64"]]]], "r": [[7.72345e-05], 0, 2.28006, 1708781109], "v": "v0.6"}
{"i": [["[\"softmax_layer\", 512, 1000]", "cuda -keys=cuda,gpu -arch=sm_70 -max_num_threads=1024 -thread_warp_size=32", [-1, 16, 64, 49152, 2147483647, 1024, 8, 32], "", 0, []], [[], [["SP", 4, 1, 1000, [32], 1], ["AN", 4, 2, 6], ["FSP", 3, 1, 0, 1], ["AN", 3, 2, 6], ["CA", 3, 4, 0], ["CI", 2], ["FSP", 1, 1, 0, 1], ["AN", 1, 2, 6], ["CA", 1, 4, 0], ["AN", 4, 0, 5], ["PR", 1, 0, "auto_unroll_max_step$0"], ["PR", 3, 0, "auto_unroll_max_step$64"]]]], "r": [[1.13708e-05], 0, 2.18569, 1708781109], "v": "v0.6"}
{"i": [["[\"softmax_layer\", 512, 1000]", "cuda -keys=cuda,gpu -arch=sm_70 -max_num_threads=1024 -thread_warp_size=32", [-1, 16, 64, 49152, 2147483647, 1024, 8, 32], "", 0, []], [[], [["CI", 2], ["FU", 4, [0, 1]], ["SP", 4, 0, 512000, [32], 1], ["AN", 4, 0, 5], ["AN", 4, 1, 6], ["SP", 3, 0, 512, [32], 1], ["AN", 3, 0, 5], ["AN", 3, 1, 6], ["SP", 1, 0, 512, [32], 1], ["AN", 1, 0, 5], ["AN", 1, 1, 6], ["PR", 1, 0, "auto_unroll_max_step$16"], ["PR", 3, 0, "auto_unroll_max_step$1024"]]]], "r": [[8.5094e-05], 0, 2.27675, 1708781110], "v": "v0.6"}
{"i": [["[\"softmax_layer\", 512, 1000]", "cuda -keys=cuda,gpu -arch=sm_70 -max_num_threads=1024 -thread_warp_size=32", [-1, 16, 64, 49152, 2147483647, 1024, 8, 32], "", 0, []], [[], [["CI", 2], ["SP", 1, 1, 1000, [2], 1], ["AN", 1, 2, 6], ["FU", 4, [0, 1]], ["SP", 4, 0, 512000, [64], 1], ["AN", 4, 0, 5], ["AN", 4, 1, 6], ["SP", 3, 0, 512, [32], 1], ["AN", 3, 0, 5], ["AN", 3, 1, 6], ["AN", 1, 0, 5], ["PR", 1, 0, "auto_unroll_max_step$16"], ["PR", 3, 0, "auto_unroll_max_step$16"]]]], "r": [[5.82854e-05], 0, 2.26545, 1708781110], "v": "v0.6"}
{"i": [["[\"softmax_layer\", 512, 1000]", "cuda -keys=cuda,gpu -arch=sm_70 -max_num_threads=1024 -thread_warp_size=32", [-1, 16, 64, 49152, 2147483647, 1024, 8, 32], "", 0, []], [[], [["SP", 4, 1, 1000, [2], 1], ["AN", 4, 2, 6], ["FSP", 3, 1, 0, 1], ["AN", 3, 2, 6], ["CA", 3, 4, 0], ["CI", 2], ["AN", 4, 0, 5], ["SP", 1, 0, 512, [4], 1], ["AN", 1, 0, 5], ["AN", 1, 1, 6], ["PR", 1, 0, "auto_unroll_max_step$512"], ["PR", 3, 0, "auto_unroll_max_step$16"]]]], "r": [[9.85078e-05], 0, 2.23947, 1708781110], "v": "v0.6"}
{"i": [["[\"softmax_layer\", 512, 1000]", "cuda -keys=cuda,gpu -arch=sm_70 -max_num_threads=1024 -thread_warp_size=32", [-1, 16, 64, 49152, 2147483647, 1024, 8, 32], "", 0, []], [[], [["SP", 4, 1, 1000, [4], 1], ["AN", 4, 2, 6], ["FSP", 3, 1, 0, 1], ["AN", 3, 2, 6], ["CA", 3, 4, 0], ["CI", 2], ["AN", 4, 0, 5], ["SP", 1, 0, 512, [32], 1], ["AN", 1, 0, 5], ["AN", 1, 1, 6], ["PR", 1, 0, "auto_unroll_max_step$16"], ["PR", 3, 0, "auto_unroll_max_step$16"]]]], "r": [[6.68832e-05], 0, 2.21172, 1708781111], "v": "v0.6"}
{"i": [["[\"softmax_layer\", 512, 1000]", "cuda -keys=cuda,gpu -arch=sm_70 -max_num_threads=1024 -thread_warp_size=32", [-1, 16, 64, 49152, 2147483647, 1024, 8, 32], "", 0, []], [[], [["CI", 2], ["SP", 1, 1, 1000, [4], 1], ["AN", 1, 2, 6], ["FU", 4, [0, 1]], ["SP", 4, 0, 512000, [32], 1], ["AN", 4, 0, 5], ["AN", 4, 1, 6], ["SP", 3, 0, 512, [16], 1], ["AN", 3, 0, 5], ["AN", 3, 1, 6], ["AN", 1, 0, 5], ["PR", 1, 0, "auto_unroll_max_step$512"], ["PR", 3, 0, "auto_unroll_max_step$512"]]]], "r": [[6.11808e-05], 0, 2.29533, 1708781111], "v": "v0.6"}
{"i": [["[\"softmax_layer\", 512, 1000]", "cuda -keys=cuda,gpu -arch=sm_70 -max_num_threads=1024 -thread_warp_size=32", [-1, 16, 64, 49152, 2147483647, 1024, 8, 32], "", 0, []], [[], [["SP", 4, 1, 1000, [25], 1], ["AN", 4, 2, 6], ["FSP", 3, 1, 0, 1], ["AN", 3, 2, 6], ["CA", 3, 4, 0], ["CI", 2], ["FSP", 1, 1, 0, 1], ["AN", 1, 2, 6], ["CA", 1, 4, 0], ["AN", 4, 0, 5], ["PR", 1, 0, "auto_unroll_max_step$512"], ["PR", 3, 0, "auto_unroll_max_step$0"]]]], "r": [[9.41123e-06], 0, 2.15964, 1708781111], "v": "v0.6"}
{"i": [["[\"softmax_layer\", 512, 1000]", "cuda -keys=cuda,gpu -arch=sm_70 -max_num_threads=1024 -thread_warp_size=32", [-1, 16, 64, 49152, 2147483647, 1024, 8, 32], "", 0, []], [[], [["CI", 2], ["SP", 1, 1, 1000, [32], 1], ["AN", 1, 2, 6], ["FU", 4, [0, 1]], ["SP", 4, 0, 512000, [64], 1], ["AN", 4, 0, 5], ["AN", 4, 1, 6], ["SP", 3, 0, 512, [1], 1], ["AN", 3, 0, 5], ["AN", 3, 1, 6], ["AN", 1, 0, 5], ["PR", 1, 0, "auto_unroll_max_step$0"], ["PR", 3, 0, "auto_unroll_max_step$16"]]]], "r": [[4.63755e-05], 0, 2.31098, 1708781112], "v": "v0.6"}
{"i": [["[\"softmax_layer\", 512, 1000]", "cuda -keys=cuda,gpu -arch=sm_70 -max_num_threads=1024 -thread_warp_size=32", [-1, 16, 64, 49152, 2147483647, 1024, 8, 32], "", 0, []], [[], [["SP", 4, 1, 1000, [2], 1], ["AN", 4, 2, 6], ["FSP", 3, 1, 0, 1], ["AN", 3, 2, 6], ["CA", 3, 4, 0], ["CI", 2], ["AN", 4, 0, 5], ["SP", 1, 0, 512, [8], 1], ["AN", 1, 0, 5], ["AN", 1, 1, 6], ["PR", 1, 0, "auto_unroll_max_step$1024"], ["PR", 3, 0, "auto_unroll_max_step$1024"]]]], "r": [[9.49604e-05], 0, 4.53891, 1708781112], "v": "v0.6"}
{"i": [["[\"softmax_layer\", 512, 1000]", "cuda -keys=cuda,gpu -arch=sm_70 -max_num_threads=1024 -thread_warp_size=32", [-1, 16, 64, 49152, 2147483647, 1024, 8, 32], "", 0, []], [[], [["SP", 4, 1, 1000, [2], 1], ["AN", 4, 2, 6], ["FSP", 3, 1, 0, 1], ["AN", 3, 2, 6], ["CA", 3, 4, 0], ["CI", 2], ["FSP", 1, 1, 0, 1], ["AN", 1, 2, 6], ["CA", 1, 4, 0], ["AN", 4, 0, 5], ["PR", 1, 0, "auto_unroll_max_step$16"], ["PR", 3, 0, "auto_unroll_max_step$512"]]]], "r": [[8.53169e-05], 0, 4.66528, 1708781112], "v": "v0.6"}
{"i": [["[\"softmax_layer\", 512, 1000]", "cuda -keys=cuda,gpu -arch=sm_70 -max_num_threads=1024 -thread_warp_size=32", [-1, 16, 64, 49152, 2147483647, 1024, 8, 32], "", 0, []], [[], [["CI", 2], ["FU", 4, [0, 1]], ["SP", 4, 0, 512000, [32], 1], ["AN", 4, 0, 5], ["AN", 4, 1, 6], ["SP", 3, 0, 512, [32], 1], ["AN", 3, 0, 5], ["AN", 3, 1, 6], ["SP", 1, 0, 512, [1], 1], ["AN", 1, 0, 5], ["AN", 1, 1, 6], ["PR", 1, 0, "auto_unroll_max_step$0"], ["PR", 3, 0, "auto_unroll_max_step$0"]]]], "r": [[7.72388e-05], 0, 2.24235, 1708781113], "v": "v0.6"}
{"i": [["[\"softmax_layer\", 512, 1000]", "cuda -keys=cuda,gpu -arch=sm_70 -max_num_threads=1024 -thread_warp_size=32", [-1, 16, 64, 49152, 2147483647, 1024, 8, 32], "", 0, []], [[], [["SP", 4, 1, 1000, [4], 1], ["AN", 4, 2, 6], ["FSP", 3, 1, 0, 1], ["AN", 3, 2, 6], ["CA", 3, 4, 0], ["CI", 2], ["AN", 4, 0, 5], ["SP", 1, 0, 512, [32], 1], ["AN", 1, 0, 5], ["AN", 1, 1, 6], ["PR", 1, 0, "auto_unroll_max_step$16"], ["PR", 3, 0, "auto_unroll_max_step$512"]]]], "r": [[6.53099e-05], 0, 3.23216, 1708781113], "v": "v0.6"}
{"i": [["[\"softmax_layer\", 512, 1000]", "cuda -keys=cuda,gpu -arch=sm_70 -max_num_threads=1024 -thread_warp_size=32", [-1, 16, 64, 49152, 2147483647, 1024, 8, 32], "", 0, []], [[], [["CI", 2], ["SP", 1, 1, 1000, [32], 1], ["AN", 1, 2, 6], ["FU", 4, [0, 1]], ["SP", 4, 0, 512000, [32], 1], ["AN", 4, 0, 5], ["AN", 4, 1, 6], ["SP", 3, 0, 512, [1], 1], ["AN", 3, 0, 5], ["AN", 3, 1, 6], ["AN", 1, 0, 5], ["PR", 1, 0, "auto_unroll_max_step$64"], ["PR", 3, 0, "auto_unroll_max_step$0"]]]], "r": [[5.76347e-05], 0, 2.27057, 1708781114], "v": "v0.6"}
{"i": [["[\"softmax_layer\", 512, 1000]", "cuda -keys=cuda,gpu -arch=sm_70 -max_num_threads=1024 -thread_warp_size=32", [-1, 16, 64, 49152, 2147483647, 1024, 8, 32], "", 0, []], [[], [["SP", 4, 1, 1000, [16], 1], ["AN", 4, 2, 6], ["FSP", 3, 1, 0, 1], ["AN", 3, 2, 6], ["CA", 3, 4, 0], ["CI", 2], ["AN", 4, 0, 5], ["SP", 1, 0, 512, [32], 1], ["AN", 1, 0, 5], ["AN", 1, 1, 6], ["PR", 1, 0, "auto_unroll_max_step$0"], ["PR", 3, 0, "auto_unroll_max_step$64"]]]], "r": [[4.07723e-05], 0, 2.41097, 1708781114], "v": "v0.6"}
{"i": [["[\"softmax_layer\", 512, 1000]", "cuda -keys=cuda,gpu -arch=sm_70 -max_num_threads=1024 -thread_warp_size=32", [-1, 16, 64, 49152, 2147483647, 1024, 8, 32], "", 0, []], [[], [["SP", 4, 1, 1000, [16], 1], ["AN", 4, 2, 6], ["FSP", 3, 1, 0, 1], ["AN", 3, 2, 6], ["CA", 3, 4, 0], ["CI", 2], ["AN", 4, 0, 5], ["SP", 1, 0, 512, [32], 1], ["AN", 1, 0, 5], ["AN", 1, 1, 6], ["PR", 1, 0, "auto_unroll_max_step$64"], ["PR", 3, 0, "auto_unroll_max_step$64"]]]], "r": [[4.07663e-05], 0, 2.39434, 1708781114], "v": "v0.6"}
{"i": [["[\"softmax_layer\", 512, 1000]", "cuda -keys=cuda,gpu -arch=sm_70 -max_num_threads=1024 -thread_warp_size=32", [-1, 16, 64, 49152, 2147483647, 1024, 8, 32], "", 0, []], [[], [["CI", 2], ["SP", 1, 1, 1000, [32], 1], ["AN", 1, 2, 6], ["FU", 4, [0, 1]], ["SP", 4, 0, 512000, [4], 1], ["AN", 4, 0, 5], ["AN", 4, 1, 6], ["SP", 3, 0, 512, [32], 1], ["AN", 3, 0, 5], ["AN", 3, 1, 6], ["AN", 1, 0, 5], ["PR", 1, 0, "auto_unroll_max_step$16"], ["PR", 3, 0, "auto_unroll_max_step$512"]]]], "r": [[0.000224283], 0, 2.34825, 1708781115], "v": "v0.6"}
{"i": [["[\"softmax_layer\", 512, 1000]", "cuda -keys=cuda,gpu -arch=sm_70 -max_num_threads=1024 -thread_warp_size=32", [-1, 16, 64, 49152, 2147483647, 1024, 8, 32], "", 0, []], [[], [["CI", 2], ["SP", 1, 1, 1000, [32], 1], ["AN", 1, 2, 6], ["FU", 4, [0, 1]], ["SP", 4, 0, 512000, [1], 1], ["AN", 4, 0, 5], ["AN", 4, 1, 6], ["SP", 3, 0, 512, [64], 1], ["AN", 3, 0, 5], ["AN", 3, 1, 6], ["AN", 1, 0, 5], ["PR", 1, 0, "auto_unroll_max_step$16"], ["PR", 3, 0, "auto_unroll_max_step$64"]]]], "r": [[0.000768677], 0, 2.30019, 1708781115], "v": "v0.6"}
{"i": [["[\"softmax_layer\", 512, 1000]", "cuda -keys=cuda,gpu -arch=sm_70 -max_num_threads=1024 -thread_warp_size=32", [-1, 16, 64, 49152, 2147483647, 1024, 8, 32], "", 0, []], [[], [["CI", 2], ["SP", 1, 1, 1000, [32], 1], ["AN", 1, 2, 6], ["FU", 4, [0, 1]], ["SP", 4, 0, 512000, [1], 1], ["AN", 4, 0, 5], ["AN", 4, 1, 6], ["SP", 3, 0, 512, [64], 1], ["AN", 3, 0, 5], ["AN", 3, 1, 6], ["AN", 1, 0, 5], ["PR", 1, 0, "auto_unroll_max_step$16"], ["PR", 3, 0, "auto_unroll_max_step$1024"]]]], "r": [[0.000768669], 0, 2.28616, 1708781115], "v": "v0.6"}
{"i": [["[\"softmax_layer\", 512, 1000]", "cuda -keys=cuda,gpu -arch=sm_70 -max_num_threads=1024 -thread_warp_size=32", [-1, 16, 64, 49152, 2147483647, 1024, 8, 32], "", 0, []], [[], [["CI", 2], ["FU", 4, [0, 1]], ["SP", 4, 0, 512000, [32], 1], ["AN", 4, 0, 5], ["AN", 4, 1, 6], ["SP", 3, 0, 512, [32], 1], ["AN", 3, 0, 5], ["AN", 3, 1, 6], ["SP", 1, 0, 512, [32], 1], ["AN", 1, 0, 5], ["AN", 1, 1, 6], ["PR", 1, 0, "auto_unroll_max_step$16"], ["PR", 3, 0, "auto_unroll_max_step$16"]]]], "r": [[8.50876e-05], 0, 2.26708, 1708781116], "v": "v0.6"}
{"i": [["[\"softmax_layer\", 512, 1000]", "cuda -keys=cuda,gpu -arch=sm_70 -max_num_threads=1024 -thread_warp_size=32", [-1, 16, 64, 49152, 2147483647, 1024, 8, 32], "", 0, []], [[], [["SP", 4, 1, 1000, [40], 1], ["AN", 4, 2, 6], ["FSP", 3, 1, 0, 1], ["AN", 3, 2, 6], ["CA", 3, 4, 0], ["CI", 2], ["AN", 4, 0, 5], ["SP", 1, 0, 512, [32], 1], ["AN", 1, 0, 5], ["AN", 1, 1, 6], ["PR", 1, 0, "auto_unroll_max_step$512"], ["PR", 3, 0, "auto_unroll_max_step$1024"]]]], "r": [[2.92448e-05], 0, 2.28622, 1708781116], "v": "v0.6"}
{"i": [["[\"softmax_layer\", 512, 1000]", "cuda -keys=cuda,gpu -arch=sm_70 -max_num_threads=1024 -thread_warp_size=32", [-1, 16, 64, 49152, 2147483647, 1024, 8, 32], "", 0, []], [[], [["SP", 4, 1, 1000, [2], 1], ["AN", 4, 2, 6], ["FSP", 3, 1, 0, 1], ["AN", 3, 2, 6], ["CA", 3, 4, 0], ["CI", 2], ["FSP", 1, 1, 0, 1], ["AN", 1, 2, 6], ["CA", 1, 4, 0], ["AN", 4, 0, 5], ["PR", 1, 0, "auto_unroll_max_step$512"], ["PR", 3, 0, "auto_unroll_max_step$512"]]]], "r": [[0.000162989], 0, 5.86128, 1708781117], "v": "v0.6"}
{"i": [["[\"softmax_layer\", 512, 1000]", "cuda -keys=cuda,gpu -arch=sm_70 -max_num_threads=1024 -thread_warp_size=32", [-1, 16, 64, 49152, 2147483647, 1024, 8, 32], "", 0, []], [[], [["SP", 4, 1, 1000, [32], 1], ["AN", 4, 2, 6], ["FSP", 3, 1, 0, 1], ["AN", 3, 2, 6], ["CA", 3, 4, 0], ["CI", 2], ["AN", 4, 0, 5], ["SP", 1, 0, 512, [8], 1], ["AN", 1, 0, 5], ["AN", 1, 1, 6], ["PR", 1, 0, "auto_unroll_max_step$0"], ["PR", 3, 0, "auto_unroll_max_step$16"]]]], "r": [[2.88495e-05], 0, 2.25264, 1708781117], "v": "v0.6"}
{"i": [["[\"softmax_layer\", 512, 1000]", "cuda -keys=cuda,gpu -arch=sm_70 -max_num_threads=1024 -thread_warp_size=32", [-1, 16, 64, 49152, 2147483647, 1024, 8, 32], "", 0, []], [[], [["SP", 4, 1, 1000, [16], 1], ["AN", 4, 2, 6], ["FSP", 3, 1, 0, 1], ["AN", 3, 2, 6], ["CA", 3, 4, 0], ["CI", 2], ["AN", 4, 0, 5], ["SP", 1, 0, 512, [64], 1], ["AN", 1, 0, 5], ["AN", 1, 1, 6], ["PR", 1, 0, "auto_unroll_max_step$16"], ["PR", 3, 0, "auto_unroll_max_step$0"]]]], "r": [[5.46071e-05], 0, 2.27929, 1708781117], "v": "v0.6"}
{"i": [["[\"softmax_layer\", 512, 1000]", "cuda -keys=cuda,gpu -arch=sm_70 -max_num_threads=1024 -thread_warp_size=32", [-1, 16, 64, 49152, 2147483647, 1024, 8, 32], "", 0, []], [[], [["CI", 2], ["SP", 1, 1, 1000, [2], 1], ["AN", 1, 2, 6], ["FU", 4, [0, 1]], ["SP", 4, 0, 512000, [32], 1], ["AN", 4, 0, 5], ["AN", 4, 1, 6], ["SP", 3, 0, 512, [2], 1], ["AN", 3, 0, 5], ["AN", 3, 1, 6], ["AN", 1, 0, 5], ["PR", 1, 0, "auto_unroll_max_step$16"], ["PR", 3, 0, "auto_unroll_max_step$512"]]]], "r": [[5.99212e-05], 0, 2.24103, 1708781118], "v": "v0.6"}
{"i": [["[\"softmax_layer\", 512, 1000]", "cuda -keys=cuda,gpu -arch=sm_70 -max_num_threads=1024 -thread_warp_size=32", [-1, 16, 64, 49152, 2147483647, 1024, 8, 32], "", 0, []], [[], [["SP", 4, 1, 1000, [1], 1], ["AN", 4, 2, 6], ["FSP", 3, 1, 0, 1], ["AN", 3, 2, 6], ["CA", 3, 4, 0], ["CI", 2], ["AN", 4, 0, 5], ["SP", 1, 0, 512, [32], 1], ["AN", 1, 0, 5], ["AN", 1, 1, 6], ["PR", 1, 0, "auto_unroll_max_step$16"], ["PR", 3, 0, "auto_unroll_max_step$16"]]]], "r": [[0.00017485], 0, 2.11413, 1708781118], "v": "v0.6"}
{"i": [["[\"softmax_layer\", 512, 1000]", "cuda -keys=cuda,gpu -arch=sm_70 -max_num_threads=1024 -thread_warp_size=32", [-1, 16, 64, 49152, 2147483647, 1024, 8, 32], "", 0, []], [[], [["SP", 4, 1, 1000, [40], 1], ["AN", 4, 2, 6], ["FSP", 3, 1, 0, 1], ["AN", 3, 2, 6], ["CA", 3, 4, 0], ["CI", 2], ["FSP", 1, 1, 0, 1], ["AN", 1, 2, 6], ["CA", 1, 4, 0], ["AN", 4, 0, 5], ["PR", 1, 0, "auto_unroll_max_step$512"], ["PR", 3, 0, "auto_unroll_max_step$16"]]]], "r": [[7.45723e-06], 0, 1.97368, 1708781118], "v": "v0.6"}
{"i": [["[\"softmax_layer\", 512, 1000]", "cuda -keys=cuda,gpu -arch=sm_70 -max_num_threads=1024 -thread_warp_size=32", [-1, 16, 64, 49152, 2147483647, 1024, 8, 32], "", 0, []], [[], [["CI", 2], ["FU", 4, [0, 1]], ["SP", 4, 0, 512000, [32], 1], ["AN", 4, 0, 5], ["AN", 4, 1, 6], ["SP", 3, 0, 512, [32], 1], ["AN", 3, 0, 5], ["AN", 3, 1, 6], ["SP", 1, 0, 512, [32], 1], ["AN", 1, 0, 5], ["AN", 1, 1, 6], ["PR", 1, 0, "auto_unroll_max_step$1024"], ["PR", 3, 0, "auto_unroll_max_step$512"]]]], "r": [[8.50633e-05], 0, 1.9409, 1708781119], "v": "v0.6"}
{"i": [["[\"softmax_layer\", 512, 1000]", "cuda -keys=cuda,gpu -arch=sm_70 -max_num_threads=1024 -thread_warp_size=32", [-1, 16, 64, 49152, 2147483647, 1024, 8, 32], "", 0, []], [[], [["CI", 2], ["SP", 1, 1, 1000, [2], 1], ["AN", 1, 2, 6], ["FU", 4, [0, 1]], ["SP", 4, 0, 512000, [64], 1], ["AN", 4, 0, 5], ["AN", 4, 1, 6], ["SP", 3, 0, 512, [32], 1], ["AN", 3, 0, 5], ["AN", 3, 1, 6], ["AN", 1, 0, 5], ["PR", 1, 0, "auto_unroll_max_step$64"], ["PR", 3, 0, "auto_unroll_max_step$16"]]]], "r": [[5.82738e-05], 0, 2.06132, 1708781119], "v": "v0.6"}
{"i": [["[\"softmax_layer\", 512, 1000]", "cuda -keys=cuda,gpu -arch=sm_70 -max_num_threads=1024 -thread_warp_size=32", [-1, 16, 64, 49152, 2147483647, 1024, 8, 32], "", 0, []], [[], [["SP", 4, 1, 1000, [32], 1], ["AN", 4, 2, 6], ["FSP", 3, 1, 0, 1], ["AN", 3, 2, 6], ["CA", 3, 4, 0], ["CI", 2], ["AN", 4, 0, 5], ["SP", 1, 0, 512, [32], 1], ["AN", 1, 0, 5], ["AN", 1, 1, 6], ["PR", 1, 0, "auto_unroll_max_step$512"], ["PR", 3, 0, "auto_unroll_max_step$512"]]]], "r": [[3.16318e-05], 0, 2.18127, 1708781119], "v": "v0.6"}
{"i": [["[\"softmax_layer\", 512, 1000]", "cuda -keys=cuda,gpu -arch=sm_70 -max_num_threads=1024 -thread_warp_size=32", [-1, 16, 64, 49152, 2147483647, 1024, 8, 32], "", 0, []], [[], [["CI", 2], ["FU", 4, [0, 1]], ["SP", 4, 0, 512000, [32], 1], ["AN", 4, 0, 5], ["AN", 4, 1, 6], ["SP", 3, 0, 512, [32], 1], ["AN", 3, 0, 5], ["AN", 3, 1, 6], ["SP", 1, 0, 512, [64], 1], ["AN", 1, 0, 5], ["AN", 1, 1, 6], ["PR", 1, 0, "auto_unroll_max_step$64"], ["PR", 3, 0, "auto_unroll_max_step$16"]]]], "r": [[9.06141e-05], 0, 1.89171, 1708781120], "v": "v0.6"}
{"i": [["[\"softmax_layer\", 512, 1000]", "cuda -keys=cuda,gpu -arch=sm_70 -max_num_threads=1024 -thread_warp_size=32", [-1, 16, 64, 49152, 2147483647, 1024, 8, 32], "", 0, []], [[], [["SP", 4, 1, 1000, [8], 1], ["AN", 4, 2, 6], ["FSP", 3, 1, 0, 1], ["AN", 3, 2, 6], ["CA", 3, 4, 0], ["CI", 2], ["FSP", 1, 1, 0, 1], ["AN", 1, 2, 6], ["CA", 1, 4, 0], ["AN", 4, 0, 5], ["PR", 1, 0, "auto_unroll_max_step$512"], ["PR", 3, 0, "auto_unroll_max_step$0"]]]], "r": [[2.37739e-05], 0, 2.23867, 1708781120], "v": "v0.6"}
{"i": [["[\"softmax_layer\", 512, 1000]", "cuda -keys=cuda,gpu -arch=sm_70 -max_num_threads=1024 -thread_warp_size=32", [-1, 16, 64, 49152, 2147483647, 1024, 8, 32], "", 0, []], [[], [["SP", 4, 1, 1000, [4], 1], ["AN", 4, 2, 6], ["FSP", 3, 1, 0, 1], ["AN", 3, 2, 6], ["CA", 3, 4, 0], ["CI", 2], ["FSP", 1, 1, 0, 1], ["AN", 1, 2, 6], ["CA", 1, 4, 0], ["AN", 4, 0, 5], ["PR", 1, 0, "auto_unroll_max_step$512"], ["PR", 3, 0, "auto_unroll_max_step$16"]]]], "r": [[4.23978e-05], 0, 2.33887, 1708781120], "v": "v0.6"}
{"i": [["[\"softmax_layer\", 512, 1000]", "cuda -keys=cuda,gpu -arch=sm_70 -max_num_threads=1024 -thread_warp_size=32", [-1, 16, 64, 49152, 2147483647, 1024, 8, 32], "", 0, []], [[], [["CI", 2], ["SP", 1, 1, 1000, [1], 1], ["AN", 1, 2, 6], ["FU", 4, [0, 1]], ["SP", 4, 0, 512000, [32], 1], ["AN", 4, 0, 5], ["AN", 4, 1, 6], ["SP", 3, 0, 512, [64], 1], ["AN", 3, 0, 5], ["AN", 3, 1, 6], ["AN", 1, 0, 5], ["PR", 1, 0, "auto_unroll_max_step$0"], ["PR", 3, 0, "auto_unroll_max_step$512"]]]], "r": [[7.98723e-05], 0, 2.07868, 1708781121], "v": "v0.6"}
{"i": [["[\"softmax_layer\", 512, 1000]", "cuda -keys=cuda,gpu -arch=sm_70 -max_num_threads=1024 -thread_warp_size=32", [-1, 16, 64, 49152, 2147483647, 1024, 8, 32], "", 0, []], [[], [["SP", 4, 1, 1000, [16], 1], ["AN", 4, 2, 6], ["FSP", 3, 1, 0, 1], ["AN", 3, 2, 6], ["CA", 3, 4, 0], ["CI", 2], ["AN", 4, 0, 5], ["SP", 1, 0, 512, [64], 1], ["AN", 1, 0, 5], ["AN", 1, 1, 6], ["PR", 1, 0, "auto_unroll_max_step$0"], ["PR", 3, 0, "auto_unroll_max_step$1024"]]]], "r": [[4.32946e-05], 0, 2.17586, 1708781121], "v": "v0.6"}
{"i": [["[\"softmax_layer\", 512, 1000]", "cuda -keys=cuda,gpu -arch=sm_70 -max_num_threads=1024 -thread_warp_size=32", [-1, 16, 64, 49152, 2147483647, 1024, 8, 32], "", 0, []], [[], [["SP", 4, 1, 1000, [2], 1], ["AN", 4, 2, 6], ["FSP", 3, 1, 0, 1], ["AN", 3, 2, 6], ["CA", 3, 4, 0], ["CI", 2], ["FSP", 1, 1, 0, 1], ["AN", 1, 2, 6], ["CA", 1, 4, 0], ["AN", 4, 0, 5], ["PR", 1, 0, "auto_unroll_max_step$16"], ["PR", 3, 0, "auto_unroll_max_step$64"]]]], "r": [[8.14319e-05], 0, 1.99125, 1708781122], "v": "v0.6"}
{"i": [["[\"softmax_layer\", 512, 1000]", "cuda -keys=cuda,gpu -arch=sm_70 -max_num_threads=1024 -thread_warp_size=32", [-1, 16, 64, 49152, 2147483647, 1024, 8, 32], "", 0, []], [[], [["CI", 2], ["FU", 4, [0, 1]], ["SP", 4, 0, 512000, [32], 1], ["AN", 4, 0, 5], ["AN", 4, 1, 6], ["SP", 3, 0, 512, [64], 1], ["AN", 3, 0, 5], ["AN", 3, 1, 6], ["SP", 1, 0, 512, [32], 1], ["AN", 1, 0, 5], ["AN", 1, 1, 6], ["PR", 1, 0, "auto_unroll_max_step$1024"], ["PR", 3, 0, "auto_unroll_max_step$16"]]]], "r": [[8.77295e-05], 0, 2.11733, 1708781122], "v": "v0.6"}
{"i": [["[\"softmax_layer\", 512, 1000]", "cuda -keys=cuda,gpu -arch=sm_70 -max_num_threads=1024 -thread_warp_size=32", [-1, 16, 64, 49152, 2147483647, 1024, 8, 32], "", 0, []], [[], [["SP", 4, 1, 1000, [32], 1], ["AN", 4, 2, 6], ["FSP", 3, 1, 0, 1], ["AN", 3, 2, 6], ["CA", 3, 4, 0], ["CI", 2], ["FSP", 1, 1, 0, 1], ["AN", 1, 2, 6], ["CA", 1, 4, 0], ["AN", 4, 0, 5], ["PR", 1, 0, "auto_unroll_max_step$1024"], ["PR", 3, 0, "auto_unroll_max_step$64"]]]], "r": [[9.52801e-06], 0, 1.70162, 1708781122], "v": "v0.6"}
{"i": [["[\"softmax_layer\", 512, 1000]", "cuda -keys=cuda,gpu -arch=sm_70 -max_num_threads=1024 -thread_warp_size=32", [-1, 16, 64, 49152, 2147483647, 1024, 8, 32], "", 0, []], [[], [["SP", 4, 1, 1000, [5], 1], ["AN", 4, 2, 6], ["FSP", 3, 1, 0, 1], ["AN", 3, 2, 6], ["CA", 3, 4, 0], ["CI", 2], ["FSP", 1, 1, 0, 1], ["AN", 1, 2, 6], ["CA", 1, 4, 0], ["AN", 4, 0, 5], ["PR", 1, 0, "auto_unroll_max_step$16"], ["PR", 3, 0, "auto_unroll_max_step$512"]]]], "r": [[3.42012e-05], 0, 2.51937, 1708781123], "v": "v0.6"}
{"i": [["[\"softmax_layer\", 512, 1000]", "cuda -keys=cuda,gpu -arch=sm_70 -max_num_threads=1024 -thread_warp_size=32", [-1, 16, 64, 49152, 2147483647, 1024, 8, 32], "", 0, []], [[], [["SP", 4, 1, 1000, [1], 1], ["AN", 4, 2, 6], ["FSP", 3, 1, 0, 1], ["AN", 3, 2, 6], ["CA", 3, 4, 0], ["CI", 2], ["FSP", 1, 1, 0, 1], ["AN", 1, 2, 6], ["CA", 1, 4, 0], ["AN", 4, 0, 5], ["PR", 1, 0, "auto_unroll_max_step$16"], ["PR", 3, 0, "auto_unroll_max_step$512"]]]], "r": [[0.000152758], 0, 1.93914, 1708781123], "v": "v0.6"}
{"i": [["[\"softmax_layer\", 512, 1000]", "cuda -keys=cuda,gpu -arch=sm_70 -max_num_threads=1024 -thread_warp_size=32", [-1, 16, 64, 49152, 2147483647, 1024, 8, 32], "", 0, []], [[], [["SP", 4, 1, 1000, [40], 1], ["AN", 4, 2, 6], ["FSP", 3, 1, 0, 1], ["AN", 3, 2, 6], ["CA", 3, 4, 0], ["CI", 2], ["FSP", 1, 1, 0, 1], ["AN", 1, 2, 6], ["CA", 1, 4, 0], ["AN", 4, 0, 5], ["PR", 1, 0, "auto_unroll_max_step$16"], ["PR", 3, 0, "auto_unroll_max_step$0"]]]], "r": [[7.44714e-06], 0, 1.92492, 1708781123], "v": "v0.6"}
{"i": [["[\"softmax_layer\", 512, 1000]", "cuda -keys=cuda,gpu -arch=sm_70 -max_num_threads=1024 -thread_warp_size=32", [-1, 16, 64, 49152, 2147483647, 1024, 8, 32], "", 0, []], [[], [["SP", 4, 1, 1000, [2], 1], ["AN", 4, 2, 6], ["FSP", 3, 1, 0, 1], ["AN", 3, 2, 6], ["CA", 3, 4, 0], ["CI", 2], ["AN", 4, 0, 5], ["SP", 1, 0, 512, [32], 1], ["AN", 1, 0, 5], ["AN", 1, 1, 6], ["PR", 1, 0, "auto_unroll_max_step$0"], ["PR", 3, 0, "auto_unroll_max_step$0"]]]], "r": [[0.00010473], 0, 2.09934, 1708781124], "v": "v0.6"}
{"i": [["[\"softmax_layer\", 512, 1000]", "cuda -keys=cuda,gpu -arch=sm_70 -max_num_threads=1024 -thread_warp_size=32", [-1, 16, 64, 49152, 2147483647, 1024, 8, 32], "", 0, []], [[], [["SP", 4, 1, 1000, [1], 1], ["AN", 4, 2, 6], ["FSP", 3, 1, 0, 1], ["AN", 3, 2, 6], ["CA", 3, 4, 0], ["CI", 2], ["FSP", 1, 1, 0, 1], ["AN", 1, 2, 6], ["CA", 1, 4, 0], ["AN", 4, 0, 5], ["PR", 1, 0, "auto_unroll_max_step$512"], ["PR", 3, 0, "auto_unroll_max_step$16"]]]], "r": [[0.000152735], 0, 1.74617, 1708781124], "v": "v0.6"}
{"i": [["[\"softmax_layer\", 512, 1000]", "cuda -keys=cuda,gpu -arch=sm_70 -max_num_threads=1024 -thread_warp_size=32", [-1, 16, 64, 49152, 2147483647, 1024, 8, 32], "", 0, []], [[], [["CI", 2], ["SP", 1, 1, 1000, [1], 1], ["AN", 1, 2, 6], ["FU", 4, [0, 1]], ["SP", 4, 0, 512000, [32], 1], ["AN", 4, 0, 5], ["AN", 4, 1, 6], ["SP", 3, 0, 512, [32], 1], ["AN", 3, 0, 5], ["AN", 3, 1, 6], ["AN", 1, 0, 5], ["PR", 1, 0, "auto_unroll_max_step$1024"], ["PR", 3, 0, "auto_unroll_max_step$1024"]]]], "r": [[7.72046e-05], 0, 1.73998, 1708781124], "v": "v0.6"}
{"i": [["[\"softmax_layer\", 512, 1000]", "cuda -keys=cuda,gpu -arch=sm_70 -max_num_threads=1024 -thread_warp_size=32", [-1, 16, 64, 49152, 2147483647, 1024, 8, 32], "", 0, []], [[], [["SP", 4, 1, 1000, [1], 1], ["AN", 4, 2, 6], ["FSP", 3, 1, 0, 1], ["AN", 3, 2, 6], ["CA", 3, 4, 0], ["CI", 2], ["FSP", 1, 1, 0, 1], ["AN", 1, 2, 6], ["CA", 1, 4, 0], ["AN", 4, 0, 5], ["PR", 1, 0, "auto_unroll_max_step$512"], ["PR", 3, 0, "auto_unroll_max_step$0"]]]], "r": [[0.000152742], 0, 1.92642, 1708781125], "v": "v0.6"}
{"i": [["[\"softmax_layer\", 512, 1000]", "cuda -keys=cuda,gpu -arch=sm_70 -max_num_threads=1024 -thread_warp_size=32", [-1, 16, 64, 49152, 2147483647, 1024, 8, 32], "", 0, []], [[], [["SP", 4, 1, 1000, [4], 1], ["AN", 4, 2, 6], ["FSP", 3, 1, 0, 1], ["AN", 3, 2, 6], ["CA", 3, 4, 0], ["CI", 2], ["AN", 4, 0, 5], ["SP", 1, 0, 512, [32], 1], ["AN", 1, 0, 5], ["AN", 1, 1, 6], ["PR", 1, 0, "auto_unroll_max_step$16"], ["PR", 3, 0, "auto_unroll_max_step$1024"]]]], "r": [[6.24456e-05], 0, 2.56749, 1708781125], "v": "v0.6"}
{"i": [["[\"softmax_layer\", 512, 1000]", "cuda -keys=cuda,gpu -arch=sm_70 -max_num_threads=1024 -thread_warp_size=32", [-1, 16, 64, 49152, 2147483647, 1024, 8, 32], "", 0, []], [[], [["SP", 4, 1, 1000, [32], 1], ["AN", 4, 2, 6], ["FSP", 3, 1, 0, 1], ["AN", 3, 2, 6], ["CA", 3, 4, 0], ["CI", 2], ["FSP", 1, 1, 0, 1], ["AN", 1, 2, 6], ["CA", 1, 4, 0], ["AN", 4, 0, 5], ["PR", 1, 0, "auto_unroll_max_step$0"], ["PR", 3, 0, "auto_unroll_max_step$1024"]]]], "r": [[9.80449e-06], 0, 1.77812, 1708781126], "v": "v0.6"}
{"i": [["[\"softmax_layer\", 512, 1000]", "cuda -keys=cuda,gpu -arch=sm_70 -max_num_threads=1024 -thread_warp_size=32", [-1, 16, 64, 49152, 2147483647, 1024, 8, 32], "", 0, []], [[], [["CI", 2], ["SP", 1, 1, 1000, [32], 1], ["AN", 1, 2, 6], ["FU", 4, [0, 1]], ["SP", 4, 0, 512000, [32], 1], ["AN", 4, 0, 5], ["AN", 4, 1, 6], ["SP", 3, 0, 512, [32], 1], ["AN", 3, 0, 5], ["AN", 3, 1, 6], ["AN", 1, 0, 5], ["PR", 1, 0, "auto_unroll_max_step$64"], ["PR", 3, 0, "auto_unroll_max_step$1024"]]]], "r": [[6.62266e-05], 0, 2.13496, 1708781126], "v": "v0.6"}
{"i": [["[\"softmax_layer\", 512, 1000]", "cuda -keys=cuda,gpu -arch=sm_70 -max_num_threads=1024 -thread_warp_size=32", [-1, 16, 64, 49152, 2147483647, 1024, 8, 32], "", 0, []], [[], [["SP", 4, 1, 1000, [32], 1], ["AN", 4, 2, 6], ["FSP", 3, 1, 0, 1], ["AN", 3, 2, 6], ["CA", 3, 4, 0], ["CI", 2], ["AN", 4, 0, 5], ["SP", 1, 0, 512, [32], 1], ["AN", 1, 0, 5], ["AN", 1, 1, 6], ["PR", 1, 0, "auto_unroll_max_step$0"], ["PR", 3, 0, "auto_unroll_max_step$1024"]]]], "r": [[3.16238e-05], 0, 1.77655, 1708781126], "v": "v0.6"}
{"i": [["[\"softmax_layer\", 512, 1000]", "cuda -keys=cuda,gpu -arch=sm_70 -max_num_threads=1024 -thread_warp_size=32", [-1, 16, 64, 49152, 2147483647, 1024, 8, 32], "", 0, []], [[], [["SP", 4, 1, 1000, [20], 1], ["AN", 4, 2, 6], ["FSP", 3, 1, 0, 1], ["AN", 3, 2, 6], ["CA", 3, 4, 0], ["CI", 2], ["FSP", 1, 1, 0, 1], ["AN", 1, 2, 6], ["CA", 1, 4, 0], ["AN", 4, 0, 5], ["PR", 1, 0, "auto_unroll_max_step$1024"], ["PR", 3, 0, "auto_unroll_max_step$16"]]]], "r": [[1.29948e-05], 0, 2.27291, 1708781156], "v": "v0.6"}
{"i": [["[\"softmax_layer\", 512, 1000]", "cuda -keys=cuda,gpu -arch=sm_70 -max_num_threads=1024 -thread_warp_size=32", [-1, 16, 64, 49152, 2147483647, 1024, 8, 32], "", 0, []], [[], [["CI", 2], ["SP", 1, 1, 1000, [20], 1], ["AN", 1, 2, 6], ["FU", 4, [0, 1]], ["SP", 4, 0, 512000, [16], 1], ["AN", 4, 0, 5], ["AN", 4, 1, 6], ["SP", 3, 0, 512, [32], 1], ["AN", 3, 0, 5], ["AN", 3, 1, 6], ["AN", 1, 0, 5], ["PR", 1, 0, "auto_unroll_max_step$64"], ["PR", 3, 0, "auto_unroll_max_step$1024"]]]], "r": [[9.27113e-05], 0, 2.28005, 1708781156], "v": "v0.6"}
{"i": [["[\"softmax_layer\", 512, 1000]", "cuda -keys=cuda,gpu -arch=sm_70 -max_num_threads=1024 -thread_warp_size=32", [-1, 16, 64, 49152, 2147483647, 1024, 8, 32], "", 0, []], [[], [["SP", 4, 1, 1000, [8], 1], ["AN", 4, 2, 6], ["FSP", 3, 1, 0, 1], ["AN", 3, 2, 6], ["CA", 3, 4, 0], ["CI", 2], ["AN", 4, 0, 5], ["SP", 1, 0, 512, [32], 1], ["AN", 1, 0, 5], ["AN", 1, 1, 6], ["PR", 1, 0, "auto_unroll_max_step$0"], ["PR", 3, 0, "auto_unroll_max_step$512"]]]], "r": [[4.76918e-05], 0, 2.56413, 1708781157], "v": "v0.6"}
{"i": [["[\"softmax_layer\", 512, 1000]", "cuda -keys=cuda,gpu -arch=sm_70 -max_num_threads=1024 -thread_warp_size=32", [-1, 16, 64, 49152, 2147483647, 1024, 8, 32], "", 0, []], [[], [["SP", 4, 1, 1000, [1], 1], ["AN", 4, 2, 6], ["FSP", 3, 1, 0, 1], ["AN", 3, 2, 6], ["CA", 3, 4, 0], ["CI", 2], ["AN", 4, 0, 5], ["SP", 1, 0, 512, [32], 1], ["AN", 1, 0, 5], ["AN", 1, 1, 6], ["PR", 1, 0, "auto_unroll_max_step$64"], ["PR", 3, 0, "auto_unroll_max_step$64"]]]], "r": [[0.000180781], 0, 2.1785, 1708781157], "v": "v0.6"}
{"i": [["[\"softmax_layer\", 512, 1000]", "cuda -keys=cuda,gpu -arch=sm_70 -max_num_threads=1024 -thread_warp_size=32", [-1, 16, 64, 49152, 2147483647, 1024, 8, 32], "", 0, []], [[], [["SP", 4, 1, 1000, [16], 1], ["AN", 4, 2, 6], ["FSP", 3, 1, 0, 1], ["AN", 3, 2, 6], ["CA", 3, 4, 0], ["CI", 2], ["FSP", 1, 1, 0, 1], ["AN", 1, 2, 6], ["CA", 1, 4, 0], ["AN", 4, 0, 5], ["PR", 1, 0, "auto_unroll_max_step$64"], ["PR", 3, 0, "auto_unroll_max_step$64"]]]], "r": [[1.90997e-05], 0, 2.36868, 1708781157], "v": "v0.6"}
{"i": [["[\"softmax_layer\", 512, 1000]", "cuda -keys=cuda,gpu -arch=sm_70 -max_num_threads=1024 -thread_warp_size=32", [-1, 16, 64, 49152, 2147483647, 1024, 8, 32], "", 0, []], [[], [["CI", 2], ["FU", 4, [0, 1]], ["SP", 4, 0, 512000, [50], 1], ["AN", 4, 0, 5], ["AN", 4, 1, 6], ["SP", 3, 0, 512, [64], 1], ["AN", 3, 0, 5], ["AN", 3, 1, 6], ["SP", 1, 0, 512, [32], 1], ["AN", 1, 0, 5], ["AN", 1, 1, 6], ["PR", 1, 0, "auto_unroll_max_step$1024"], ["PR", 3, 0, "auto_unroll_max_step$1024"]]]], "r": [[7.96866e-05], 0, 2.2566, 1708781158], "v": "v0.6"}
{"i": [["[\"softmax_layer\", 512, 1000]", "cuda -keys=cuda,gpu -arch=sm_70 -max_num_threads=1024 -thread_warp_size=32", [-1, 16, 64, 49152, 2147483647, 1024, 8, 32], "", 0, []], [[], [["CI", 2], ["SP", 1, 1, 1000, [1], 1], ["AN", 1, 2, 6], ["FU", 4, [0, 1]], ["SP", 4, 0, 512000, [32], 1], ["AN", 4, 0, 5], ["AN", 4, 1, 6], ["SP", 3, 0, 512, [32], 1], ["AN", 3, 0, 5], ["AN", 3, 1, 6], ["AN", 1, 0, 5], ["PR", 1, 0, "auto_unroll_max_step$16"], ["PR", 3, 0, "auto_unroll_max_step$64"]]]], "r": [[7.73196e-05], 0, 2.23577, 1708781158], "v": "v0.6"}
{"i": [["[\"softmax_layer\", 512, 1000]", "cuda -keys=cuda,gpu -arch=sm_70 -max_num_threads=1024 -thread_warp_size=32", [-1, 16, 64, 49152, 2147483647, 1024, 8, 32], "", 0, []], [[], [["CI", 2], ["SP", 1, 1, 1000, [32], 1], ["AN", 1, 2, 6], ["FU", 4, [0, 1]], ["SP", 4, 0, 512000, [32], 1], ["AN", 4, 0, 5], ["AN", 4, 1, 6], ["SP", 3, 0, 512, [64], 1], ["AN", 3, 0, 5], ["AN", 3, 1, 6], ["AN", 1, 0, 5], ["PR", 1, 0, "auto_unroll_max_step$64"], ["PR", 3, 0, "auto_unroll_max_step$64"]]]], "r": [[6.87998e-05], 0, 2.30009, 1708781158], "v": "v0.6"}
{"i": [["[\"softmax_layer\", 512, 1000]", "cuda -keys=cuda,gpu -arch=sm_70 -max_num_threads=1024 -thread_warp_size=32", [-1, 16, 64, 49152, 2147483647, 1024, 8, 32], "", 0, []], [[], [["CI", 2], ["SP", 1, 1, 1000, [1], 1], ["AN", 1, 2, 6], ["FU", 4, [0, 1]], ["SP", 4, 0, 512000, [1], 1], ["AN", 4, 0, 5], ["AN", 4, 1, 6], ["SP", 3, 0, 512, [2], 1], ["AN", 3, 0, 5], ["AN", 3, 1, 6], ["AN", 1, 0, 5], ["PR", 1, 0, "auto_unroll_max_step$16"], ["PR", 3, 0, "auto_unroll_max_step$512"]]]], "r": [[0.000767547], 0, 2.2564, 1708781159], "v": "v0.6"}
{"i": [["[\"softmax_layer\", 512, 1000]", "cuda -keys=cuda,gpu -arch=sm_70 -max_num_threads=1024 -thread_warp_size=32", [-1, 16, 64, 49152, 2147483647, 1024, 8, 32], "", 0, []], [[], [["CI", 2], ["SP", 1, 1, 1000, [1], 1], ["AN", 1, 2, 6], ["FU", 4, [0, 1]], ["SP", 4, 0, 512000, [32], 1], ["AN", 4, 0, 5], ["AN", 4, 1, 6], ["SP", 3, 0, 512, [4], 1], ["AN", 3, 0, 5], ["AN", 3, 1, 6], ["AN", 1, 0, 5], ["PR", 1, 0, "auto_unroll_max_step$0"], ["PR", 3, 0, "auto_unroll_max_step$512"]]]], "r": [[6.75202e-05], 0, 2.26881, 1708781159], "v": "v0.6"}
{"i": [["[\"softmax_layer\", 512, 1000]", "cuda -keys=cuda,gpu -arch=sm_70 -max_num_threads=1024 -thread_warp_size=32", [-1, 16, 64, 49152, 2147483647, 1024, 8, 32], "", 0, []], [[], [["SP", 4, 1, 1000, [32], 1], ["AN", 4, 2, 6], ["FSP", 3, 1, 0, 1], ["AN", 3, 2, 6], ["CA", 3, 4, 0], ["CI", 2], ["AN", 4, 0, 5], ["SP", 1, 0, 512, [32], 1], ["AN", 1, 0, 5], ["AN", 1, 1, 6], ["PR", 1, 0, "auto_unroll_max_step$64"], ["PR", 3, 0, "auto_unroll_max_step$512"]]]], "r": [[3.33472e-05], 0, 2.27373, 1708781159], "v": "v0.6"}
{"i": [["[\"softmax_layer\", 512, 1000]", "cuda -keys=cuda,gpu -arch=sm_70 -max_num_threads=1024 -thread_warp_size=32", [-1, 16, 64, 49152, 2147483647, 1024, 8, 32], "", 0, []], [[], [["SP", 4, 1, 1000, [8], 1], ["AN", 4, 2, 6], ["FSP", 3, 1, 0, 1], ["AN", 3, 2, 6], ["CA", 3, 4, 0], ["CI", 2], ["AN", 4, 0, 5], ["SP", 1, 0, 512, [4], 1], ["AN", 1, 0, 5], ["AN", 1, 1, 6], ["PR", 1, 0, "auto_unroll_max_step$0"], ["PR", 3, 0, "auto_unroll_max_step$0"]]]], "r": [[3.81705e-05], 0, 2.17418, 1708781160], "v": "v0.6"}
{"i": [["[\"softmax_layer\", 512, 1000]", "cuda -keys=cuda,gpu -arch=sm_70 -max_num_threads=1024 -thread_warp_size=32", [-1, 16, 64, 49152, 2147483647, 1024, 8, 32], "", 0, []], [[], [["CI", 2], ["FU", 4, [0, 1]], ["SP", 4, 0, 512000, [1], 1], ["AN", 4, 0, 5], ["AN", 4, 1, 6], ["SP", 3, 0, 512, [1], 1], ["AN", 3, 0, 5], ["AN", 3, 1, 6], ["SP", 1, 0, 512, [2], 1], ["AN", 1, 0, 5], ["AN", 1, 1, 6], ["PR", 1, 0, "auto_unroll_max_step$1024"], ["PR", 3, 0, "auto_unroll_max_step$1024"]]]], "r": [[0.000767516], 0, 2.13022, 1708781160], "v": "v0.6"}
{"i": [["[\"softmax_layer\", 512, 1000]", "cuda -keys=cuda,gpu -arch=sm_70 -max_num_threads=1024 -thread_warp_size=32", [-1, 16, 64, 49152, 2147483647, 1024, 8, 32], "", 0, []], [[], [["CI", 2], ["SP", 1, 1, 1000, [32], 1], ["AN", 1, 2, 6], ["FU", 4, [0, 1]], ["SP", 4, 0, 512000, [64], 1], ["AN", 4, 0, 5], ["AN", 4, 1, 6], ["SP", 3, 0, 512, [1], 1], ["AN", 3, 0, 5], ["AN", 3, 1, 6], ["AN", 1, 0, 5], ["PR", 1, 0, "auto_unroll_max_step$512"], ["PR", 3, 0, "auto_unroll_max_step$0"]]]], "r": [[4.63403e-05], 0, 2.25513, 1708781160], "v": "v0.6"}
{"i": [["[\"softmax_layer\", 512, 1000]", "cuda -keys=cuda,gpu -arch=sm_70 -max_num_threads=1024 -thread_warp_size=32", [-1, 16, 64, 49152, 2147483647, 1024, 8, 32], "", 0, []], [[], [["SP", 4, 1, 1000, [1], 1], ["AN", 4, 2, 6], ["FSP", 3, 1, 0, 1], ["AN", 3, 2, 6], ["CA", 3, 4, 0], ["CI", 2], ["AN", 4, 0, 5], ["SP", 1, 0, 512, [32], 1], ["AN", 1, 0, 5], ["AN", 1, 1, 6], ["PR", 1, 0, "auto_unroll_max_step$16"], ["PR", 3, 0, "auto_unroll_max_step$512"]]]], "r": [[0.000180006], 0, 2.17896, 1708781161], "v": "v0.6"}
{"i": [["[\"softmax_layer\", 512, 1000]", "cuda -keys=cuda,gpu -arch=sm_70 -max_num_threads=1024 -thread_warp_size=32", [-1, 16, 64, 49152, 2147483647, 1024, 8, 32], "", 0, []], [[], [["SP", 4, 1, 1000, [4], 1], ["AN", 4, 2, 6], ["FSP", 3, 1, 0, 1], ["AN", 3, 2, 6], ["CA", 3, 4, 0], ["CI", 2], ["FSP", 1, 1, 0, 1], ["AN", 1, 2, 6], ["CA", 1, 4, 0], ["AN", 4, 0, 5], ["PR", 1, 0, "auto_unroll_max_step$64"], ["PR", 3, 0, "auto_unroll_max_step$64"]]]], "r": [[4.47222e-05], 0, 2.06898, 1708781161], "v": "v0.6"}
{"i": [["[\"softmax_layer\", 512, 1000]", "cuda -keys=cuda,gpu -arch=sm_70 -max_num_threads=1024 -thread_warp_size=32", [-1, 16, 64, 49152, 2147483647, 1024, 8, 32], "", 0, []], [[], [["CI", 2], ["FU", 4, [0, 1]], ["SP", 4, 0, 512000, [2], 1], ["AN", 4, 0, 5], ["AN", 4, 1, 6], ["SP", 3, 0, 512, [16], 1], ["AN", 3, 0, 5], ["AN", 3, 1, 6], ["SP", 1, 0, 512, [32], 1], ["AN", 1, 0, 5], ["AN", 1, 1, 6], ["PR", 1, 0, "auto_unroll_max_step$16"], ["PR", 3, 0, "auto_unroll_max_step$512"]]]], "r": [[0.000417568], 0, 2.27084, 1708781162], "v": "v0.6"}
{"i": [["[\"softmax_layer\", 512, 1000]", "cuda -keys=cuda,gpu -arch=sm_70 -max_num_threads=1024 -thread_warp_size=32", [-1, 16, 64, 49152, 2147483647, 1024, 8, 32], "", 0, []], [[], [["CI", 2], ["SP", 1, 1, 1000, [16], 1], ["AN", 1, 2, 6], ["FU", 4, [0, 1]], ["SP", 4, 0, 512000, [1], 1], ["AN", 4, 0, 5], ["AN", 4, 1, 6], ["SP", 3, 0, 512, [8], 1], ["AN", 3, 0, 5], ["AN", 3, 1, 6], ["AN", 1, 0, 5], ["PR", 1, 0, "auto_unroll_max_step$16"], ["PR", 3, 0, "auto_unroll_max_step$64"]]]], "r": [[0.000757399], 0, 2.29678, 1708781162], "v": "v0.6"}
{"i": [["[\"softmax_layer\", 512, 1000]", "cuda -keys=cuda,gpu -arch=sm_70 -max_num_threads=1024 -thread_warp_size=32", [-1, 16, 64, 49152, 2147483647, 1024, 8, 32], "", 0, []], [[], [["SP", 4, 1, 1000, [8], 1], ["AN", 4, 2, 6], ["FSP", 3, 1, 0, 1], ["AN", 3, 2, 6], ["CA", 3, 4, 0], ["CI", 2], ["AN", 4, 0, 5], ["SP", 1, 0, 512, [32], 1], ["AN", 1, 0, 5], ["AN", 1, 1, 6], ["PR", 1, 0, "auto_unroll_max_step$16"], ["PR", 3, 0, "auto_unroll_max_step$512"]]]], "r": [[4.75332e-05], 0, 2.61372, 1708781162], "v": "v0.6"}
{"i": [["[\"softmax_layer\", 512, 1000]", "cuda -keys=cuda,gpu -arch=sm_70 -max_num_threads=1024 -thread_warp_size=32", [-1, 16, 64, 49152, 2147483647, 1024, 8, 32], "", 0, []], [[], [["SP", 4, 1, 1000, [32], 1], ["AN", 4, 2, 6], ["FSP", 3, 1, 0, 1], ["AN", 3, 2, 6], ["CA", 3, 4, 0], ["CI", 2], ["AN", 4, 0, 5], ["SP", 1, 0, 512, [64], 1], ["AN", 1, 0, 5], ["AN", 1, 1, 6], ["PR", 1, 0, "auto_unroll_max_step$0"], ["PR", 3, 0, "auto_unroll_max_step$0"]]]], "r": [[4.42471e-05], 0, 2.17201, 1708781163], "v": "v0.6"}
{"i": [["[\"softmax_layer\", 512, 1000]", "cuda -keys=cuda,gpu -arch=sm_70 -max_num_threads=1024 -thread_warp_size=32", [-1, 16, 64, 49152, 2147483647, 1024, 8, 32], "", 0, []], [[], [["SP", 4, 1, 1000, [2], 1], ["AN", 4, 2, 6], ["FSP", 3, 1, 0, 1], ["AN", 3, 2, 6], ["CA", 3, 4, 0], ["CI", 2], ["FSP", 1, 1, 0, 1], ["AN", 1, 2, 6], ["CA", 1, 4, 0], ["AN", 4, 0, 5], ["PR", 1, 0, "auto_unroll_max_step$64"], ["PR", 3, 0, "auto_unroll_max_step$64"]]]], "r": [[8.48317e-05], 0, 2.07457, 1708781163], "v": "v0.6"}
{"i": [["[\"softmax_layer\", 512, 1000]", "cuda -keys=cuda,gpu -arch=sm_70 -max_num_threads=1024 -thread_warp_size=32", [-1, 16, 64, 49152, 2147483647, 1024, 8, 32], "", 0, []], [[], [["SP", 4, 1, 1000, [32], 1], ["AN", 4, 2, 6], ["FSP", 3, 1, 0, 1], ["AN", 3, 2, 6], ["CA", 3, 4, 0], ["CI", 2], ["AN", 4, 0, 5], ["SP", 1, 0, 512, [1], 1], ["AN", 1, 0, 5], ["AN", 1, 1, 6], ["PR", 1, 0, "auto_unroll_max_step$64"], ["PR", 3, 0, "auto_unroll_max_step$512"]]]], "r": [[2.5462e-05], 0, 2.25438, 1708781163], "v": "v0.6"}
{"i": [["[\"softmax_layer\", 512, 1000]", "cuda -keys=cuda,gpu -arch=sm_70 -max_num_threads=1024 -thread_warp_size=32", [-1, 16, 64, 49152, 2147483647, 1024, 8, 32], "", 0, []], [[], [["CI", 2], ["SP", 1, 1, 1000, [4], 1], ["AN", 1, 2, 6], ["FU", 4, [0, 1]], ["SP", 4, 0, 512000, [32], 1], ["AN", 4, 0, 5], ["AN", 4, 1, 6], ["SP", 3, 0, 512, [8], 1], ["AN", 3, 0, 5], ["AN", 3, 1, 6], ["AN", 1, 0, 5], ["PR", 1, 0, "auto_unroll_max_step$512"], ["PR", 3, 0, "auto_unroll_max_step$512"]]]], "r": [[5.81577e-05], 0, 2.26114, 1708781164], "v": "v0.6"}
{"i": [["[\"softmax_layer\", 512, 1000]", "cuda -keys=cuda,gpu -arch=sm_70 -max_num_threads=1024 -thread_warp_size=32", [-1, 16, 64, 49152, 2147483647, 1024, 8, 32], "", 0, []], [[], [["CI", 2], ["SP", 1, 1, 1000, [32], 1], ["AN", 1, 2, 6], ["FU", 4, [0, 1]], ["SP", 4, 0, 512000, [64], 1], ["AN", 4, 0, 5], ["AN", 4, 1, 6], ["SP", 3, 0, 512, [2], 1], ["AN", 3, 0, 5], ["AN", 3, 1, 6], ["AN", 1, 0, 5], ["PR", 1, 0, "auto_unroll_max_step$16"], ["PR", 3, 0, "auto_unroll_max_step$0"]]]], "r": [[4.53485e-05], 0, 2.23648, 1708781164], "v": "v0.6"}
{"i": [["[\"softmax_layer\", 512, 1000]", "cuda -keys=cuda,gpu -arch=sm_70 -max_num_threads=1024 -thread_warp_size=32", [-1, 16, 64, 49152, 2147483647, 1024, 8, 32], "", 0, []], [[], [["CI", 2], ["FU", 4, [0, 1]], ["SP", 4, 0, 512000, [2], 1], ["AN", 4, 0, 5], ["AN", 4, 1, 6], ["SP", 3, 0, 512, [32], 1], ["AN", 3, 0, 5], ["AN", 3, 1, 6], ["SP", 1, 0, 512, [32], 1], ["AN", 1, 0, 5], ["AN", 1, 1, 6], ["PR", 1, 0, "auto_unroll_max_step$1024"], ["PR", 3, 0, "auto_unroll_max_step$512"]]]], "r": [[0.000423803], 0, 2.2317, 1708781164], "v": "v0.6"}
{"i": [["[\"softmax_layer\", 512, 1000]", "cuda -keys=cuda,gpu -arch=sm_70 -max_num_threads=1024 -thread_warp_size=32", [-1, 16, 64, 49152, 2147483647, 1024, 8, 32], "", 0, []], [[], [["CI", 2], ["SP", 1, 1, 1000, [32], 1], ["AN", 1, 2, 6], ["FU", 4, [0, 1]], ["SP", 4, 0, 512000, [32], 1], ["AN", 4, 0, 5], ["AN", 4, 1, 6], ["SP", 3, 0, 512, [64], 1], ["AN", 3, 0, 5], ["AN", 3, 1, 6], ["AN", 1, 0, 5], ["PR", 1, 0, "auto_unroll_max_step$0"], ["PR", 3, 0, "auto_unroll_max_step$512"]]]], "r": [[6.88021e-05], 0, 2.28782, 1708781165], "v": "v0.6"}
{"i": [["[\"softmax_layer\", 512, 1000]", "cuda -keys=cuda,gpu -arch=sm_70 -max_num_threads=1024 -thread_warp_size=32", [-1, 16, 64, 49152, 2147483647, 1024, 8, 32], "", 0, []], [[], [["CI", 2], ["FU", 4, [0, 1]], ["SP", 4, 0, 512000, [64], 1], ["AN", 4, 0, 5], ["AN", 4, 1, 6], ["SP", 3, 0, 512, [2], 1], ["AN", 3, 0, 5], ["AN", 3, 1, 6], ["SP", 1, 0, 512, [64], 1], ["AN", 1, 0, 5], ["AN", 1, 1, 6], ["PR", 1, 0, "auto_unroll_max_step$16"], ["PR", 3, 0, "auto_unroll_max_step$0"]]]], "r": [[6.98479e-05], 0, 2.23935, 1708781165], "v": "v0.6"}
{"i": [["[\"softmax_layer\", 512, 1000]", "cuda -keys=cuda,gpu -arch=sm_70 -max_num_threads=1024 -thread_warp_size=32", [-1, 16, 64, 49152, 2147483647, 1024, 8, 32], "", 0, []], [[], [["CI", 2], ["FU", 4, [0, 1]], ["SP", 4, 0, 512000, [1], 1], ["AN", 4, 0, 5], ["AN", 4, 1, 6], ["SP", 3, 0, 512, [32], 1], ["AN", 3, 0, 5], ["AN", 3, 1, 6], ["SP", 1, 0, 512, [2], 1], ["AN", 1, 0, 5], ["AN", 1, 1, 6], ["PR", 1, 0, "auto_unroll_max_step$64"], ["PR", 3, 0, "auto_unroll_max_step$16"]]]], "r": [[0.000776062], 0, 2.08915, 1708781165], "v": "v0.6"}
{"i": [["[\"softmax_layer\", 512, 1000]", "cuda -keys=cuda,gpu -arch=sm_70 -max_num_threads=1024 -thread_warp_size=32", [-1, 16, 64, 49152, 2147483647, 1024, 8, 32], "", 0, []], [[], [["CI", 2], ["SP", 1, 1, 1000, [10], 1], ["AN", 1, 2, 6], ["FU", 4, [0, 1]], ["SP", 4, 0, 512000, [32], 1], ["AN", 4, 0, 5], ["AN", 4, 1, 6], ["SP", 3, 0, 512, [1], 1], ["AN", 3, 0, 5], ["AN", 3, 1, 6], ["AN", 1, 0, 5], ["PR", 1, 0, "auto_unroll_max_step$64"], ["PR", 3, 0, "auto_unroll_max_step$0"]]]], "r": [[5.75842e-05], 0, 2.2456, 1708781166], "v": "v0.6"}
{"i": [["[\"softmax_layer\", 512, 1000]", "cuda -keys=cuda,gpu -arch=sm_70 -max_num_threads=1024 -thread_warp_size=32", [-1, 16, 64, 49152, 2147483647, 1024, 8, 32], "", 0, []], [[], [["CI", 2], ["FU", 4, [0, 1]], ["SP", 4, 0, 512000, [32], 1], ["AN", 4, 0, 5], ["AN", 4, 1, 6], ["SP", 3, 0, 512, [32], 1], ["AN", 3, 0, 5], ["AN", 3, 1, 6], ["SP", 1, 0, 512, [32], 1], ["AN", 1, 0, 5], ["AN", 1, 1, 6], ["PR", 1, 0, "auto_unroll_max_step$64"], ["PR", 3, 0, "auto_unroll_max_step$1024"]]]], "r": [[8.51815e-05], 0, 2.23276, 1708781166], "v": "v0.6"}
{"i": [["[\"softmax_layer\", 512, 1000]", "cuda -keys=cuda,gpu -arch=sm_70 -max_num_threads=1024 -thread_warp_size=32", [-1, 16, 64, 49152, 2147483647, 1024, 8, 32], "", 0, []], [[], [["CI", 2], ["SP", 1, 1, 1000, [32], 1], ["AN", 1, 2, 6], ["FU", 4, [0, 1]], ["SP", 4, 0, 512000, [64], 1], ["AN", 4, 0, 5], ["AN", 4, 1, 6], ["SP", 3, 0, 512, [32], 1], ["AN", 3, 0, 5], ["AN", 3, 1, 6], ["AN", 1, 0, 5], ["PR", 1, 0, "auto_unroll_max_step$1024"], ["PR", 3, 0, "auto_unroll_max_step$16"]]]], "r": [[5.49696e-05], 0, 2.30577, 1708781167], "v": "v0.6"}
{"i": [["[\"softmax_layer\", 512, 1000]", "cuda -keys=cuda,gpu -arch=sm_70 -max_num_threads=1024 -thread_warp_size=32", [-1, 16, 64, 49152, 2147483647, 1024, 8, 32], "", 0, []], [[], [["SP", 4, 1, 1000, [1], 1], ["AN", 4, 2, 6], ["FSP", 3, 1, 0, 1], ["AN", 3, 2, 6], ["CA", 3, 4, 0], ["CI", 2], ["AN", 4, 0, 5], ["SP", 1, 0, 512, [64], 1], ["AN", 1, 0, 5], ["AN", 1, 1, 6], ["PR", 1, 0, "auto_unroll_max_step$1024"], ["PR", 3, 0, "auto_unroll_max_step$0"]]]], "r": [[0.000185488], 0, 2.19704, 1708781167], "v": "v0.6"}
{"i": [["[\"softmax_layer\", 512, 1000]", "cuda -keys=cuda,gpu -arch=sm_70 -max_num_threads=1024 -thread_warp_size=32", [-1, 16, 64, 49152, 2147483647, 1024, 8, 32], "", 0, []], [[], [["SP", 4, 1, 1000, [1], 1], ["AN", 4, 2, 6], ["FSP", 3, 1, 0, 1], ["AN", 3, 2, 6], ["CA", 3, 4, 0], ["CI", 2], ["FSP", 1, 1, 0, 1], ["AN", 1, 2, 6], ["CA", 1, 4, 0], ["AN", 4, 0, 5], ["PR", 1, 0, "auto_unroll_max_step$64"], ["PR", 3, 0, "auto_unroll_max_step$64"]]]], "r": [[0.000158082], 0, 2.05513, 1708781167], "v": "v0.6"}
{"i": [["[\"softmax_layer\", 512, 1000]", "cuda -keys=cuda,gpu -arch=sm_70 -max_num_threads=1024 -thread_warp_size=32", [-1, 16, 64, 49152, 2147483647, 1024, 8, 32], "", 0, []], [[], [["SP", 4, 1, 1000, [2], 1], ["AN", 4, 2, 6], ["FSP", 3, 1, 0, 1], ["AN", 3, 2, 6], ["CA", 3, 4, 0], ["CI", 2], ["FSP", 1, 1, 0, 1], ["AN", 1, 2, 6], ["CA", 1, 4, 0], ["AN", 4, 0, 5], ["PR", 1, 0, "auto_unroll_max_step$64"], ["PR", 3, 0, "auto_unroll_max_step$16"]]]], "r": [[8.47714e-05], 0, 2.07413, 1708781168], "v": "v0.6"}
{"i": [["[\"softmax_layer\", 512, 1000]", "cuda -keys=cuda,gpu -arch=sm_70 -max_num_threads=1024 -thread_warp_size=32", [-1, 16, 64, 49152, 2147483647, 1024, 8, 32], "", 0, []], [[], [["CI", 2], ["SP", 1, 1, 1000, [32], 1], ["AN", 1, 2, 6], ["FU", 4, [0, 1]], ["SP", 4, 0, 512000, [2], 1], ["AN", 4, 0, 5], ["AN", 4, 1, 6], ["SP", 3, 0, 512, [32], 1], ["AN", 3, 0, 5], ["AN", 3, 1, 6], ["AN", 1, 0, 5], ["PR", 1, 0, "auto_unroll_max_step$512"], ["PR", 3, 0, "auto_unroll_max_step$1024"]]]], "r": [[0.000404871], 0, 2.26, 1708781168], "v": "v0.6"}
{"i": [["[\"softmax_layer\", 512, 1000]", "cuda -keys=cuda,gpu -arch=sm_70 -max_num_threads=1024 -thread_warp_size=32", [-1, 16, 64, 49152, 2147483647, 1024, 8, 32], "", 0, []], [[], [["CI", 2], ["SP", 1, 1, 1000, [2], 1], ["AN", 1, 2, 6], ["FU", 4, [0, 1]], ["SP", 4, 0, 512000, [64], 1], ["AN", 4, 0, 5], ["AN", 4, 1, 6], ["SP", 3, 0, 512, [4], 1], ["AN", 3, 0, 5], ["AN", 3, 1, 6], ["AN", 1, 0, 5], ["PR", 1, 0, "auto_unroll_max_step$64"], ["PR", 3, 0, "auto_unroll_max_step$1024"]]]], "r": [[4.85213e-05], 0, 2.2499, 1708781168], "v": "v0.6"}
{"i": [["[\"softmax_layer\", 512, 1000]", "cuda -keys=cuda,gpu -arch=sm_70 -max_num_threads=1024 -thread_warp_size=32", [-1, 16, 64, 49152, 2147483647, 1024, 8, 32], "", 0, []], [[], [["CI", 2], ["FU", 4, [0, 1]], ["SP", 4, 0, 512000, [8], 1], ["AN", 4, 0, 5], ["AN", 4, 1, 6], ["SP", 3, 0, 512, [1], 1], ["AN", 3, 0, 5], ["AN", 3, 1, 6], ["SP", 1, 0, 512, [2], 1], ["AN", 1, 0, 5], ["AN", 1, 1, 6], ["PR", 1, 0, "auto_unroll_max_step$16"], ["PR", 3, 0, "auto_unroll_max_step$512"]]]], "r": [[0.000135352], 0, 2.24446, 1708781169], "v": "v0.6"}
{"i": [["[\"softmax_layer\", 512, 1000]", "cuda -keys=cuda,gpu -arch=sm_70 -max_num_threads=1024 -thread_warp_size=32", [-1, 16, 64, 49152, 2147483647, 1024, 8, 32], "", 0, []], [[], [["SP", 4, 1, 1000, [1], 1], ["AN", 4, 2, 6], ["FSP", 3, 1, 0, 1], ["AN", 3, 2, 6], ["CA", 3, 4, 0], ["CI", 2], ["FSP", 1, 1, 0, 1], ["AN", 1, 2, 6], ["CA", 1, 4, 0], ["AN", 4, 0, 5], ["PR", 1, 0, "auto_unroll_max_step$1024"], ["PR", 3, 0, "auto_unroll_max_step$0"]]]], "r": [[0.000157153], 0, 5.22972, 1708781169], "v": "v0.6"}
{"i": [["[\"softmax_layer\", 512, 1000]", "cuda -keys=cuda,gpu -arch=sm_70 -max_num_threads=1024 -thread_warp_size=32", [-1, 16, 64, 49152, 2147483647, 1024, 8, 32], "", 0, []], [[], [["SP", 4, 1, 1000, [50], 1], ["AN", 4, 2, 6], ["FSP", 3, 1, 0, 1], ["AN", 3, 2, 6], ["CA", 3, 4, 0], ["CI", 2], ["AN", 4, 0, 5], ["SP", 1, 0, 512, [4], 1], ["AN", 1, 0, 5], ["AN", 1, 1, 6], ["PR", 1, 0, "auto_unroll_max_step$1024"], ["PR", 3, 0, "auto_unroll_max_step$1024"]]]], "r": [[1.90922e-05], 0, 2.22792, 1708781169], "v": "v0.6"}
{"i": [["[\"softmax_layer\", 512, 1000]", "cuda -keys=cuda,gpu -arch=sm_70 -max_num_threads=1024 -thread_warp_size=32", [-1, 16, 64, 49152, 2147483647, 1024, 8, 32], "", 0, []], [[], [["SP", 4, 1, 1000, [32], 1], ["AN", 4, 2, 6], ["FSP", 3, 1, 0, 1], ["AN", 3, 2, 6], ["CA", 3, 4, 0], ["CI", 2], ["AN", 4, 0, 5], ["SP", 1, 0, 512, [1], 1], ["AN", 1, 0, 5], ["AN", 1, 1, 6], ["PR", 1, 0, "auto_unroll_max_step$0"], ["PR", 3, 0, "auto_unroll_max_step$64"]]]], "r": [[2.54357e-05], 0, 2.23776, 1708781170], "v": "v0.6"}
{"i": [["[\"softmax_layer\", 512, 1000]", "cuda -keys=cuda,gpu -arch=sm_70 -max_num_threads=1024 -thread_warp_size=32", [-1, 16, 64, 49152, 2147483647, 1024, 8, 32], "", 0, []], [[], [["SP", 4, 1, 1000, [8], 1], ["AN", 4, 2, 6], ["FSP", 3, 1, 0, 1], ["AN", 3, 2, 6], ["CA", 3, 4, 0], ["CI", 2], ["AN", 4, 0, 5], ["SP", 1, 0, 512, [64], 1], ["AN", 1, 0, 5], ["AN", 1, 1, 6], ["PR", 1, 0, "auto_unroll_max_step$16"], ["PR", 3, 0, "auto_unroll_max_step$16"]]]], "r": [[5.29903e-05], 0, 1.92012, 1708781170], "v": "v0.6"}
{"i": [["[\"softmax_layer\", 512, 1000]", "cuda -keys=cuda,gpu -arch=sm_70 -max_num_threads=1024 -thread_warp_size=32", [-1, 16, 64, 49152, 2147483647, 1024, 8, 32], "", 0, []], [[], [["SP", 4, 1, 1000, [20], 1], ["AN", 4, 2, 6], ["FSP", 3, 1, 0, 1], ["AN", 3, 2, 6], ["CA", 3, 4, 0], ["CI", 2], ["FSP", 1, 1, 0, 1], ["AN", 1, 2, 6], ["CA", 1, 4, 0], ["AN", 4, 0, 5], ["PR", 1, 0, "auto_unroll_max_step$512"], ["PR", 3, 0, "auto_unroll_max_step$16"]]]], "r": [[1.11379e-05], 0, 2.07329, 1708781171], "v": "v0.6"}
{"i": [["[\"softmax_layer\", 512, 1000]", "cuda -keys=cuda,gpu -arch=sm_70 -max_num_threads=1024 -thread_warp_size=32", [-1, 16, 64, 49152, 2147483647, 1024, 8, 32], "", 0, []], [[], [["CI", 2], ["FU", 4, [0, 1]], ["SP", 4, 0, 512000, [64], 1], ["AN", 4, 0, 5], ["AN", 4, 1, 6], ["SP", 3, 0, 512, [64], 1], ["AN", 3, 0, 5], ["AN", 3, 1, 6], ["SP", 1, 0, 512, [32], 1], ["AN", 1, 0, 5], ["AN", 1, 1, 6], ["PR", 1, 0, "auto_unroll_max_step$1024"], ["PR", 3, 0, "auto_unroll_max_step$16"]]]], "r": [[7.64866e-05], 0, 2.11196, 1708781171], "v": "v0.6"}
{"i": [["[\"softmax_layer\", 512, 1000]", "cuda -keys=cuda,gpu -arch=sm_70 -max_num_threads=1024 -thread_warp_size=32", [-1, 16, 64, 49152, 2147483647, 1024, 8, 32], "", 0, []], [[], [["CI", 2], ["SP", 1, 1, 1000, [4], 1], ["AN", 1, 2, 6], ["FU", 4, [0, 1]], ["SP", 4, 0, 512000, [32], 1], ["AN", 4, 0, 5], ["AN", 4, 1, 6], ["SP", 3, 0, 512, [32], 1], ["AN", 3, 0, 5], ["AN", 3, 1, 6], ["AN", 1, 0, 5], ["PR", 1, 0, "auto_unroll_max_step$0"], ["PR", 3, 0, "auto_unroll_max_step$16"]]]], "r": [[6.75413e-05], 0, 1.79986, 1708781171], "v": "v0.6"}
{"i": [["[\"softmax_layer\", 512, 1000]", "cuda -keys=cuda,gpu -arch=sm_70 -max_num_threads=1024 -thread_warp_size=32", [-1, 16, 64, 49152, 2147483647, 1024, 8, 32], "", 0, []], [[], [["SP", 4, 1, 1000, [32], 1], ["AN", 4, 2, 6], ["FSP", 3, 1, 0, 1], ["AN", 3, 2, 6], ["CA", 3, 4, 0], ["CI", 2], ["AN", 4, 0, 5], ["SP", 1, 0, 512, [1], 1], ["AN", 1, 0, 5], ["AN", 1, 1, 6], ["PR", 1, 0, "auto_unroll_max_step$16"], ["PR", 3, 0, "auto_unroll_max_step$512"]]]], "r": [[2.54467e-05], 0, 1.74031, 1708781172], "v": "v0.6"}
{"i": [["[\"softmax_layer\", 512, 1000]", "cuda -keys=cuda,gpu -arch=sm_70 -max_num_threads=1024 -thread_warp_size=32", [-1, 16, 64, 49152, 2147483647, 1024, 8, 32], "", 0, []], [[], [["SP", 4, 1, 1000, [40], 1], ["AN", 4, 2, 6], ["FSP", 3, 1, 0, 1], ["AN", 3, 2, 6], ["CA", 3, 4, 0], ["CI", 2], ["FSP", 1, 1, 0, 1], ["AN", 1, 2, 6], ["CA", 1, 4, 0], ["AN", 4, 0, 5], ["PR", 1, 0, "auto_unroll_max_step$512"], ["PR", 3, 0, "auto_unroll_max_step$64"]]]], "r": [[7.48585e-06], 0, 2.03175, 1708781172], "v": "v0.6"}
{"i": [["[\"softmax_layer\", 512, 1000]", "cuda -keys=cuda,gpu -arch=sm_70 -max_num_threads=1024 -thread_warp_size=32", [-1, 16, 64, 49152, 2147483647, 1024, 8, 32], "", 0, []], [[], [["CI", 2], ["FU", 4, [0, 1]], ["SP", 4, 0, 512000, [64], 1], ["AN", 4, 0, 5], ["AN", 4, 1, 6], ["SP", 3, 0, 512, [2], 1], ["AN", 3, 0, 5], ["AN", 3, 1, 6], ["SP", 1, 0, 512, [32], 1], ["AN", 1, 0, 5], ["AN", 1, 1, 6], ["PR", 1, 0, "auto_unroll_max_step$512"], ["PR", 3, 0, "auto_unroll_max_step$512"]]]], "r": [[6.43048e-05], 0, 1.7597, 1708781172], "v": "v0.6"}
{"i": [["[\"softmax_layer\", 512, 1000]", "cuda -keys=cuda,gpu -arch=sm_70 -max_num_threads=1024 -thread_warp_size=32", [-1, 16, 64, 49152, 2147483647, 1024, 8, 32], "", 0, []], [[], [["CI", 2], ["SP", 1, 1, 1000, [2], 1], ["AN", 1, 2, 6], ["FU", 4, [0, 1]], ["SP", 4, 0, 512000, [1], 1], ["AN", 4, 0, 5], ["AN", 4, 1, 6], ["SP", 3, 0, 512, [32], 1], ["AN", 3, 0, 5], ["AN", 3, 1, 6], ["AN", 1, 0, 5], ["PR", 1, 0, "auto_unroll_max_step$0"], ["PR", 3, 0, "auto_unroll_max_step$512"]]]], "r": [[0.000769432], 0, 1.62197, 1708781173], "v": "v0.6"}
{"i": [["[\"softmax_layer\", 512, 1000]", "cuda -keys=cuda,gpu -arch=sm_70 -max_num_threads=1024 -thread_warp_size=32", [-1, 16, 64, 49152, 2147483647, 1024, 8, 32], "", 0, []], [[], [["SP", 4, 1, 1000, [1], 1], ["AN", 4, 2, 6], ["FSP", 3, 1, 0, 1], ["AN", 3, 2, 6], ["CA", 3, 4, 0], ["CI", 2], ["AN", 4, 0, 5], ["SP", 1, 0, 512, [32], 1], ["AN", 1, 0, 5], ["AN", 1, 1, 6], ["PR", 1, 0, "auto_unroll_max_step$64"], ["PR", 3, 0, "auto_unroll_max_step$16"]]]], "r": [[0.000179917], 0, 1.76028, 1708781173], "v": "v0.6"}
{"i": [["[\"softmax_layer\", 512, 1000]", "cuda -keys=cuda,gpu -arch=sm_70 -max_num_threads=1024 -thread_warp_size=32", [-1, 16, 64, 49152, 2147483647, 1024, 8, 32], "", 0, []], [[], [["SP", 4, 1, 1000, [32], 1], ["AN", 4, 2, 6], ["FSP", 3, 1, 0, 1], ["AN", 3, 2, 6], ["CA", 3, 4, 0], ["CI", 2], ["AN", 4, 0, 5], ["SP", 1, 0, 512, [32], 1], ["AN", 1, 0, 5], ["AN", 1, 1, 6], ["PR", 1, 0, "auto_unroll_max_step$1024"], ["PR", 3, 0, "auto_unroll_max_step$0"]]]], "r": [[3.86384e-05], 0, 1.76029, 1708781173], "v": "v0.6"}
{"i": [["[\"softmax_layer\", 512, 1000]", "cuda -keys=cuda,gpu -arch=sm_70 -max_num_threads=1024 -thread_warp_size=32", [-1, 16, 64, 49152, 2147483647, 1024, 8, 32], "", 0, []], [[], [["CI", 2], ["SP", 1, 1, 1000, [2], 1], ["AN", 1, 2, 6], ["FU", 4, [0, 1]], ["SP", 4, 0, 512000, [32], 1], ["AN", 4, 0, 5], ["AN", 4, 1, 6], ["SP", 3, 0, 512, [32], 1], ["AN", 3, 0, 5], ["AN", 3, 1, 6], ["AN", 1, 0, 5], ["PR", 1, 0, "auto_unroll_max_step$64"], ["PR", 3, 0, "auto_unroll_max_step$1024"]]]], "r": [[6.96203e-05], 0, 1.77, 1708781174], "v": "v0.6"}
{"i": [["[\"softmax_layer\", 512, 1000]", "cuda -keys=cuda,gpu -arch=sm_70 -max_num_threads=1024 -thread_warp_size=32", [-1, 16, 64, 49152, 2147483647, 1024, 8, 32], "", 0, []], [[], [["SP", 4, 1, 1000, [10], 1], ["AN", 4, 2, 6], ["FSP", 3, 1, 0, 1], ["AN", 3, 2, 6], ["CA", 3, 4, 0], ["CI", 2], ["FSP", 1, 1, 0, 1], ["AN", 1, 2, 6], ["CA", 1, 4, 0], ["AN", 4, 0, 5], ["PR", 1, 0, "auto_unroll_max_step$16"], ["PR", 3, 0, "auto_unroll_max_step$16"]]]], "r": [[1.91948e-05], 0, 1.86094, 1708781174], "v": "v0.6"}
{"i": [["[\"softmax_layer\", 512, 1000]", "cuda -keys=cuda,gpu -arch=sm_70 -max_num_threads=1024 -thread_warp_size=32", [-1, 16, 64, 49152, 2147483647, 1024, 8, 32], "", 0, []], [[], [["SP", 4, 1, 1000, [40], 1], ["AN", 4, 2, 6], ["FSP", 3, 1, 0, 1], ["AN", 3, 2, 6], ["CA", 3, 4, 0], ["CI", 2], ["FSP", 1, 1, 0, 1], ["AN", 1, 2, 6], ["CA", 1, 4, 0], ["AN", 4, 0, 5], ["PR", 1, 0, "auto_unroll_max_step$1024"], ["PR", 3, 0, "auto_unroll_max_step$512"]]]], "r": [[7.47866e-06], 0, 1.99586, 1708781174], "v": "v0.6"}
{"i": [["[\"softmax_layer\", 512, 1000]", "cuda -keys=cuda,gpu -arch=sm_70 -max_num_threads=1024 -thread_warp_size=32", [-1, 16, 64, 49152, 2147483647, 1024, 8, 32], "", 0, []], [[], [["CI", 2], ["SP", 1, 1, 1000, [2], 1], ["AN", 1, 2, 6], ["FU", 4, [0, 1]], ["SP", 4, 0, 512000, [8], 1], ["AN", 4, 0, 5], ["AN", 4, 1, 6], ["SP", 3, 0, 512, [32], 1], ["AN", 3, 0, 5], ["AN", 3, 1, 6], ["AN", 1, 0, 5], ["PR", 1, 0, "auto_unroll_max_step$64"], ["PR", 3, 0, "auto_unroll_max_step$64"]]]], "r": [[0.00013732], 0, 1.71698, 1708781175], "v": "v0.6"}
{"i": [["[\"softmax_layer\", 512, 1000]", "cuda -keys=cuda,gpu -arch=sm_70 -max_num_threads=1024 -thread_warp_size=32", [-1, 16, 64, 49152, 2147483647, 1024, 8, 32], "", 0, []], [[], [["CI", 2], ["FU", 4, [0, 1]], ["SP", 4, 0, 512000, [32], 1], ["AN", 4, 0, 5], ["AN", 4, 1, 6], ["SP", 3, 0, 512, [32], 1], ["AN", 3, 0, 5], ["AN", 3, 1, 6], ["SP", 1, 0, 512, [64], 1], ["AN", 1, 0, 5], ["AN", 1, 1, 6], ["PR", 1, 0, "auto_unroll_max_step$512"], ["PR", 3, 0, "auto_unroll_max_step$512"]]]], "r": [[9.07081e-05], 0, 2.0039, 1708781175], "v": "v0.6"}
{"i": [["[\"softmax_layer\", 512, 1000]", "cuda -keys=cuda,gpu -arch=sm_70 -max_num_threads=1024 -thread_warp_size=32", [-1, 16, 64, 49152, 2147483647, 1024, 8, 32], "", 0, []], [[], [["SP", 4, 1, 1000, [1], 1], ["AN", 4, 2, 6], ["FSP", 3, 1, 0, 1], ["AN", 3, 2, 6], ["CA", 3, 4, 0], ["CI", 2], ["AN", 4, 0, 5], ["SP", 1, 0, 512, [16], 1], ["AN", 1, 0, 5], ["AN", 1, 1, 6], ["PR", 1, 0, "auto_unroll_max_step$16"], ["PR", 3, 0, "auto_unroll_max_step$1024"]]]], "r": [[0.000167164], 0, 5.47669, 1708781175], "v": "v0.6"}
